"KG06";"Supporting the Analysis of Clones in Software Systems: A Case Study";107;1582029620588;
"CP06";"Verifying Feature-Based Model Templates Against Well-Formedness OCL Constraints";275;1580239750458;
"KV06";"Towards Type Safety of Aspect-Oriented Languages";5;1584971304263;
"AWLF06";"Proof General in Eclipse: System and Architecture Overview";11;1582030701866;
"B06";"A Very Mathematical Dilemma";9;1584974548725;
"CKK06";"Feature Models are Views on Ontologies";199;1584975631062;
"TBRCST06";"Explanations for Agile Feature Models";30;1580240833699;
"BRCTS06";"A Survey on the Automated Analyses of Feture Models";0;1580246119591;
"BBRC06";"Automated Analyses of Feature Models: Challenges Ahead";286;1582031783763;
"AGMKBdL06";"Refactoring Product Lines";205;1584976712000;
"BSTRC06";"A First Step Towards a Framework for the Automated Analysis of Feature Models";100;1580404748526;
"YGM:SEAS06";"Assessing Merge Potential of Existing Engine Control Systems into a Product Line";23;1584977794368;
"GHM+:IBMSJ05";"The Eclipse 3.0 Platform: Adopting OSGi Technology";146;1582032865589;
"YMKI:PROFES05";"Measuring Similarity of Large Software Systems Based on Source Code Correspondence";79;1580405829531;
"CK:CASSIS04";"ESCJava2: Uniting ESCJava and JML";361;1582033946791;
"C05";"A Design Discipline and Language Features for Modular Reasoning in Aspect-Oriented Programs";44;1584978876541;
"ACV+:ICSM05";"Comparative Analysis of Porting Strategies in J2ME Games";33;1584979958402;
"AMC+:SPLC05";"Extracting and Evolving Mobile Games Product Lines";139;1584982121611;
"A:ECOOP05";"Open Modules: Modular Reasoning About Advice";305;1582035027975;
"BEM:RISE05";"Can Aspects Implement Contracts";33;1584983203564;
"DNS:JACM05";"Simplify: A Theorem Prover for Program Checking";910;1582036108790;
"SGB05";"A Taxonomy of Variability Realization Techniques: Research Articles";576;1582037190610;
"BDN:OOPSLA05";"ClassboxJ: Controlling the Scope of Change in Java";149;1582038272101;
"KM:ICSE05";"Aspect-Oriented Programming and Modular Reasoning";397;1580406911821;
"BL:PASTE05";"Weakest-Precondition of Unstructured Programs";269;1582215690433;
"H:AUSE05";"Fundamental Nonmodularity in Electronic Mail";40;1582216773488;
"CKLP:FMCO05";"Beyond Assertions: Advanced Specification and Verification with JML and ESCJava2";282;1582039352805;
"BCC+05";"An Overview of JML Tools and Applications";808;1582217859030;
"LKF:AUSE05";"Modular Verification of Open Features Using Three-Valued Model Checking";60;1582218942863;
"CA:GPCE05";"Mapping Features to Models: A Template Approach Based on Superimposed Variants";699;1582040434779;
"LS05";"Extending Design by Contract for Aspect-Oriented Programming";19;1582220026231;
"FK:VSTTE05";"Decomposing Verification Around End-User Features";20;1582221122822;
"ALRS05";"FeatureC++: On the Symbiosis of Feature-Oriented and Aspect-Oriented Programming";232;1582041516027;
"W05";"Formalization and Type-Soundness Proof for Featherweight Java in Coq";-2;1580407993129;
"JavaSpec";"The Java Language Specification, Third Edition";-2;1580409074335;
"PBL05";"Software Product Line Engineering: Foundations, Principles and Techniques";4256;1582042597366;
"T05";"Enabling the Smooth Integration of Core Assets: Defining and Packaging Architectural Rules for a Family of Embedded Products";15;1582043679040;
"BSTRC05";"Using Java CSP Solvers in the Automated Analyses of Feature Models";92;1582231309219;
"KC05";"Synchronizing Cardinality-Based Feature Models and Their Specializations";60;1582265331305;
"CHE05b";"Staged Configuration through Specialization and Multi-Level Configuration of Feature Models";593;1582266412735;
"WLSZP05";"A Semantic Web Approach to Feature Modeling and Verification";113;1582270739427;
"CHE05a";"Formalizing Cardinality-Based Feature Models and Their Specialization";757;1582273985565;
"CK05";"Cardinality-Based Feature Modeling and Constraints: A Progress Report";334;1582044761653;
"BTRC05";"Using Constraint Programming to Reason on Feature Models";106;1580410157287;
"useBTRC05";"Automated Reasoning on Feature Models";779;1580411238938;
"SZLW05";"Formal Semantics and Verification for Feature Modeling";185;1582819242214;
"B05";"Feature Models, Grammars, and Propositional Formulas";1406;1582820323552;
"LAMS05";"Tool Support for Feature-Oriented Software Development - FeatureIDE: An Eclipse-Based Approach";71;1582045843810;
"HSJ+04";"Fast Backtrack-Free Product Configuration using a Precompiled Solution Space Representation";120;1584396613779;
"PH:Interfaces04";"Linking Product Variety to Order-Fulfillment Strategies";272;1582046924980;
"TBG:VLHCC04";"Managing Duplicated Code with Linked Editing";214;1582052328347;
"MPY+:ICSE04";"Skoll: Distributed Continuous Quality Assurance";128;1582053410786;
"GLRW:ICSR04";"Towards Generating Acceptance Tests for Product Lines";42;1582288044424;
"DL:HASE04";"Software Fault Tree Analysis for Product Lines";69;1582295615926;
"DHT:IST04";"Verifying Haskell Programs by Combining Testing, Model Checking and Interactive Theorem Proving";30;1582821404687;
"M:STVR04";"Search-Based Software Test Data Generation: A Survey: Research Articles";-2;1582054492565;
"P:SoSyM04";"Plug-and-Play Composition of Features and Feature Interactions with Statechart Diagrams";54;1582822486338;
"BFKH:ASE04";"Parameterized Interfaces for Open System Verification of Product Lines";40;1582920619195;
"HP04";"Finding Bugs is Easy";1059;1582921314589;
"KWA:TSE04";"Software Fault Interactions and Implications for Software Testing";778;1582922104634;
"SK:EIWAS04";"PCDiff: Attacking the Fragile Pointcut Problem";195;1582055574153;
"KFG:FSE04";"Verifying Aspect Advice Modularly";137;1582931688231;
"MO:FSE04";"Variability Management with Feature-Oriented Programming and Aspects";302;1582932770065;
"BPS:SCP04";"Variability Management with Feature Models";209;1582933851411;
"TTK04";"Product Family Testing: A Survey";130;1582056656157;
"useLS05";"Cona: Aspects for Contracts and Contracts for Aspects";43;1582057737164;
"AC04";"FeaturePlugin: Feature Modeling Plug-In for Eclipse";356;1582058819240;
"CCHW04";"Eclipse AspectJ: Aspect-Oriented Programming With AspectJ and the Eclipse AspectJ Development Tools";198;1582059901346;
"G04";"A Computer-Checked Proof of the Four Colour Theorem";193;1582934933452;
"SH04";"Experiences Adopting Software Product Line Development without a Product Line Architecture";53;1582936015360;
"BC04";"Interactive Theorem Proving and Program Development - Coq'Art: The Calculus of Inductive Constructions";2163;1582060981872;
"STBMPSF04";"Introducing PLA at Bosch Gasoline Systems: Experiences and Practices";117;1582062063777;
"ZZM04";"A Propositional Logic-Based Method for Verification of Feature Models";170;1582937096885;
"useCHE05b";"Staged Configuration Using Feature Models";637;1582940342484;
"AMS04";"Using a Configurator for Modelling and Configuring Software Product Lines based on Feature Models";46;1582941425223;
"BHST04";"Semantics of Feature Diagrams";-2;1580412321358;
"BSR04";"Scaling Step-Wise Refinement";1163;1580413404107;
"FV:SPE03";"Software Product Line Migration and Deployment";101;1584708837222;
"B:ICSE03";"A Tutorial on Feature-Oriented Programming and Product Lines";70;1583875334705;
"MC:PFE03";"Theorem Proving for Product Line Model Verification";59;1582296698065;
"BG:PFE03";"PLUTO: A Test Methodology for Product Families";103;1582068543560;
"CGMC:ICSE03";"Constructing Test Suites for Interaction Testing";437;1582942506791;
"H:JMLC03";"The Verifying Compiler: A Grand Challenge for Computing Research";441;1582099289459;
"AK03";"Model-Driven Development: A Metamodeling Foundation";1209;1582100370930;
"KM:CONQUEST03";"Challenges in Testing Software Product Lines";-2;1582943588993;
"H:NODe03";"Object Teams: Improving Modularity for Crosscutting Collaborations";200;1582101453474;
"BS03";"Abstract State Machines: A Method for High-Level System Design and Analysis";1456;1582102535638;
"SDNB:ECOOP03";"Traits: Composable Units of Behaviour";500;1582103618323;
"MO:AOSD03";"Conquering Aspects with Caesar";386;1582944671051;
"LG03";"Analysis of a Software Product Line Architecture: An Experience Report";41;1582106237828;
"CKMR03";"Feature Interaction: A Critical Review and Considered Forecast";473;1582107318453;
"ZR03";"Pipa: A Behavioral Interface Specification Language for AspectJ";82;1582108399821;
"B03";"Composition and Construction of Embedded Software Families";61;1582946835163;
"SRP03";"Details of Formalized Relations in Feature Models Using OCL";84;1582947918207;
"CBBHROA03";"Automating Feature-Oriented Domain Analysis";37;1582948999446;
"R03";"Towards a More Precise Definition of Feature Models";135;1582950080962;
"DM:JAIR02";"A Knowledge Compilation Map";676;1582230226986;
"K:SPLC02";"Variation Management for Software Production Lines";182;1583918380824;
"KKI:TSE02";"CCFinder: A Multilinguistic Token-based Code Clone Detection System for Large Scale Source Code";1742;1582109481756;
"M:TSE02";"A State-of-the-Art Survey on Software Merging";620;1582275067819;
"FF:ICFP02";"Contracts for Higher-Order Functions";489;1582951162576;
"ABGM:TSE02";"Using Version Control Data to Evaluate the Impact of Software Tools: A Case Study of the Version Editor";95;1582110564910;
"CK:Software02";"Point  Counterpoint: Being Proactive Pays Off  Eliminating the Adoption Barrier";75;1582111646522;
"CL:FOAL02";"Observers and Assistants: A Proposal for Modular Aspect-Oriented Reasoning";148;1582112727912;
"KLD:Software02";"Feature-Oriented Product Line Engineering";733;1582584971568;
"UT:AOSD02";"Aspect-Oriented Programming with Model Checking";81;1582586054191;
"L02";"Specifying Systems: The TLA+ Language and Tools for Hardware and Software Engineers";1462;1582113809112;
"FLL+:PLDI02";"Extended Static Checking for Java";1704;1582620333612;
"NWP02";"IsabelleHOL: A Proof Assistant for Higher-Order Logic";3636;1582114889496;
"SB02";"Mixin Layers: An Object-Oriented Implementation Technique for Refinements and Collaboration-Based Designs";408;1582115969985;
"LKF02";"Verifying Cross-Cutting Features as Open Systems";103;1582621415708;
"K:PFE02";"Easing the Transition to Software Mass Customization";399;1582622497379;
"APB:SCAM02";"Handling Preprocessor-Conditioned Declarations";43;1582623578824;
"B02";"Test Driven Development: By Example";3350;1582117050806;
"KLD:S02";"Feature-Oriented Product Line Engineering";733;1582624660450;
"SS:TOSEM02";"Behavior-Consistent Specialization of Object Life Cycles";130;1582625741225;
"SP02";"Aspect-Oriented Programming with C and .NET";73;1582626822906;
"SGSP02";"AspectC++: An Aspect-Oriented Extension to the C++ Programming Language";468;1582118133252;
"LKF:ASE02";"Interfaces for Modular Feature Verification";52;1582627904675;
"K02";"AspectC: An AOSD implementation for C";66;1582119215305;
"NPW02";"IsabelleHOL - A Proof Assistant for Higher-Order Logic";3644;1582628987500;
"P02";"Types and Programming Languages";3126;1582630068953;
"vDK02";"Domain-Specific Language Design Requires Feature Descriptions";370;1582952245429;
"RBSP02";"Extending Feature Diagrams with UML Multiplicities";287;1582953328437;
"BLHM02";"Generating Product-Lines of Product-Families";107;1582954410142;
"dJV02";"Grammars as Feature Diagrams";42;1582955492660;
"M02";"Using First-Order Logic for Product Line Model Validation";304;1582956575513;
"SBF:IJPE01";"Mass Customization: Literature Review and Research Directions";1727;1582120296376;
"C:APSEC01";"Applying mutation analysis for object-oriented programs using a reflective approach";62;1582957656770;
"RUCH:TSE01";"Prioritizing Test Cases for Regression Testing";1326;1582958767255;
"MJ01";"Testing a Software Product Line";225;1582959849911;
"FLF:ESECFSE01";"Behavioral Contracts and Behavioral Subtyping";98;1583081940555;
"NCA:REFLECTION01";"Supporting Formal Verification of Crosscutting Concerns";29;1583082001571;
"B2001";"Software Product Lines: Organizational Alternatives";143;1582121377603;
"FL:FME01";"Houdini, an Annotation Assistant for ESCJava";429;1583230519285;
"LB:GCSE01";"A Standard Problem for Evaluating Product-Line Methodologies";222;1583231600852;
"PR01";"Feature Integration Using a Feature Construct";138;1583232684460;
"CN01";"Software Product Lines: Practices and Patterns";5057;1582122459676;
"Sch01";"Automated Theorem Proving in Software Engineering";133;1583233765953;
"FK01";"Modular Verification of Collaboration-Based Software Designs";106;1583234846892;
"KHHKPG01";"An Overview of AspectJ";4197;1583235928023;
"AG01";"Implementing Product Line Variabilities";334;1583237010067;
"IPW01";"Featherweight Java: A Minimal Core Calculus for Java and GJ";1062;1582123542199;
"vGBS01";"On the Notion of Variability in Software Product Lines";770;1583238092672;
"S01";"User Interface Design for Programmers";175;1580414486108;
"DWMB:JOM00";"Approaches to Mass Customization: Configurations and Empirical Validation";1028;1582124622915;
"CR:IWPC00";"Case Study of Feature Location Using Dependence Graph";316;1582939260415;
"H:FSE00";"Testing: A Roadmap";541;1582125704360;
"EMR:SEN00";"Prioritizing Test Cases for Regression Testing";1324;1582276148505;
"OLKM00";"The Koala Component Model for Consumer Electronics Software";1000;1582277230188;
"HP:STTT00";"Model Checking Java Programs Using Java PathFinder";979;1582278311028;
"VHBP:ASE00";"Model Checking Programs";1778;1582279393149;
"HA:FSE00";"Composing Features and Resolving Interactions";83;1582280475462;
"BCS:SPLC00";"Object-Oriented Frameworks and Product Lines";138;1582281557427;
"KPRS:GCSE00";"Aspect Composition Applying the Design by Contract Principle";69;1580415566623;
"B00";"A Run-time Assertion Checker for Java Using JML";45;1582282638688;
"SB00";"Issues Concerning Variability in Software Product Lines";102;1582283720312;
"CE00";"Generative Programming: Methods, Tools, and Applications";4561;1582126786117;
"F00";"Refactoring: Improving the Design of Existing Code";56;1582127867042;
"GK:XPS99";"Knowledge-Based Configuration: Survey and Future Directions";136;1582197082779;
"Binder99";"Testing Object-oriented Systems: Models, Patterns, and Tools";2260;1582128948647;
"BFK+:SSR99";"PuLSE: A Methodology to Develop Software Product Lines";583;1582130030456;
"CCGR:CAV99";"NuSMV: A New Symbolic Model Verifier";802;1582131111439;
"TOHS:ICSE99";"N Degrees of Separation: Multi-Dimensional Separation of Concerns";1948;1582132192678;
"CGP99";"Model Checking";-2;1582285881326;
"PMDL99";"Extending Software Quality Assessment Techniques to Java Systems";82;1582286962631;
"IPW99";"Featherweight Java: A Minimal Core Calculus for Java and GJ";1062;1582134356565;
"HK:JR98";"Variety for Sale: Mass Customization or Mass Confusion";1173;1582135437718;
"JZ:TSE98";"Distributed feature composition: a virtual architecture for telecommunications services";311;1582136520467;
"K:TOOLS98";"iContract - The Java(Tm) Design by Contract(Tm) Tool";-2;1580416649062;
"KC98";"JPP: A Java Pre-Processor";17;1582137603216;
"BCK98";"Software Architecture in Practice";8829;1583264058809;
"L:OOPSLA98";"Data Groups: Specifying the Modification of Extended State";207;1582138685513;
"CW:CSUR98";"Version Models for Software Configuration Management";934;1583265141632;
"BM:ICSE98";"Conceptual Module Querying for Software Reengineering";67;1583266223970;
"TWFL:IWSSD98";"Feature Engineering";58;1583267306542;
"ML:OOPSLA98";"Adaptive Plug-and-Play Components for Evolutionary Software Development";279;1583268387574;
"FKF:POPL98";"Classes and Mixins";549;1583269469938;
"SB:ECOOP98";"Implementing Layered Designs with Mixin Layers";380;1583270552571;
"GFA98";"Integrating Feature Modeling with the RSEB";855;1583271634626;
"KKLKKS98";"FORM: A Feature-Oriented Reuse Method with Domain-Specific Reference Architectures";1465;1582139767675;
"H:TSE97";"The Model Checker SPIN";4991;1583272716563;
"N97";"Proof-Carrying Code";2536;1580417730389;
"JM97";"Design by Contract: The Lessons of Ariane";351;1582140849465;
"M97";"Advanced Compiler Design and Implementation";3886;1580418811818;
"C97";"Type Systems";604;1583273798914;
"P97";"Feature-Oriented Programming: A Fresh Look at Objects";570;1582141931080;
"KLMMLLI97";"Aspect-Oriented Programming";9796;1583275963179;
"AS96";"Structure and Interpretation of Computer Programs";3176;1583278126120;
"ORR+:CAV96";"PVS: Combining Specification, Proof Checking, and Model Checking";649;1582143011728;
"AF96";"The New Statistical Analysis of Data";260;1580419893640;
"A96";"The B-Book: Assigning Programs to Meanings";4824;1582144093648;
"JSHS96";"TROLL: A Language for Object-Oriented Specification of Information Systems";165;1582145175921;
"VN:OOPSLA96";"Using Role Components in Implement Collaboration-Based Designs";302;1583279207466;
"DL96";"Forcing Behavioral Subtyping through Specification Inheritance";268;1583280289240;
"MLM96";"Experiment on the Automatic Detection of Function Clones in a Software System Using Metrics";639;1583282453763;
"MMC:OOPSLA95";"Towards a Methodology for Explicit Composition of MetaObjects";93;1583283535111;
"BR95";"A Mathematical Definition of Full Prolog";133;1580420975900;
"NT95";"Object-Oriented Software Composition";294;1583284617663;
"GHJV95";"Design Patterns: Elements of Reusable Object-Oriented Software";-2;1582146257846;
"B95";"On Finding Duplication and Near-Duplication in Large Software Systems";910;1583285698971;
"LW:TOPLAS94";"A Behavioral Notion of Subtyping";1561;1583286781480;
"N94";"Usability Engineering";20927;1583287862709;
"WF94";"A Syntactic Approach to Type Soundness";1362;1583288944279;
"BMW:ICSE93";"The Concept Assignment Problem in Program Understanding";441;1582938178827;
"R93";"Raise Method Manual";-2;1583290027101;
"BR93";"A Formal Specification of PARLOG";20;1583308181643;
"HO:OOPSLA93";"Subject-Oriented Programming: A Critique of Pure Objects";1118;1582147340660;
"J93";"Identifying Redundancy in Source Code Using Fingerprints";364;1583309264070;
"CDK93";"A Unified Approach for Showing Language Containment and Equivalence Between Various Types of $omega$-Automata";43;1583310346223;
"SC:USENIX92";"ifdef Considered Harmful, or Portability Experience With C News";236;1583919462661;
"W92";"Specification in Fresco";35;1583311427605;
"ORS:CADE92";"PVS: A Prototype Verification System";2147;1582148423098;
"H:ECOOP92";"Specifying Reusable Components Using Contracts";209;1583312509975;
"M92";"Applying Design by Contract";2946;1583399919639;
"C:ECOOP91";"Inheritance in Object-Oriented Z";76;1583401001670;
"A:FOOL91";"Designing an Object-Oriented Programming Language with Behavioural Subtyping";360;1583402083239;
"HV91";"Model Checking vs. Theorem Proving: A Manifesto";290;1582149505665;
"BC:ECOOP90";"Mixin-Based Inheritance";1140;1583403164173;
"HHG:ECOOP90";"Contracts: Specifying Behavioral Compositions in Object-Oriented Systems";813;1582180373507;
"B:Van90";"Software Testing Techniques";81;1583404245650;
"J90";"Systematic Software Development Using VDM";3768;1583405327592;
"KCHNP90";"Feature-Oriented Domain Analysis (FODA) Feasibility Study";4890;1583406408755;
"RDH+:PU89";"Design Of Mutant Operators For The C Programming Language";335;1583407489332;
"C:MOR79";"A Greedy Heuristic for the Set-Covering Problem";2769;1582298860256;
"BDC+:SETSS89";"The Feature Interaction Problem in Telecommunications Systems";209;1580422056652;
"MF89";"Towards a Generic Model of Configuration Tasks";668;1582299942613;
"S88";"Understanding Z: A Specification Language and Its Formal Semantics";1120;1582181456919;
"M88";"Object-Oriented Software Construction";10392;1580423137960;
"D87";"Future Perfect";1673;1582182540123;
"Z87";"A Framework for Information Systems Architecture";4402;1580424218976;
"LG86";"Abstraction and Specification in Program Development";903;1580425301910;
"D86";"Checking C Programs with Lint";71;1580426384757;
"S85";"The Limits of Correctness";80;1582193838543;
"SE84";"Empirical Studies of Programming Knowledge";1013;1582194919919;
"T83";"On the Complexity of Derivation in Propositional Calculus";1826;1584355504038;
"S83";"Algorithms";-2;1582198164821;
"G81";"The Science of Programming";2477;1583408570914;
"W:ICSE81";"Program Slicing";4879;1583409651299;
"S81";"Independent Predicates";7;1583410732019;
"P:ICSE78";"Designing Software for Ease of Extension and Contraction";1205;1583411813899;
"CC:POPL77";"Abstract Interpretation: A Unified Lattice Model for Static Analysis of Programs by Construction or Approximation of Fixpoints";7627;1582183621763;
"D76";"A Discipline of Programming";7645;1583412895814;
"P76";"On the Design and Development of Program Families";1255;1583413977364;
"K76";"Symbolic Execution and Program Testing";3110;1582199246045;
"D75";"Guarded Commands, Nondeterminacy and Formal Derivation of Programs";2612;1583415058878;
"LZ74";"Programming with Abstract Data Types";1160;1583416140295;
"D72";"Chapter I: Notes on Structured Programming";-2;1582184703984;
"H72";"Proof of Correctness of Data Representations";1628;1583417222357;
"P72";"On the Criteria to be used in Decomposing Systems into Modules";6682;1583418303420;
"W71";"Program Development by Stepwise Refinement";1934;1582200326930;
"H69";"An Axiomatic Basis for Computer Programming";7744;1583419385271;
"I68";"Mass Produced Software Components";1745;1583420467370;
"D68";"Go To Statement Considered Harmful";28;1582201407764;
"F67";"Assigning Meanings to Programs";3636;1583421548818;
"H:BST50";"Error detecting and error correcting codes";6112;1582297779234;
"T49";"Checking a Large Routine";394;1583422631042;
"F1879";"Begriffsschrift, eine der arithmetischen nachgebildete Formelsprache des reinen Denkens";-2;1583423712790;
"KMSL:CDT83";"CONIC: An Integrated Approach to Distributed Computer Control Systems";168;1582186867620;
"spl-strategies";"Analysis Strategies for Software Product Lines";81;1583424793336;
"cpp";"The C Preprocessor";37;1582202490320;
"antenna";"Antenna: An Ant-to-End Solution For Wireless Java";-2;1582187348514;
"munge";"Munge: A Purposely-Simple Java Preprocessor";-2;1582188429924;
"useFM07";"Why: A Software Verification Platform";-2;1582189512109;
"sat4j";"SAT4J: A Satisfiability Library for Java";33;1582190593394;
"homogeneous";"An Homogeneous Feature-Based Approach";-2;1582203571739;
"gears";"Gears: A Software Product Line Engineering Tool";-2;1582191675264;
"pure-variants";"pure::variants";-2;1582192757590;
"cdl3";"The eCos Component Writer's Guide";32;1580112505779;
"cdl";"The eCos Component Writer's Guide";32;1583425874801;
"LinuxKernelConf";"LinuxKernelConf Documentation";-2;1582204652146;
"kconfig";"KConfig Language";-2;1584372812896;
"AHEAD";"AHEAD Tool Suite";-2;1583426955803;
"Coq:mailinglist";"The Coq Mailing List";-2;1582212229408;
"Coq:website";"The Coq Proof Assistant";-2;1582213312261;
"Coq:manual";"The Coq Proof Assistant Reference Manual";87;1582214606745;
"JML:manual";"JML Reference Manual";244;1583447848748;
