"KMKB:ESECFSE13";"SPLat Lightweight Dynamic Analysis for Reducing Combinatorics in Testing Configurable Systems";38;1534760795476;
"DDJS13";"Verifying Traits An Incremental Proof System for Fine-Grained Reuse";12;1534761876794;
"PGT+:SPLC13";"Coevolution of Variability Models and Related Artifacts A Case Study from the Linux Kernel";43;1534762958605;
"RLK+13";"Quantifying the Effects of Aspectual Decompositions on Design by Contract Modularization A Maintenance Study";6;1534764041182;
"BMB+:PLDI13";"SPLLIFT Statically Analyzing Software Product Lines in Minutes Instead of Years";68;1534765123609;
"HTH13";"Separation of Concerns in Feature Diagram Languages A Systematic Survey";23;1534766204767;
"SK:JUCS13";"Modeling and Verification of Reconfigurable Actor Families";6;1534767287073;
"SK:FSEN13";"Delta Modeling and Model Checking of Product Families";10;1534768368072;
"I13";"Methodology for the Derivation of Product Behaviour in a Software Product Line";7;1534769449481;
"HB:FHIES13";"Enhancing Product Line Development by Safety Requirements and Verification";6;1534770530624;
"FKA+:EMSE13";"Do Background Colors Improve Program Comprehension in the Ifdef Hell";76;1534883638299;
"RCC:SPLC13";"Managing Cloned Variants A Framework and Experience";80;1534771612940;
"D13";"Feature Modularity in Mechanized Reasoning";0;1535525837786;
"SST:MultiPLE13";"Towards Modular Analysis of Multi Product Lines";25;1534140239766;
"ABKS13";"Feature-Oriented Software Product Lines Concepts and Implementation";-2;1535526918734;
"useRLB+:AOSD14";"AspectJML Modular Specification and Runtime Checking for Crosscutting Contracts";12;1535528001273;
"PB13";"Separation Logic for Object-Oriented Programming";9;1534141321710;
"BLP:FMSPLE13";"Combining Declarative and Procedural Views in the Specification and Analysis of Product Families";34;1534142405122;
"useBLP:FMSPLE13";"Combining Declarative and Procedural Views in the Feature-Oriented Specification and Analysis of Product Families";0;1535529161807;
"BRT+13";"Intraprocedural Dataflow Analysis for Software Product Lines";53;1534143488606;
"CCS+13";"Featured Transition Systems Foundations for Verifying Variability-Intensive Systems and Their Application to LTL Model Checking";144;1534144572298;
"W13";"Methoden-basierte Komposition von Kontrakten in Feature-orientierter Programmierung";-2;1534145653633;
"LLKK:ICSR13";"Validating Consistency between a Feature Model and Its Implementation";17;1534146735789;
"CCH+:SPLC13";"ProVeLines A Product Line of Verifiers for Software Product Lines";50;1534147817751;
"HSB:CADE13";"Reuse in Software Verification by Abstract Method Calls";19;1534151063167;
"WHSS:MAPLESCALE13";"Interface Variability in Family Model Mining";29;1534152145461;
"SSA:FMSPLE13";"Variability-Aware Safety Analysis Using Delta Component Fault Diagrams";8;1534153226677;
"LC:SCP13";"A Systematic Mapping Study on Software Product Line Evolution From Legacy System Reengineering to Product Line Refactoring";77;1534154309297;
"CCH+:ASAS13";"Model Checking Adaptive Software with Featured Transition Systems";36;1534155392304;
"CSHL:ICSE13";"Beyond Boolean Product-Line Model Checking Dealing with Feature Attributes and Multi-Features";66;1534156474944;
"ARTK13";"Feature-Interaction Detection Based on Feature-Based Specifications";49;1534157556889;
"T:ISSTA13";"Product-Line Verification with Feature-Oriented Contracts";4;1534158638507;
"TAZ+:MASPEGHI13";"Subclack Feature-Oriented Programming with Behavioral Feature Interfaces";11;1534159720699;
"HLC:ICSE13";"Efficient Quality Assurance of Variability-Intensive Systems";1;1535534468003;
"RLL+:FOAL13";"Modular Aspect-Oriented Design Rule Enforcement with XPIDRs";11;1534160802388;
"C13";"Test Case-Aware Combinatorial Interaction Testing";19;1534161884980;
"PFP+:ICSE13";"What Good Are Strong Specifications";39;1534162966910;
"DOS:POPL13";"Meta-Theory a la Carte";38;1535535550049;
"RC:ICSE13";"A Framework for Managing Cloned Product Variants";40;1534164048836;
"EW:GTTSE13";"Variation Programming with the Choice Calculus";20;1534165130067;
"EORW:VaMoS13";"Adding Configuration to the Choice Calculus";5;1534166212710;
"BM13";"C4J Contracts, Java und Eclipse";-2;1535536632021;
"GBS13";"ReFlO An Interactive Tool for Pipe-And-Filter Domain Specification and Program Generation";9;1534167294972;
"ARW+:ICSE13";"Strategies for Product-Line Verification Case Studies and Experiments";127;1534168377626;
"AKL13";"Language-Independent and Automated Software Composition The FeatureHouse Experience";95;1535537714756;
"STSS:VaMoS13";"Automated Analysis of Dependent Feature Models";15;1535538795079;
"RAK+:VaMoS13";"The PLA Model On the Combination of Product-Line Analyses";38;1535539876156;
"SKK+:ICSE12";"Predicting Performance via Automated Feature-Interaction Detection";128;1535454638299;
"SRK+:SQJ12";"SPL Conqueror Toward Optimization of Non-functional Properties in Software Product Lines";108;1535449229051;
"MGSH:SPLC13";"Practical Pairwise Testing for Software Product Lines";30;1535738355081;
"NNP+:TSE12";"Clone Management for Evolving Software";98;1532778452633;
"HRGL:SPLC12";"Using Regression Testing to Analyze the Impact of Changes to Variability Models on Products";21;1536248209313;
"ALL:ASE12";"Structured Merge with Auto-Tuning Balancing Precision and Performance";31;1534772695894;
"ZFSZ:CSMR12";"Feature Identification from the Source Code of Product Variants";79;1534773778158;
"DGK+:ICST12";"An Empirical Study of Pre-Release Software Faults in an Industrial Product Line";12;1535540958843;
"YH:STVR12";"Regression Testing Minimization, Selection and Prioritization A Survey";878;1535542040448;
"HZDK:ICSM12";"Recovering Commit Dependencies for Selective Code Integration in Software Product Lines";7;1535543122749;
"BEG:CASCON12";"Grammar-based Test Generation for Software Product Line Feature Models";17;1535544203291;
"AHC+:CAiSE12";"Feature Model Differences";34;1535545284455;
"SGB+:VaMoS12";"BeTTy Benchmarking and Testing on the Automated Analysis of Feature Models";85;1535546366190;
"TSD+:OOPSLA12";"Gradual Typing for First-Class Classes";51;1536264586455;
"MJ:FOAL12";"Design by Contract for Aspects, by Aspects";2;1536265667535;
"HFA+12";"Exemplar Driven Development of Software Product Lines";5;1536266750643;
"EBG:CAiSE12";"Evolutionary Search-Based Test Generation for Software Product Line Feature Models";73;1536267833320;
"CCS+:VaMoS12";"Managing Evolution in Software Product Lines A Model-Checking Perspective";31;1536268915833;
"BGM:SPLC12";"Demonstration of a Model Checker for the Analysis of Product Variability";7;1536305100739;
"GG:PLDI12";"SuperC Parsing All of C by Taming the Preprocessor";68;1536306182258;
"SLW:12";"Multi-Perspectives on Feature Models";38;1536307263308;
"HTGE13";"Managing Emerging Configuration Dependencies in Multi Product Lines";15;1536308345604;
"CMSE:SEN12";"Strategies for Testing Products in Software Product Lines";44;1536309427988;
"LSKL:TAP12";"Incremental Model-Based Testing of Delta-oriented Software Product Lines";75;1536310510032;
"DT+:MISS12";"Understanding Linux Feature Distribution";37;1536311591874;
"MHF:SPLC12";"An Algorithm for Generating T-Wise Covering Arrays from Large Feature Models";150;1536312673756;
"useHPP+:TSE14";"Bypassing the Combinatorial Explosion Using Similarity to Generate and Prioritize T-Wise Test Suites for Large Software Product Lines";29;1534317980716;
"JHF+:MODELS12";"Generating Better Partial Covering Arrays by Modeling Weights on Sub-Product Lines";52;1535462213794;
"POS+:SQJ12";"Pairwise Testing for Software Product Lines Comparison of Two Approaches";117;1536313755878;
"O:PhD12";"Feature Model-Based Software Product Line Testing";10;1536314837811;
"WRH+12";"Experimentation in Software Engineering";5008;1535547447283;
"KS:COORDINATION12";"Using Coordinated Actors to Model Families of Distributed Systems";4;1536315920346;
"ABFG:ISoLA12";"A Compositional Framework to Derive Product Line Behavioural Descriptions";15;1536317001872;
"SJBK:COMPSAC12";"Scheduling and Analysis of Real-Time Software Families";8;1534774860298;
"BMP:SERENE12";"Assume-Guarantee Testing of Evolving Software Product Line Architectures";1;1517562941621;
"PSS:MODIQUITOUS12";"Test Modeling for Context-aware Ubiquitous Applications with Feature Petri Nets";9;1535548530055;
"FKL+:ICPC12";"Measuring Programming Experience";61;1534775941905;
"S12";"Framework for Measuring Program Comprehension";-2;1536181432082;
"RLBC:SPLC12";"Managing Forked Product Variants";39;1534777022406;
"HGR:IST12";"A Systematic Review and an Expert Survey on Capabilities Supporting Multi Product Lines";75;1534778104926;
"JHS:FMCO12";"ABS A Core Language for Abstract Behavioral Specification";268;1534780269133;
"LKL:SPLC12";"A Survey on Software Product Line Testing";58;1534830523407;
"DCP+:ISoLA12";"A Vision for Behavioural Model-Driven Validation of Software Product Lines";16;1535550694516;
"SK:FSEN12";"Efficient Verification of Evolving Software Product Lines";11;1534831605674;
"SLC12";"Towards Fully-Fledged Reverse Inheritance in Eiffel";7;1534832687163;
"CSHL:FMSPLE12";"Towards an Incremental Automata-Based Approach for Software Product-Line Model Checking";20;1534833770468;
"CSHL:SPLC12";"Behavioural Modelling and Verification of Real-Time Software Product Lines";30;1534838149145;
"CCH+12";"Model Checking Software Product Lines with SNIP";75;1534839232021;
"KKB:ISSRE12";"Shared Execution for Efficiently Testing Product Lines";41;1534840314290;
"KRE+:FOSD12";"Toward Variability-Aware Testing";69;1534841395643;
"useCEW:TOPLAS14";"An Error-Tolerant Type System for Variational Lambda Calculus";40;1534842477778;
"HK:WCRE12";"Reverse Engineering Variability in Source Code Using Clone Detection A Case Study for Linux Variants of Consumer Electronic Devices";28;1534843559792;
"TB12";"Entwicklung von Softwarevarianten mit FeatureIDE";-2;1535551775516;
"XXJ:WCRE12";"Feature Location in a Collection of Product Variants";61;1534844641473;
"ACG+:VaMoS12";"On Extracting Feature Models From Product Descriptions";115;1534845722510;
"LSZ12";"Featherweight Jigsaw - Replacing Inheritance by Composition in Java-like Languages";16;1534846804257;
"HS:ISoLA12";"A Liskov Principle for Delta-Oriented Programming";36;1534847885854;
"MAG:WASP12";"Formal Specification and Verification of Well-Formedness in Business Process Product Lines";1;1535552856810;
"JHF+:ICTSS12";"A Technique for Agile and Automatic Interaction Testing for Product Lines";20;1534848968866;
"useMRKN:iFM13";"Compositional Verification of Evolving Software Product Lines";2;1534852213448;
"L12";"Variables Nanodatenmanagement fuer eingebettete Systeme";0;1535553938620;
"B12";"Contract-Aware Feature Composition";8;1534853295123;
"GSCH:RE12";"Efficient Consistency Checking of Scenario-Based Product-Line Specifications";21;1534854376306;
"CCP+:ICSE12";"Simulation-Based Abstractions for Software Product-Line Model Checking";59;1534855461910;
"HJD:ConfWS12";"Unifying Software and Product Configuration A Research Roadmap";0;1535555020874;
"P12";"System Design and Risk Assessment for Safety Critical Control Software Product Lines";1;1534319066255;
"useLKA+:ESECFSE13";"Large-Scale Variability-Aware Type Checking and Dataflow Analysis";12;1534919678376;
"KOE:OOPSLA12";"A Variability-Aware Module System";80;1535556102550;
"useBMB+:PLDI13";"Transparent and Efficient Reuse of IFDS-Based Static Program Analyses for Software Product Lines";0;1535557185127;
"GDS:ICSE12";"Test Confessions A Study of Testing Practices for Plug-in Systems";49;1534920760519;
"HBC+12";"A Code Tagging Approach to Software Product Line Development";16;1534922839978;
"RC:FASE12";"Combining Related Products into Product Lines";88;1534923922617;
"SCRS12";"Mintha A Framework for Auto-Programming and Testing of Railway Controllers for Varying Clients";1;1535558266496;
"HMZ:RAMiCS12";"Foundations of Coloring Algebra with Consequences for Feature-Oriented Programming";3;1534925004553;
"HMZ12";"Foundations of Coloring Algebra with Consequences for Feature-Oriented Programming";3;1534926086854;
"JLM+12";"A Constraint-Based Variability Modeling Framework";28;1534927169288;
"DS:ISoLA12";"Family-Based Analysis of Type Safety for Delta-Oriented Software Product Lines";24;1534928251951;
"BTG12";"A Theory of Software Product Line Refinement";47;1534929333961;
"SRC+12";"Software Diversity State of the Art and Perspectives";102;1534930416560;
"BMS:FM12";"VMC A Tool for Product Variability Analysis";45;1534933661688;
"SCD:FASE12";"Integration Testing of Software Product Lines Using Compositional Symbolic Execution";38;1534934742956;
"HRRS:Monterey12";"Evolving Delta-Oriented Software Product Line Architectures";39;1534964526350;
"BS:FOSD12";"Ensuring Well-Formedness of Configured Domain Models in Model-Driven Product Lines Based on Negative Variability";16;1534965608609;
"FOSD12";"FOSD '12 Proceedings of the 4th International Workshop on Feature-Oriented Software Development";-2;1535559349320;
"HLL+12";"Behavioral Interface Specification Languages";151;1534966689539;
"DDJ+:FMSPLE12";"A Transformational Proof System for Delta-Oriented Programming";25;1534967771898;
"T:MIT12";"Verification of Software Product Lines Using Contracts";3;1534968853032;
"TSAH:GPCE12";"Family-Based Deductive Verification of Software Product Lines";62;1534969935356;
"KATS:TOSEM12";"Type Checking Annotation-Based Product Lines";140;1535560430652;
"B:PLAS12";"Position Paper Static Flow-Sensitive and Context-Sensitive Information-Flow Analysis for Software Product Lines";11;1534971016753;
"useBRT+13";"Intraprocedural Dataflow Analysis for Software Product Lines";54;1534972100470;
"ASL+12";"Access Control in Feature-Oriented Programming";54;1534972164771;
"useTAK+:CSUR";"Analysis Strategies for Software Product Lines";76;1535002357325;
"TLD:OSR12";"Configuration Coverage in the Analysis of Large-Scale System Software";57;1535561512418;
"TSK+:FASE12";"Applying Design by Contract to Feature-Oriented Programming";33;1535003440634;
"STKS:VaMoS12";"Variant-Preserving Refactoring in Feature-Oriented Software Product Lines";62;1535004524000;
"OZLG:SPLC11";"Pairwise Feature-interaction Testing for SPLs Potentials and Limitations";41;1536249291412;
"useXXJ:WCRE12";"Reengineering Legacy Software Products into Software Product Line Based on Automatic Variability Analysis";22;1534851132086;
"ACLF:ASE11";"Slicing Feature Models";57;1535005606063;
"KSL+:Promise11";"Are Change Metrics Good Predictors for an Evolving Software Product Line";26;1535006689799;
"KLG:MSR11";"Empirical Evaluation of Reliability Improvement in an Evolving Software Product Line";15;1535007772660;
"CMN:STVR11";"On the Use of a Similarity Function for Test Case Selection in the Context of Model-Based Testing";66;1535008854784;
"GC:ISSRE11";"Feature Interaction Faults Revisited An Exploratory Study";45;1535009937272;
"AB:ICSE11";"A Practical Guide for Using Statistical Tests to Assess Randomized Algorithms in Software Engineering";477;1535011020502;
"HBG:ISSRE11";"PACOGEN Automatic Generation of Pairwise Test Configurations from Feature Models";64;1535012103494;
"BG:SQJ11";"Assessing the Maintainability of Software Product Line Feature Models Using Structural Metrics";106;1535013186089;
"ALB+:ESECFSE11";"Semistructured Merge Rethinking Merge in Revision Control Systems";60;1535014268712;
"DKB:WCRE11";"Analyzing the Source Code of Multiple Software Variants for Reuse Potential";56;1535015350083;
"Pa11";"Sustainable Evolution of Product Line Infrastructure Code";-2;1536182513214;
"HHJ+:FMCO11";"HATS Abstract Behavioral Specification The Architectural View";18;1535017514198;
"W11";"Deductive Verification of Object-Oriented Software Dynamic Frames, Dynamic Logic, and Predicate Abstraction";52;1535018595991;
"HZS:SCP11";"Statically Safe Program Generation with SafeGen";71;1535019678170;
"HS:TOPLAS11";"Morphing Structurally Shaping a Class by Reflecting on Others";25;1535020761117;
"HHSDA11";"Supporting Multiple Perspectives in Feature-Based Configuration";55;1535021843318;
"EB+:ITNG11";"Goal-Oriented Test Case Selection and Prioritization for Product Line Feature Models";29;1535022926724;
"JHF:MODELS11";"Properties of Realistic Feature Models Make Combinatorial Testing of Product Lines Feasible";76;1535024008357;
"GCD:ESE11";"Evaluating Improvements to a Meta-Heuristic Search for Constrained Interaction Testing";151;1535025089734;
"JH:TSE11";"An Analysis and Survey of the Development of Mutation Testing";1033;1535026171817;
"C:NFM11";"OpenJML JML for Java 7 by Extending OpenJDK";52;1535027254633;
"LWE:VLHCC11";"ifdef Confirmed Harmful Promoting Understandable Software Variation";54;1535028336389;
"FSP+:EASE11";"Using Background Colors to Support Program Comprehension in Software Product Lines";53;1535565839197;
"YYZ+:ESECFSE11";"How Do Fixes Become Bugs";162;1535029418836;
"SK:FACS11";"Reducing the Model Checking Cost of Product Lines Using Static Analysis Techniques";4;1535030500689;
"NL:CSUR11";"A Survey of Combinatorial Testing";459;1535031582407;
"BK:CAV11";"CPAchecker A Tool for Configurable Software Verification";351;1535096376811;
"OWES11";"A Survey of Model-Based Software Product Lines Testing";41;1535097460424;
"LHME:SPLC11";"From Requirements to Features An Exploratory Study of Feature-Oriented Refactoring";27;1535098542379;
"DCI+11";"A Systematic Mapping Study of Software Product Lines Testing";173;1535099624126;
"ALH+:ICSR11";"Supporting Consistency Checking Between Features and Software Product Line Use Scenarios";23;1535100707249;
"KAO:FOSD11";"The Road to Feature Modularity";48;1535101790409;
"EW11";"The Choice Calculus A Representation for Software Variation";119;1535102872007;
"RCL+:FTfJP11";"On the Interplay of Exception Handling and Design by Contract An Aspect-Oriented Recovery Approach";9;1535103953589;
"P11";"Precise Documentation The Key to Better Software";78;1535016432216;
"RQB+:GPCE11";"On the Impact of Feature Dependencies when Maintaining Preprocessor-Based Software Product Lines";32;1535105035695;
"GWW+11";"A Genetic Algorithm for Optimized Feature Selection with Resource Constraints in Software Product Lines";132;1535106117366;
"ABFG:FMOODS11";"A Model-Checking Tool for Families of Services";26;1535108282015;
"TBG:SBES11";"Safe Composition of Configuration Knowledge-Based Software Product Lines";22;1535109364224;
"NTS+:GPCE11";"Investigating the Safe Evolution of Software Product Lines";62;1535110446928;
"GPB:SC11";"Composing Event-B Specifications Case-Study Experience";22;1535111528259;
"ABF+:PLEASE11";"Design and Validation of Variability in Product Lines";14;1535112610375;
"BMP:SERENE11";"Guaranteeing Correct Evolution of Software Product Lines Setting up the Problem";4;1535113693648;
"useABFG:ISoLA12";"Formal Description of Variability in Product Families";89;1535566921720;
"CE:SPLC11";"Optimizing the Product Derivation Process";16;1535114775258;
"KA:GTTSE11";"Feature-Oriented Software Development A Short Tutorial on Feature-Oriented Programming, Virtual Separation of Concerns, and Variability-Aware Analysis";-2;1536183594156;
"TSP+:11";"AutoDaMa On the Feasibility of Secure and Tailor-made Automotive Data Management";-2;1536184675569;
"ASW+:ASE11";"Detection of Feature Interactions Using Feature-Aware Verification";107;1535115857576;
"useASW+:ASE11";"Feature-Aware Verification";-2;1536212306406;
"BKS:FoVeOOS11";"Verification of Software Product Lines with Delta-Oriented Slicing";35;1535116939411;
"KBK:AOSD11";"Reducing Combinatorics in Testing Product Lines";98;1535118022191;
"ACLF:SAC11";"A Domain-Specific Language for Managing Feature Models";38;1535169371783;
"BFL+11";"Specification and Verification The Spec Experience";148;1535170453673;
"ER:IST11";"Software Product Line Testing - A Systematic Mapping Study";253;1535171535944;
"TLSS:EuroSys11";"Feature Consistency in Compile-Time-Configurable System Software Facing the Linux 10,000 Feature Problem";122;1535172618820;
"KGR+:OOPSLA11";"Variability-Aware Parsing in the Presence of Lexical Macros and Conditional Compilation";216;1533144899721;
"DCB:OOPSLA11";"Product Lines of Theorems";34;1533157076014;
"HRRS:MBEES11";"Delta Modeling for Software Architectures";48;1533158158514;
"H11";"Next-Generation Feature Models with Pseudo-Boolean SAT Solvers";4;1533159240151;
"useHS:ISoLA12";"A Liskov Principle for Delta-Oriented Programming";36;1533160323194;
"STAL:FOSD11";"Automatic Detection of Feature Interactions Using the Java Modeling Language An Experience Report";22;1535173698963;
"LBL:AUSE11";"Compositional Model Checking of Software Product Lines Using Variation Point Obligations";58;1535174781555;
"SH11";"Formal Methods in Software Product Line Engineering";44;1533189727299;
"SBD11";"Compositional Type-Checking for Delta-Oriented Programming";63;1533190808794;
"CHSL:ICSE11";"Symbolic Model Checking of Software Product Lines";205;1533193960469;
"SRK+:SPLC11";"Scalable Prediction of Non-functional Properties in Software Product Lines";62;1533195043113;
"TKES:SPLC11";"Abstract Features in Feature Modeling";120;1533196125653;
"RS:ICST11";"Runtime Verification of Linux Kernel Modules Based on Call Interception";24;1533197207038;
"MCHB:VAMOS11";"A Formal Semantics for Feature Cardinalities in Feature Diagrams";43;1533198288724;
"SLBWC:ICSE11";"Reverse Engineering Feature Models";270;1533199371365;
"TSKA:VAST11";"Proof Composition for Deductive Verification of Software Product Lines";44;1533200453073;
"OZML:VaMoS11";"MoSo-PoLiTe - Tool Support for Pairwise and Model-Based Software Product Line Testing";53;1535176946602;
"RSTS:VAMOS11";"Multi-Dimensional Variability Modeling";55;1535178028843;
"MC:SCP10";"Decision-Making Coordination and Efficient Reasoning Techniques for Feature-Based Configuration";63;1534790011361;
"D:SPLC10";"Visualizing and Analyzing Software Variability with Bar Diagrams and Occurrence Matrices";7;1536250373658;
"GKN:SPLC10";"Sans Constraints Feature Diagrams vs. Feature Models";6;1535179110328;
"SF:DLS10";"Contracts for First-Class Classes";26;1535180192894;
"HEB+:FOSD10";"Toolchain-Independent Variant Management with the Leviathan Filesystem";15;1535181275045;
"BMB+:Models10";"Aspect-Oriented Feature Models";18;1535182357855;
"KO:OOPSLA10";"Modular Logic Metaprogramming";9;1535183440378;
"KKHL:FOSD10";"TypeChef Toward Type Checking Ifdef Variability in C";64;1535185604572;
"ABGF:VaMoS10";"A Deontic Logical Framework for Modelling Product Families";25;1535186686748;
"RS:VaMoS10";"Automating the Configuration of Multi Software Product Lines";87;1535189933926;
"HB:ISSRE10";"An Industrial Investigation of Similarity Measures for Model-Based Test Case Selection";51;1535191016502;
"M10";"Testing a Software Product Line";220;1535192098505;
"SK:FMSPLE10";"An Effective Approach for Verifying Product Lines in Presence of Variability Models";0;1535573330993;
"useKBK:AOSD11";"Eliminating Products to Test in a Software Product Line";5;1535574413387;
"A10";"Modeling in Event-B System and Software Engineering";-2;1535605943406;
"SPB:ABZ10";"A Basis for Feature-Oriented Modelling in Event-B";16;1535193181047;
"SOM:SOFSEM10";"Model-Driven Software Product Line Testing An Integrated Approach";17;1535194265494;
"LMP10";"Quality Assurance in the Presence of Variability";19;1535195347329;
"VGE+:ASE10";"Flexible and Scalable Consistency Checking on Product Line Variability Models";53;1535196429679;
"MCP+:FMSPLE10";"Feature Petri Nets";30;1535197512060;
"KBBK:RV10";"Reducing Configurations to Monitor in a Software Product Line";47;1535198595557;
"ALMK10";"An Algebraic Foundation for Automatic Feature-Based Program Synthesis";56;1535199676854;
"ABFG:iFM10";"A Logical Framework to Deal with Variability";63;1535200758190;
"DJOS10";"Lazy Behavioral Subtyping";28;1535201841476;
"BDH:FoVeOOS10";"Verification of Variable Software An Experience Report";3;1535202937266;
"SMP:SPLC10";"Avoiding Redundant Testing in Application Engineering";27;1535204019675;
"RSK:FOSD10";"Improving Reuse of Component Families by Generating Component Hierarchies";3;1535205101566;
"AL:iFM10";"Adding Change Impact Analysis to the Formal Verification of C Programs";2;1535206183545;
"STL:TR10";"An Algorithm for Quantifying the Program Variability Induced by Conditional Compilation";4;1535207265816;
"STLS:GPCE10";"Efficient Extraction and Analysis of Preprocessor-Based Variability";40;1535209430975;
"HPSA:SAC10";"Dynamic Contract Layers";25;1535210513720;
"ASLK:FOSD10";"Language-Independent Reference Checking in Software Product Lines";22;1535211596486;
"NNH10";"Principles of Program Analysis";2295;1535212679108;
"SGS:FMCO10";"Compositional Algorithmic Verification of Software Product Lines";28;1535213761107;
"BCH+:ASE10";"Tag and Prune A Pragmatic Approach to Software Product Line Implementation";36;1535214842883;
"RPRB:SPLASH10";"Emergent Feature Modularization";40;1535215925473;
"BDS:SAC10";"Implementing Software Product Lines Using Traits";44;1535217006924;
"AH:TOPLAS10";"A Calculus for Uniform Feature Composition";47;1535218089627;
"SC10";"A New Eclipse-Based JML Compiler Built Using AST Merging";15;1535219171386;
"PSK+:ICST10";"Automated and Scalable T-Wise Test Case Generation Strategies for Software Product Lines";206;1535220253269;
"RPK:GPCE10";"Automatic Variation-Point Identification in Function-Block-Based Models";48;1535221335395;
"KS:FOSD10";"Patching Product Line Programs";5;1535222417178;
"CIZ:OOPSLA10";"Mostly Modular Compilation of Crosscutting Concerns by Contextual Predicate Dispatch";27;1535223498726;
"BSLWC:ASE10";"Variability Modeling in the Real A Perspective from the Operating Systems Domain";141;1536318083416;
"OMR:SPLC10";"Automated Incremental Pairwise Testing of Software Product Lines";139;1536319164791;
"K10";"Virtual Separation of Concerns Toward Preprocessors 2.0";11;1535608128266;
"CHSLR10";"Model Checking Lots of Systems Efficient Verification of Temporal Properties in Software Product Lines";289;1536320247334;
