"RBSP02";"Extending Feature Diagrams with UML Multiplicities";246;1533845882194;
"BLHM02";"Generating Product-Lines of Product-Families";100;1533846964772;
"dJV02";"Grammars as Feature Diagrams";41;1533848047964;
"M02";"Using First-Order Logic for Product Line Model Validation";272;1533849153960;
"C:APSEC01";"Applying mutation analysis for object-oriented programs using a reflective approach";51;1533850236493;
"RUCH:TSE01";"Prioritizing Test Cases for Regression Testing";1255;1533851319514;
"MJ01";"Testing a Software Product Line";220;1533852402158;
"FLF:ESECFSE01";"Behavioral Contracts and Behavioral Subtyping";98;1533853484464;
"NCA:REFLECTION01";"Supporting Formal Verification of Crosscutting Concerns";29;1533879839145;
"B2001";"Software Product Lines Organizational Alternatives";143;1533880922637;
"FL:FME01";"Houdini, an Annotation Assistant for ESCJava";385;1533882004861;
"LB:GCSE01";"A Standard Problem for Evaluating Product-Line Methodologies";191;1533883086901;
"PR01";"Feature Integration Using a Feature Construct";122;1533884169819;
"CN01";"Software Product Lines Practices and Patterns";4684;1536015708824;
"Sch01";"Automated Theorem Proving in Software Engineering";122;1533885252810;
"FK01";"Modular Verification of Collaboration-Based Software Designs";102;1533886334056;
"KHHKPG01";"An Overview of AspectJ";4058;1533887416633;
"AG01";"Implementing Product Line Variabilities";300;1533888498642;
"IPW01";"Featherweight Java A Minimal Core Calculus for Java and GJ";950;1533889580470;
"vGBS01";"On the Notion of Variability in Software Product Lines";737;1533890663179;
"S01";"User Interface Design for Programmers";153;1536016790737;
"CR:IWPC00";"Case Study of Feature Location Using Dependence Graph";290;1533380764961;
"H:FSE00";"Testing A Roadmap";518;1536223004227;
"EMR:SEN00";"Prioritizing Test Cases for Regression Testing";1262;1536224878005;
"OLKM00";"The Koala Component Model for Consumer Electronics Software";973;1536225960097;
"HP:STTT00";"Model Checking Java Programs Using Java PathFinder";920;1536227041130;
"VHBP:ASE00";"Model Checking Programs";1697;1536228122403;
"HA:FSE00";"Composing Features and Resolving Interactions";77;1536229203774;
"BCS:SPLC00";"Object-Oriented Frameworks and Product Lines";135;1536230285202;
"KPRS:GCSE00";"Aspect Composition Applying the Design by Contract Principle";66;1536017872765;
"B00";"A Run-time Assertion Checker for Java Using JML";44;1536231366987;
"SB00";"Issues Concerning Variability in Software Product Lines";99;1536232448885;
"CE00";"Generative Programming Methods, Tools, and Applications";-2;1536018955560;
"F00";"Refactoring Improving the Design of Existing Code";7842;1536020037954;
"Binder99";"Testing Object-oriented Systems Models, Patterns, and Tools";2189;1536233532123;
"BFK+:SSR99";"PuLSE A Methodology to Develop Software Product Lines";544;1536021121432;
"CCGR:CAV99";"NuSMV A New Symbolic Model Verifier";724;1536234613393;
"TOHS:ICSE99";"N Degrees of Separation Multi-Dimensional Separation of Concerns";1881;1536236777709;
"CGP99";"Model Checking";12561;1536237860008;
"PMDL99";"Extending Software Quality Assessment Techniques to Java Systems";72;1536242798985;
"IPW99";"Featherweight Java A Minimal Core Calculus for Java and GJ";953;1536243881902;
"JZ:TSE98";"Distributed feature composition a virtual architecture for telecommunications services";298;1536259027395;
"K:TOOLS98";"iContract - The Java(Tm) Design by Contract(Tm) Tool";-2;1536022204280;
"KC98";"JPP A Java Pre-Processor";16;1533928544926;
"BCK98";"Software Architecture in Practice";7960;1533929627103;
"L:OOPSLA98";"Data Groups Specifying the Modification of Extended State";190;1536023287580;
"CW:CSUR98";"Version Models for Software Configuration Management";877;1533930708821;
"BM:ICSE98";"Conceptual Module Querying for Software Reengineering";64;1533931791729;
"TWFL:IWSSD98";"Feature Engineering";47;1533932874728;
"ML:OOPSLA98";"Adaptive Plug-and-Play Components for Evolutionary Software Development";261;1533933955988;
"FKF:POPL98";"Classes and Mixins";523;1533935038786;
"SB:ECOOP98";"Implementing Layered Designs with Mixin Layers";371;1533936121931;
"GFA98";"Integrating Feature Modeling with the RSEB";814;1533937204617;
"KKLKKS98";"FORM A Feature-Oriented Reuse Method with Domain-Specific Reference Architectures";1363;1533938286975;
"H:TSE97";"The Model Checker SPIN";4625;1533939368944;
"N97";"Proof-Carrying Code";13;1536024369802;
"JM97";"Design by Contract The Lessons of Ariane";331;1533941533471;
"M97";"Advanced Compiler Design and Implementation";0;1536025452148;
"C97";"Type Systems";594;1533942614952;
"P97";"Feature-Oriented Programming A Fresh Look at Objects";530;1533943696632;
"KLMMLLI97";"Aspect-Oriented Programming";9463;1534031188450;
"AS96";"Structure and Interpretation of Computer Programs";2999;1534033354553;
"ORR+:CAV96";"PVS Combining Specification, Proof Checking, and Model Checking";625;1532956788813;
"AF96";"The New Statistical Analysis of Data";-2;1536026535688;
"A96";"The B-Book Assigning Programs to Meanings";4440;1532957872111;
"JSHS96";"TROLL A Language for Object-Oriented Specification of Information Systems";159;1532958954639;
"VN:OOPSLA96";"Using Role Components in Implement Collaboration-Based Designs";287;1534034436732;
"DL96";"Forcing Behavioral Subtyping through Specification Inheritance";256;1534065540512;
"MLM96";"Experiment on the Automatic Detection of Function Clones in a Software System Using Metrics";578;1534067705756;
"MMC:OOPSLA95";"Towards a Methodology for Explicit Composition of MetaObjects";88;1534068789417;
"BR95";"A Mathematical Definition of Full Prolog";126;1536027618219;
"NT95";"Object-Oriented Software Composition";192;1534069872164;
"GHJV95";"Design Patterns Elements of Reusable Object-Oriented Software";0;1534070958079;
"B95";"On Finding Duplication and Near-Duplication in Large Software Systems";801;1534072040137;
"LW:TOPLAS94";"A Behavioral Notion of Subtyping";1451;1534073122424;
"N94";"Usability Engineering";18815;1534074204624;
"WF94";"A Syntactic Approach to Type Soundness";1237;1534075285596;
"BMW:ICSE93";"The Concept Assignment Problem in Program Understanding";416;1533379683925;
"R93";"Raise Method Manual";-2;1534076368620;
"BR93";"A Formal Specification of PARLOG";20;1534079617615;
"HO:OOPSLA93";"Subject-Oriented Programming A Critique of Pure Objects";1084;1534080698648;
"J93";"Identifying Redundancy in Source Code Using Fingerprints";325;1534081782503;
"CDK93";"A Unified Approach for Showing Language Containment and Equivalence Between Various Types of $omega$-Automata";40;1534082865530;
"SC:USENIX92";"ifdef Considered Harmful, or Portability Experience With C News";217;1534799346239;
"W92";"Specification in Fresco";32;1534083948699;
"ORS:CADE92";"PVS A Prototype Verification System";2035;1534085030824;
"H:ECOOP92";"Specifying Reusable Components Using Contracts";212;1534086113906;
"M92";"Applying Design by Contract";2756;1534087195763;
"C:ECOOP91";"Inheritance in Object-Oriented Z";77;1534088278003;
"A:FOOL91";"Designing an Object-Oriented Programming Language with Behavioural Subtyping";345;1534089360713;
"HV91";"Model Checking vs. Theorem Proving A Manifesto";277;1534090441741;
"BC:ECOOP90";"Mixin-Based Inheritance";1113;1534091523189;
"HHG:ECOOP90";"Contracts Specifying Behavioral Compositions in Object-Oriented Systems";781;1534092605230;
"B:Van90";"Software Testing Techniques";55;1534093687959;
"J90";"Systematic Software Development Using VDM";3626;1534094769363;
"KCHNP90";"Feature-Oriented Domain Analysis (FODA) Feasibility Study";5080;1534095850953;
"RDH+:PU89";"Design Of Mutant Operators For The C Programming Language";315;1534096933893;
"H:BST50";"Error detecting and error correcting codes";5626;1536260110223;
"C:MOR79";"A Greedy Heuristic for the Set-Covering Problem";2538;1536261192387;
"BDC+:SETSS89";"The Feature Interaction Problem in Telecommunications Systems";196;1536028700809;
"MF89";"Towards a Generic Model of Configuration Tasks";623;1536263503657;
"S88";"Understanding Z A Specification Language and Its Formal Semantics";0;1536029783037;
"M88";"Object-Oriented Software Construction";9974;1536030865762;
"Z87";"A Framework for Information Systems Architecture";3932;1536031947456;
"LG86";"Abstraction and Specification in Program Development";878;1536033029669;
"D86";"Checking C Programs with Lint";77;1536034112676;
"S85";"The Limits of Correctness";75;1536061968288;
"SE84";"Empirical Studies of Programming Knowledge";956;1536063050478;
"S83";"Algorithms";-2;1536064132330;
"G81";"The Science of Programming";2358;1534098016313;
"W:ICSE81";"Program Slicing";4561;1534099101104;
"S81";"Independent Predicates";6;1534100186968;
"P:ICSE78";"Designing Software for Ease of Extension and Contraction";910;1534101269347;
"CC:POPL77";"Abstract Interpretation A Unified Lattice Model for Static Analysis of Programs by Construction or Approximation of Fixpoints";7046;1534102352469;
"D76";"A Discipline of Programming";7323;1534103436149;
"P76";"On the Design and Development of Program Families";1218;1534104518513;
"K76";"Symbolic Execution and Program Testing";2711;1536065214398;
"D75";"Guarded Commands, Nondeterminacy and Formal Derivation of Programs";2450;1534105599866;
"LZ74";"Programming with Abstract Data Types";1078;1534106681453;
"D72";"Chapter I Notes on Structured Programming";-2;1536066294917;
"H72";"Proof of Correctness of Data Representations";1589;1534107763706;
"P72";"On the Criteria to be used in Decomposing Systems into Modules";6357;1534108846558;
"W71";"Program Development by Stepwise Refinement";1877;1536067376417;
"H69";"An Axiomatic Basis for Computer Programming";7189;1534109928522;
"I68";"Mass Produced Software Components";993;1534111009789;
"D68";"Go To Statement Considered Harmful";21;1536068457894;
"F67";"Assigning Meanings to Programs";3396;1534112093378;
"T49";"Checking a Large Routine";336;1534113176871;
"F1879";"Begriffsschrift, eine der arithmetischen nachgebildete Formelsprache des reinen Denkens";-2;1534114259700;
"KMSL:CDT83";"CONIC An Integrated Approach to Distributed Computer Control Systems";167;1534115342320;
"spl-strategies";"Analysis Strategies for Software Product Lines";76;1534116425027;
"cpp";"The C Preprocessor";0;1536069538652;
"antenna";"Antenna An Ant-to-End Solution For Wireless Java";-2;1534117506604;
"munge";"Munge A Purposely-Simple Java Preprocessor";-2;1536072782625;
"useFM07";"Why A Software Verification Platform";-2;1536073864581;
"sat4j";"SAT4J A Satisfiability Library for Java";34;1534118589815;
"homogeneous";"An Homogeneous Feature-Based Approach";-2;1536074947510;
"gears";"Gears A Software Product Line Engineering Tool";-2;1536076029872;
"pure-variants";"purevariants";-2;1536077111920;
"cdl3";"The eCos Component Writer's Guide";29;1535465459146;
"cdl";"The eCos Component Writer's Guide";29;1534119671601;
"LinuxKernelConf";"LinuxKernelConf Documentation";-2;1536078193907;
"kconfig";"KConfig Documentation";-2;1536079276745;
"AHEAD";"AHEAD Tool Suite";-2;1534120755488;
"Coq:mailinglist";"The Coq Mailing List";-2;1536080358776;
"Coq:website";"The Coq Proof Assistant";-2;1536081441439;
"Coq:manual";"The Coq Proof Assistant Reference Manual";-2;1536090011548;
"JML:manual";"JML Reference Manual";235;1534121838113;
