"BLLV:TSE20";"A Framework for Quantitative Modeling and Analysis of Highly (Re)Configurable Systems";14;1582267495619;
"KTS+:VaMoS20";"YASA: Yet Another Sampling Algorithm";0;1582222206331;
"BRK+:VaMoS20";"Variational Correctness-by-Construction";0;1582226979961;
"SSK+:VaMoS20";"SMT-Based Variability Analyses in FeatureIDE";0;1582228061179;
"STS:VaMoS20";"Evaluating SAT Solvers on Industrial Feature Models";1;1582229143857;
"OGB+:TR19";"Uniform Sampling from Kconfig Feature Models";5;1584353341587;
"MOP+:SPLC19";"Uniform Random Sampling Product Configurations of Feature Models That Have Numerical Features";2;1584354423373;
"FAH+:SPLC19";"A KConfig Translation to Logic with One-Way Validation System";0;1582292371711;
"GTA+:VaMoS19";"Characterizing Safe and Partially Safe Evolution Scenarios in Product Lines: An Empirical Study";1;1582268576512;
"BTS:SEFM19";"SAT Encodings of the At-Most-k Constraint: A Case Study on Configuring University Courses";2;1584965897220;
"LGL:STTT19";"Sampling Strategies for Product Lines with Unbounded Parametric Real-Time Constraints";1;1582322916252;
"TKK+:SPLC19";"Feature-Oriented Contract Composition";2;1582320752960;
"PTR+:SPLC19";"Product Sampling for Product Lines: The Scalability Challenge";3;1582533331641;
"TTS+:VariVolution19";"Towards Efficient Analysis of Variation in Time and Space";3;1582319671791;
"TSS:MODEVAR19";"On Language Levels for Feature Modeling Notations";1;1582318336677;
"LRGB:COLA19";"Automated Analysis of Two-Layered Feature Models with Feature Attributes";4;1580641366386;
"GBT+19";"Automated Analysis of Feature Models: Quo Vadis";14;1580642448288;
"RRC+:SOSP19";"An Analysis of Performance Evolution of Linux's Core Operations";0;1584966978449;
"RKBL:TOSEM19";"Automated N-Way Program Merging for Facilitating Family-Based Analyses of Variant-Rich Software";6;1582450901611;
"SBT:JSS19";"Partially Safe Evolution of Software Product Lines";17;1582271821560;
"SPLC19a";"SPLC '19: Proceedings of the 23rd International Systems and Software Product Line Conference - Volume A";0;1580160177294;
"SPLC19b";"SPLC '19: Proceedings of the 23rd International Systems and Software Product Line Conference - Volume B";0;1580161259501;
"JMJ+19";"Addressed Challenges";-2;1582321834722;
"THA+19";"Performance Analysis Strategies for Software Variants and Versions";1;1582402338080;
"RSC+:FASE19";"Tool Support for Correctness-by-Construction";-2;1584462585204;
"TKK+:JSS19";"Feature-Oriented Contract Composition";2;1582800854841;
"KTP+:SE19";"Understanding Parameters of Deductive Verification: An Empirical Investigation of KeY";2;1584480165129;
"KTS+:SE19";"Propagating Configuration Decisions with Modal Implication Graphs";8;1584566832181;
"RDD:SoSyM19";"Certifying Delta-Oriented Programs";0;1581358745228;
"ATL+:SoSyM19";"Effective Product-Line Testing Using Similarity-Based Product Prioritization";55;1582403421185;
"BDG+:SCP19";"On the Expressiveness of Modal Transition Systems with Variability Constraints";6;1580462362976;
"SYS:IST19";"Metrics for Analyzing Variability and its Implementation in Software Product Lines: A Systematic Literature Review";14;1580465610028;
"LNTS:JSS19";"Retest Test Selection for Product-Line Regression Testing of Variants and Versions of Variants";5;1580466691736;
"KGS:SPLC18";"Identifying the Intensity of Variability Changes in Software Product Line Evolution";4;1582269658622;
"P18";"Stability of Product Sampling under Product-Line Evolution";2;1580643532795;
"CCRC:ASE18";"Navigating the Maze: The Impact of Configurability in Bioinformatics Software";4;1582441162991;
"HKE+:ASE18";"A Unified Lattice Model and Framework for Purity Analyses";1;1581444393338;
"KTPS:FIDE18";"Experience Report on Formally Verifying Parts of OpenJDK's API with KeY";2;1584679619345;
"KTM+:SE18";"Is There a Mismatch between Real-World Feature Models and Product-Line Research";24;1584680702668;
"CGR+:VaMoS18";"Equivalent Mutants in Configurable Systems: An Empirical Study";12;1584681785687;
"LNT+:VaMoS18";"175% Modeling for Product-Line Evolution of Domain Artifacts";14;1584685032453;
"BFG:SPLC18";"Product Line Models of Large Cyber-physical Systems: The Case of ERTMSETCS";4;1580463446498;
"BBG:SPLC18";"Modelling and Analysis with Featured Modal Contract Automata";4;1580464528383;
"VBLL:FM18";"QFLan: A Tool for the Quantitative Analysis of Highly Reconfigurable Systems";5;1581424341467;
"KTPS:ISoLA18";"Scalability of Deductive Verification Depends on Method Call Treatment";3;1580467774687;
"RLB+:GPCE18";"Measuring Effectiveness of Sample-Based Product-Line Testing";1;1580468858958;
"NMS+:GPCE18";"Anomaly Analyses for Feature-Model Evolution";5;1580469941330;
"TKS:ConfWS18";"Product Configuration in the Wild: Strategies for Conflicting Decisions in Web Configurators";1;1580471023665;
"NST:VariVolution18";"Back to the Future: Avoiding Paradoxes in Feature-Model Evolution";6;1580472105717;
"TKL:SPLC18";"Clean Your Variable Code with FeatureIDE";12;1580473186925;
"KFT+:SPLC18";"Apo-Games: A Case Study for Reverse Engineering Variability from Cloned Java Variants";13;1580474268260;
"VAT+:SPLC18";"A Classification of Product Sampling for Software Product Lines";19;1580475350038;
"KTPS:ITP18";"Understanding Parameters of Deductive Verification: An Empirical Investigation of KeY";2;1580476432133;
"DDP:EMSE18";"FEVER: An Approach to Analyze Feature-Oriented Changes and Artefact Co-Evolution in Highly Configurable Systems";7;1580507843979;
"KTS+:ICSE18";"Propagating Configuration Decisions with Modal Implication Graphs";9;1583489461927;
"GYS+:EMSE18";"Data-Efficient Performance Learning for Configurable Systems";32;1580080009686;
"TKL:Modellierung18";"Feature Modeling and Development with FeatureIDE";2;1580508926254;
"AMS+:TOSEM18";"Variability Bugs in Highly Configurable Systems: A Qualitative Analysis";20;1580510008029;
"DBW:SCP18";"Variability Abstractions for Lifted Analyses";3;1580595322140;
"K:TR17";"Differential Testing for Variational Analyses: Experience from Developing KConfigReader";10;1584131109884;
"useBBG:SPLC18";"Orchestration of Dynamic Service Product Lines with Featured Modal Contract Automata";11;1581327735743;
"SKT+:SE17";"Compositional Analyses of Highly-Configurable Systems with Feature-Model Interfaces";0;1584686114105;
"KATS:IFAC17";"Supporting the Development of Interdisciplinary Product Lines in the Manufacturing Domain";4;1584687196639;
"JVK+:SEAMS17";"Transfer Learning for Improving Model Predictions in Highly Configurable Software";42;1580634873412;
"TF17";"An Introduction to Personalization and Mass Customization";24;1580635955174;
"FLS+:CIM17";"Hyper-Heuristic Based Product Selection for Software Product Line Testing";23;1582564047699;
"HNA+:TR17";"Test Them All, Is It worth It A Ground Truth Comparison of Configuration Sampling Strategies";9;1582565130760;
"useHNA+:TR17";"Yo Variability! JHipster: A Playground for Web-Apps Analyses";11;1580637036936;
"FLV:SBES17";"Automatic Generation of Search-Based Algorithms Applied to the Feature Testing of Software Product Lines";5;1582566213252;
"AZAB17";"Constrained Interaction Testing: A Systematic Literature Study";26;1580638118990;
"SSA:ESECFSE17";"Attributed Variability Models: Outside the Comfort Zone";16;1580639201444;
"GRS+:CCPE17";"Performance-Influence Models of Multigrid Methods: A Case Study on Triangular Grids";9;1580640283895;
"FMP:SEFM17";"Specification Clones: An Empirical Study of the Structure of Event-B Specifications";1;1580647860385;
"ALHR:TOCE17";"Teaching Software Product Lines: A Snapshot of Current Practices and Challenges";11;1580648942562;
"BTSG:ICFEM17";"Modularization of Refinement Steps for Agile Formal Methods";0;1580218447402;
"KPK+:SPLC17";"FeatureIDE: Empowering Third-Party Developers";12;1580650024852;
"LSBL:SPLC17";"Modeling and Testing Product Lines with Unbounded Parametric Real-Time Constraints";14;1584268072781;
"KTS+:ESECFSE17";"Is There a Mismatch Between Real-World Feature Models and Product-Line Research";24;1583629894697;
"DABW:STTT17";"Efficient Family-Based Model Checking via Variability Abstractions";18;1583274882018;
"LLE:SoSyM17";"Variability Extraction and Modeling for Product Variants";40;1583935684906;
"MTS+17";"Mastering Software Variability with FeatureIDE";60;1582488185550;
"SPLC17b";"Proceedings of the 21st International Systems and Software Product Line Conference (SPLC) - Volume B";-2;1584688279371;
"CBA:OOPSLA17";"Evaluating and Improving Semistructured Merge";26;1582644127921;
"LBG:GPCE17";"A Classification of Variation Control Systems";21;1580219530292;
"MAZ:SPLC17";"ESPLA: A Catalog of Extractive SPL Adoption Case Studies";28;1580651107274;
"DHL:TAP17";"Abstraction Refinement for the Analysis of Software Product Lines";1;1580220611750;
"G:ESECFSE17";"Kmax: Finding All Configurations of Kbuild Makefiles Statically";11;1580652188672;
"LCA+:IST17";"Feature-Family-Based Reliability Analysis of Software Product Lines";4;1580221692568;
"MNS+:SPLC17";"Anomaly Detection and Explanation in Context-Aware Software Product Lines";6;1580224529066;
"ESKS:SPLC17";"An Empirical Study of Configuration Mismatches in Linux";12;1580225609977;
"WRSS:VaMoS17";"Extractive Software Product Line Engineering Using Model-based Delta Module Generation";14;1580226692320;
"SWS+:SPLC17";"Detecting Variability in MATLABSimulink Models: An Industry-Inspired Technique and Its Evaluation";6;1580653271358;
"ALL+:VACE17";"Delta-Oriented Product Prioritization for Similarity-Based Product-Line Testing";15;1584456095175;
"DW:FASE17";"Variability-Specific Abstraction Refinement for Family-Based Model Checking";18;1583943256344;
"BVW:FASE17";"Family-Based Model Checking with mCRL2";23;1583944338345;
"QPV+:SoSyM17";"The Shape of Feature Code: An Analysis of Twenty C-Preprocessor-Based Systems";26;1580654353646;
"LATS:VaMoS17";"Optimizing Product Orders Using Graph Algorithms for Improving Incremental Product-line Analysis";11;1580111416304;
"FMS+:SANER17";"Variant-Preserving Refactorings for Migrating Cloned Products to a Product Line";45;1583877498266;
"RDZL:VaMoS16";"Feature Models in Linux: From Symbols to Semantics";9;1584132191494;
"FMSPLE16";"Proceedings of the 7th International Workshop on Formal Methods and Analysis in Software Product Line Engineering (FMSPLE@ETAPS)";-2;1584689361646;
"BFGM:JLAMP16";"Modelling and Analysing Variability in Product Families: Model Checking of Modal Transition Systems with Variability Constraints";51;1580428550190;
"useBVW:FASE17";"Towards a Feature mu-Calculus Targeting SPL Verification";8;1581450894450;
"BRV:ISoLA16";"Supervisory Controller Synthesis for Product Lines Using CIF 3";18;1580429267772;
"BLLV:ISoLA16";"Statistical Model Checking for Product Lines";20;1580430350501;
"HW:FOSD16";"Formula Choice Calculus";4;1580655435704;
"MFV:JSERD16";"A Multi-Objective Test Data Generation Approach for Mutation Testing of Feature Models";9;1580656518683;
"FKPV:CEC16";"Product Selection Based on Upper Confidence Bound MOEAD-DRA for Testing Software Product Lines";13;1582567294710;
"HHB:iFM16";"Can Formal Methods Improve the Efficiency of Code Reviews";7;1580227773280;
"ABB+16";"Deductive Software Verification - The KeY Book";134;1580228854887;
"WSSS:SANER16";"Custom-Tailored Variability Mining for Block-Based Languages";12;1580229935505;
"WTS+:ISoLA16";"Identifying Variability in Object-Oriented Code Using Model-Based Code Mining";5;1580232178469;
"FLRE:SBST16";"A Preliminary Empirical Assessment of Similarity for Combinatorial Interaction Testing of Software Product Lines";6;1583281371338;
"DL:iFM16";"On Type Checking Delta-Oriented Product Lines";15;1583277044715;
"SSRS:VaMoS16";"Aligning Coevolving Artifacts Between Software Product Lines and Products";12;1580158012949;
"BSD:SPLC16";"When 150% is Too Much: Supporting Product Centric Viewpoints in an Industrial Product Line";3;1580657599819;
"SBWW:ICSME16";"Concepts, Operations, and Feasibility of a Projection-Based Variation Control System";27;1584984285950;
"RGPA:SPLC16";"A Prototype-Based Approach for Managing Clones in Clone-and-Own Product Lines";7;1580078927403;
"OFAL:SPLC16";"Long-Term Average Cost in Featured Transition Systems";11;1580083256741;
"LBC:SPLC16";"Towards Clone-and-Own Support: Locating Relevant Methods in Legacy Products";12;1580658680602;
"ZGB+:SPLC16";"A Mathematical Model of Performance-Relevant Feature Interactions";9;1584987534602;
"PKM+:ICSR16";"FeatureIDE: Scalable Product Configuration of Variable Systems";24;1580659763441;
"MBW:ICSE16";"How Does the Degree of Variability Affect Bug Finding";50;1583913876954;
"BSK+:SOFTENG16";"Migration from Annotation-Based to Composition-Based Product Lines: Towards a Tool-Driven Process";25;1580660845928;
"HZS+:EMSE16";"Preprocessor-Based Variability in Open-Source and Industrial Software Systems: An Empirical Study";57;1580661925871;
"T16";"Spezifikation und Verifikation von Produktlinien mit Feature-orientierten Vertraegen";0;1584985368358;
"SSS+16";"A Study on Tool Support for Refactoring in Database Applications";2;1584986451383;
"KAT:GPCE16";"Explaining Anomalies in Feature Models";47;1583942174467;
"AKT+:GPCE16";"IncLing: Efficient Product-line Testing Using Incremental Pairwise Sampling";58;1580663007847;
"AMK+:GPCE16";"Tool Demo: Testing Configurable Systems with FeatureIDE";28;1580664089990;
"AKTS:FOSD16";"Implicit Constraints in Partial Feature Models";29;1583945419845;
"RRM+:IST16";"Assessing Fine-Grained Feature Dependencies";30;1580084339016;
"SAKS:EMSE16";"Quantifying Structural Attributes of System Decompositions in 28 Feature-Oriented Software Product Lines";5;1583587850763;
"BABN:EMSE16";"Breathing Ontological Knowledge Into Feature Model Synthesis: An Empirical Study";38;1580665171186;
"MKR+:ICSE16";"A Comparison of 10 Sampling Algorithms for Configurable Systems";83;1582710429250;
"TRS+:SPLC16";"Product-Line Maintenance with Emergent Contract Interfaces";14;1580085420501;
"KST+:SPLC16";"Comparing Algorithms for Efficient Feature-Model Slicing";14;1583612233245;
"PTF+:SPLC16";"Synchronizing Software Variants with VariantSync";21;1583586768506;
"TLK:SPLC16";"Clean Your Variable Code with FeatureIDE";12;1580087584326;
"HNTS:ISoLA16";"Proof-Carrying Apps: Contract-Based Deployment-Time Verification";4;1580666252772;
"useSBT:JSS19";"Partially Safe Evolution of Software Product Lines";17;1582272902722;
"MWK+:ASE16";"On Essential Configuration Complexity: Measuring Interactions In Highly-Configurable Systems";69;1580667334465;
"KAT:TR16";"Explaining Anomalies in Feature Models";47;1582945753989;
"R16";"Analysis Strategies for Configurable Systems";7;1580088665896;
"ITT:SEAMS16";"Symbolic Performance Adaptation";13;1583613314968;
"BVM:SCP16";"Basic Behavioral Models for Software Product Lines: Expressiveness and Testing Pre-Orders";35;1580667787969;
"useDDP:EMSE18";"FEVER: Extracting Feature-Oriented Changes from Commits";15;1580668870911;
"SL:SAC16";"Similarity Management of 'Cloned and Owned' Variants";11;1584384712733;
"FAHC:ICSR16";"Feature Location in Model-Based Software Product Lines Through a Genetic Algorithm";16;1583583521815;
"MZP+:ICSR16";"Feature Location Benchmark for Software Families Using Eclipse Community Releases";8;1583582438315;
"SSCW:ICSR16";"Tax-PLEASE - Towards Taxonomy-Based Software Product Line Engineering";3;1583580275838;
"LMTS:ICSR16";"Applying Incremental Model Slicing to Product-Line Regression Testing";21;1583614397257;
"SKT+:ICSE16";"Feature-Model Interfaces: The Highway to Compositional Analyses of Highly-Configurable Systems";35;1580711289370;
"MTS+:ICSE16";"FeatureIDE: Taming the Preprocessor Wilderness";35;1580712371791;
"CHG+:MODULARITY16";"Segregating Feature Interfaces to Support Software Product Line Maintenance";5;1582740880725;
"KSTS:TR16";"An Efficient Algorithm for Feature-Model Slicing";7;1583581357242;
"M16";"Metaanalyse zu Strategien fuer die formale Verifikation von Software-Produktlinien";0;1580089748092;
"ABT+:VaMoS16";"Mutation Operators for Preprocessor-Based Variability";13;1580090830785;
"TWS+:VaMoS16";"Variability Hiding in Contracts for Dependent Software Product Lines";15;1583239173206;
"P16";"Automating the Synchronization of Software Variants";2;1582741962909;
"RTS+:JLAMP16";"Variability Encoding: From Compile-Time to Load-Time Variability";32;1580713454564;
"EKS:GPCE15";"Analysing the KConfig Semantics and its Analysis Tools";17;1584711001271;
"BTL+:VaMoS15";"A Survey on Modeling Techniques for Formal Behavioral Verification of Software Product Lines";18;1584690443420;
"useBDG+:SCP19";"From Featured Transition Systems to Modal Transition Systems with Variability Constraints";10;1581369945615;
"BLLV:SPLC15";"Statistical Analysis of Probabilistic Models of Software Product Lines with Quantitative Constraints";33;1581425424634;
"BLLV:FMSPLE15";"Quantitative Analysis of Probabilistic Models of Software Product Lines with Statistical Model Checking";16;1581357662003;
"BFGM:SPLat15";"Using FMC for Family-Based Analysis of Software Product Lines";9;1581471598690;
"BBV:FMSPLE15";"Coherent Branching Feature Bisimulation";9;1580427467382;
"GDR+:IST15";"Supporting Distributed Product Configuration by Integrating Heterogeneous Variability Modeling Approaches";26;1580714536149;
"useMFV:JSERD16";"A Mutation and Multi-Objective Test Data Generation Approach for Feature Testing of Software Product Lines";16;1580715619371;
"LFRE:IWCT15";"A First Systematic Mapping Study on Combinatorial Interaction Testing for Software Product Lines";47;1582562964508;
"SGS+:ASE15";"Cost-Efficient Sampling for Performance Prediction of Configurable Systems";99;1580081092498;
"KTTS:ASE15";"Scaling Size and Parameter Spaces in Variability-Aware Software Performance Models";22;1580233259092;
"DPL+:VaMoS15";"Covering SPL Behaviour with Sampled Configurations: An Initial Assessment";9;1580716700443;
"BSAB:ICSE15";"Symbolic Model Checking of Product-Line Requirements Using SAT-Based Methods";15;1583292190936;
"NBKC:TSE15";"Where Do Configuration Constraints Stem From An Extraction Approach and an Empirical Study";65;1583291108870;
"KSFS:VaMoS15";"Use-Case-Specific Source-Code Documentation for Feature-Oriented Programming";13;1583914958153;
"PCF:ICSR15";"A Systematic Literature Review of Software Product Line Management Tools";43;1583876416546;
"useDBW:SCP18";"Variability Abstractions: Trading Precision for Speed in Family-Based Analyses";17;1580717781023;
"BKL+:AUSE15";"Reasoning about Product-Line Evolution Using Complex Feature Model Differences";41;1583579192435;
"VBM:ICFEM15";"Delta-Oriented FSM-Based Testing";-2;1580108740839;
"FLLE:ICSE15";"The ECCO Tool: Extraction and Composition for Clone-and-Own";27;1580718863273;
"LFLE:SST15";"Using Traceability for Incremental Construction and Evolution of Software Product Portfolios";10;1582551065495;
"ALL+:GECCO15";"Extracting Variability-Safe Feature Models from Source Code Dependencies in System Variants";12;1583584603448;
"JBAC:SPLC15";"Maintaining Feature Traceability with Embedded Annotations";44;1583585686045;
"MZB+:SPLC15";"Bottom-Up Adoption of Software Product Lines: A Generic and Extensible Approach";80;1580719945132;
"LJG+:ICSE15";"Morpheus: Variability-Aware Refactoring in the Wild";36;1580721025800;
"useSKT+:ICSE16";"Feature-Model Interfaces for Compositional Analyses";2;1583240255650;
"ES:STTT15";"Mapping the Design Space of Textual Variability Modeling Languages: A Refined Analysis";24;1580722106346;
"BLB+:FASE15";"Facilitating Reuse in Multi-Goal Test-Suite Generation for Software Product Lines";29;1580113589696;
"RGA+:ICSE15";"Presence-Condition Simplification in Highly Configurable Systems";36;1583241337767;
"SSW:ICSME15";"Forked and Integrated Variants in an Open-Source Firmware Project";42;1580114675578;
"SGKA:ESECFSE15";"Performance-Influence Models for Highly Configurable Systems";138;1583242419547;
"LEGP:MODELS15";"Feature Modeling of Two Large-Scale Industrial Software Systems: Experiences and Lessons Learned";15;1580723187388;
"FAB+:SPLC15";"Assessing Product Line Derivation Operators Applied to Java Source Code: An Empirical Study";4;1580724269072;
"OGRT:SLE15";"Using Decision Rules for Solving Conflicts in Extended Feature Models";18;1583619075983;
"RBR+:SPLC15";"Fault-Based Product-Line Testing: Effective Sample Generation Based on Feature-Diagram Mutation";28;1580725351257;
"LBS:SANER15";"Towards Incremental Model Slicing for Delta-Oriented Software Product Lines";9;1583243502286;
"LLL+:SPLC15";"Delta-Oriented Test Case Prioritization for Integration Testing of Software Product Lines";21;1583244584762;
"AGV:ICST15";"Generating Tests for Detecting Faults in Feature Models";39;1583245668040;
"S15";"An Annotation-Centric Approach to Similarity Management";3;1583246749026;
"SSR:sosym15";"Variability Testing in the Wild: The Drupal Case Study";39;1580726431731;
"WKP:VaMoS15";"Uncovering Variability Models for Software Ecosystems from Multi-Repository Structures";5;1582552146607;
"LG:VaMoS15";"Using Feature Feeds to Improve Developer Awareness in Software Ecosystem Evolution";11;1583247831652;
"M:SE15";"Scalable Sampling and Prioritization for Product-Line Testing";7;1582553227114;
"TAK+:SE15";"Analysis Strategies for Software Product Lines: A Classification and Survey";4;1580727512378;
"T15";"Product-Line Specification and Verification with Feature-Oriented Contracts";31;1583248914476;
"BDS:SCP14";"Implementing Type-Safe Software Product Lines Using Parametric Traits";12;1583249996115;
"MJ:TAOSD14";"Modular Reasoning in Aspect-Oriented Languages from a Substitution Perspective";8;1583251077126;
"SPH+:EXWA14";"Automated Generation of Computationally Hard Feature Models Using Evolutionary Algorithms";14;1582666160276;
"CR:IJAST14";"Efficient and Effective Testing of Automotive Software Product Lines";3;1582568377385;
"GKS+:PPL14";"Experiments on Optimizing the Performance of Stencil Codes with SPL Conqueror";15;1580082174195;
"KST:FASE14";"Family-Based Performance Analysis of Variant-Rich Software Systems";25;1580234342059;
"LHF+:CEC14";"Comparative Analysis of Classical Multi-Objective Evolutionary Algorithms and Seeding Strategies for Pairwise Testing of Software Product Lines";20;1580235423962;
"TDS+:ATC14";"Static Analysis of Variability in System Software: The 90,000 Ifdefs Issue";36;1580728593853;
"ZHP+:SAC14";"Towards a Language-Independent Approach for Reverse-Engineering of Software Product Lines";43;1584361994837;
"SSA:Modellierung14";"DeltaEcore - A Model-Based Delta Language Generation Framework";59;1583257565563;
"KHS+:PPPJ14";"DeltaJ 1.5: Delta-Oriented Programming for Java 1.5";52;1580729676300;
"WKE+:Onward14";"Variational Data Structures: Exploring Tradeoffs in Computing with Variability";41;1580730758571;
"DPL+:ISoLA14";"Coverage Criteria for Behavioural Testing of Software Product Lines";34;1583620158170;
"SDCE:ICSE14";"Case Studies and Tools for Contract Specifications";22;1583621240541;
"DPS:SPLat14";"Abstract Test Case Generation for Behavioural Testing of Software Product Lines";18;1582289126177;
"BV:ISoLA14";"Towards Modular Verification of Software Product Lines with mCRL2";19;1582284800183;
"VK:APSEC14";"Model Checking of Software Product Lines in Presence of Nondeterminism and Probabilities";1;1580115759911;
"LAG+:ICSME14";"Recovering Feature-to-Code Mappings in Mixed-Variability Software Systems";16;1582570539662;
"useLLE:SoSyM16b";"Enhancing Clone-and-Own with Systematic Reuse for Developing Software Variants";97;1582442244390;
"KKS:ICSME14";"Program Dependency Analysis for Consolidating Customized Product Copies";9;1583624485734;
"BNR+:MODELS14";"Three Cases of Feature-Based Variability Modeling in Industry";48;1583625567413;
"DSW:SPLC14";"Delta-Oriented Multi Software Product Lines";21;1583252158206;
"MRGF:JUCS14";"A Catalogue of Refactorings to Remove Incomplete Annotations";13;1583253239738;
"LS:SPLat14";"Towards the Assessment of Software Product Line Tests: A Mutation System for Variable Systems";22;1580731840396;
"BL:FOSD14";"Towards Incremental Test Suite Optimization for Software Product Lines";9;1583254321059;
"PHL:ICST14";"Sampling Program Inputs with Mutation Analysis: Going Beyond Combinatorial Interaction Testing";35;1580732921990;
"HPL:SBSE14";"Mutation-Based Generation of Software Product Line Test Configurations";45;1582631151025;
"SO:SPLC14";"Generation, Composition, and Verification of Families of Human-Intensive Systems";3;1583255401648;
"SWZ:InnoSWDev14";"Model Checking Partial Software Product Line Designs";1;1583256483962;
"BH14";"Reasoning and Verification: State of the Art and Current Trends";49;1580734002972;
"M14";"VarexJ: A Variability-Aware Interpreter for Java Applications";10;1580735084218;
"K14";"Product-Line Verification with Abstract Contracts";-2;1582232391598;
"RBB14";"Emergent Interfaces for Feature Modularization";2;1583258647099;
"ABB+:VSTTE14";"The KeY Platform for Verification and Analysis of Java Programs";67;1583259729389;
"SFG+:SCP14";"On the Use of Feature-Oriented Programming for Evolving Software Product Lines - A Comparative Study";28;1583260812127;
"MMCA:IST14";"On Strategies for Testing Software Product Lines: A Systematic Literature Review";56;1580736166830;
"BV:FormaliSE14";"Using mCRL2 for the Analysis of Software Product Lines";34;1583261894597;
"NKN:ICSE14";"Exploring Variability-Aware Execution for Testing Plugin-Based Web Applications";93;1583262977269;
"useNBKC:TSE15";"Mining Configuration Constraints: Static Analyses and Empirical Results";120;1580940343007;
"RBK:ICSE14";"Feature Maintenance with Emergent Interfaces";37;1582646291905;
"NKN:FSE14";"Building Call Graphs for Embedded Client-Side Code in Dynamic Web Applications";26;1582647372562;
"CHL+:FSE14";"Counterexample Guided Abstraction Refinement of Product-Line Behavioural Models";24;1582667241558;
"AV:REVE14";"Feature Location for Software Product Line Migration: A Mapping Study";41;1580941424430;
