"K06";"Aspect Categories and Classes of Temporal Properties";117;1607615441149;
"LBR06";"Preliminary Design of JML: A Behavioral Interface Specification Language for Java";1059;1611052792150;
"ALS:ICSE06";"Aspectual Mixin Layers: Aspects and Features in Concert";168;1611053873302;
"B:GTTSE06";"A Tutorial on Feature Oriented Programming and the AHEAD Tool Suite";130;1607616523216;
"KG06";"Supporting the Analysis of Clones in Software Systems: A Case Study";115;1611054955812;
"CP06";"Verifying Feature-Based Model Templates Against Well-Formedness OCL Constraints";298;1608287576338;
"KV06";"Towards Type Safety of Aspect-Oriented Languages";5;1607617603977;
"AWLF06";"Proof General in Eclipse: System and Architecture Overview";11;1611056036799;
"B06";"A Very Mathematical Dilemma";9;1607621192151;
"CKK06";"Feature Models are Views on Ontologies";211;1607622274234;
"TBRCST06";"Explanations for Agile Feature Models";31;1608288657624;
"BRCTS06";"A Survey on the Automated Analyses of Feture Models";0;1608289738859;
"BBRC06";"Automated Analyses of Feature Models: Challenges Ahead";304;1611057118771;
"AGMKBdL06";"Refactoring Product Lines";224;1607623357051;
"BSTRC06";"A First Step Towards a Framework for the Automated Analysis of Feature Models";104;1608290821278;
"YGM:SEAS06";"Assessing Merge Potential of Existing Engine Control Systems into a Product Line";26;1607624438014;
"MS05";"Software Ecosystem: Understanding an Indispensable Technology and Industry";714;1617626706724;
"GTK+:Nature05";"Allegro Version 2";220;1616233736153;
"ELH+:TOSEM05";"Impact of Software Engineering Research on the Practice of Software Configuration Management";237;1612961598152;
"BBEW:WEA05";"BDDs in a Branch and Cut Framework";41;1612198123371;
"AGH05";"The Java Programming Language";3672;1612199205802;
"DK:SAT05";"Variable Ordering for Efficient SAT Search by Analyzing Constraint-Variable Dependencies";12;1612200286747;
"LJG:SPLC05";"Cost Estimation for Product Line Engineering Using Cots Components";23;1612201367716;
"HD:IJCAI05";"DPLL With a Trace: From SAT to Knowledge Compilation";68;1612202449388;
"CMC05";"The Structured Intuitive Model for Product Line Economics (SIMPLE)";114;1612203530159;
"SBK:AAAI05";"Solving Bayesian Networks by Weighted Model Counting";108;1612204611055;
"SBK:SAT05";"Heuristics for Fast Exact Model Counting";100;1612247339770;
"WS:SAT05";"A New Approach to Model Counting";114;1612248421613;
"CK:CADICS05";"A Fast Pseudo-Boolean Constraint Solver";232;1612249503934;
"PBDG:APS05";"Pruning Conformant Plans by Counting Models on Compiled d-DNNF Representations";70;1612250586104;
"RJB05";"The Unified Modeling Language Reference Manual";558;1613189594230;
"KWN:GI05";"A Generic Difference Algorithm for UML Models.";215;1612791726782;
"ZS:ASE05";"UMLDiff: An Algorithm for Object-Oriented Design Differencing";517;1612792809008;
"B:TCS05";"A Survey on Tree Edit Distance and Related Problems";900;1608199133012;
"GHM+:IBMSJ05";"The Eclipse 3.0 Platform: Adopting OSGi Technology";148;1611058200467;
"YMKI:PROFES05";"Measuring Similarity of Large Software Systems Based on Source Code Correspondence";84;1608292717423;
"CK:CASSIS04";"ESCJava2: Uniting ESCJava and JML";368;1611059281577;
"C05";"A Design Discipline and Language Features for Modular Reasoning in Aspect-Oriented Programs";45;1607625518986;
"ACV+:ICSM05";"Comparative Analysis of Porting Strategies in J2ME Games";34;1607626600526;
"AMC+:SPLC05";"Extracting and Evolving Mobile Games Product Lines";147;1607631828821;
"A:ECOOP05";"Open Modules: Modular Reasoning About Advice";314;1611060363240;
"BEM:RISE05";"Can Aspects Implement Contracts";34;1607632909957;
"DNS:JACM05";"Simplify: A Theorem Prover for Program Checking";960;1611061444532;
"SGB05";"A Taxonomy of Variability Realization Techniques: Research Articles";612;1611062526153;
"BDN:OOPSLA05";"ClassboxJ: Controlling the Scope of Change in Java";152;1611063608012;
"KM:ICSE05";"Aspect-Oriented Programming and Modular Reasoning";407;1608293800150;
"BL:PASTE05";"Weakest-Precondition of Unstructured Programs";289;1612945368420;
"H:AUSE05";"Fundamental Nonmodularity in Electronic Mail";47;1612946450019;
"CKLP:FMCO05";"Beyond Assertions: Advanced Specification and Verification with JML and ESCJava2";298;1611064690253;
"BCC+05";"An Overview of JML Tools and Applications";835;1612947531132;
"LKF:AUSE05";"Modular Verification of Open Features Using Three-Valued Model Checking";64;1612948613713;
"CA:GPCE05";"Mapping Features to Models: A Template Approach Based on Superimposed Variants";735;1611065773204;
"LS05";"Extending Design by Contract for Aspect-Oriented Programming";20;1612949695554;
"FK:VSTTE05";"Decomposing Verification Around End-User Features";22;1612963760266;
"ALRS05";"FeatureC++: On the Symbiosis of Feature-Oriented and Aspect-Oriented Programming";235;1611066855944;
"W05";"Formalization and Type-Soundness Proof for Featherweight Java in Coq";-2;1608294881799;
"JavaSpec";"The Java Language Specification, Third Edition";-2;1608295963303;
"PBL05";"Software Product Line Engineering: Foundations, Principles and Techniques";4554;1611067938939;
"T05";"Enabling the Smooth Integration of Core Assets: Defining and Packaging Architectural Rules for a Family of Embedded Products";15;1611069020629;
"BSTRC05";"Using Java CSP Solvers in the Automated Analyses of Feature Models";101;1612970250059;
"KC05";"Synchronizing Cardinality-Based Feature Models and Their Specializations";63;1612975658139;
"CHE05b";"Staged Configuration through Specialization and Multi-Level Configuration of Feature Models";636;1612976739629;
"WLSZP05";"A Semantic Web Approach to Feature Modeling and Verification";122;1612981065990;
"CHE05a";"Formalizing Cardinality-Based Feature Models and Their Specialization";836;1613146324349;
"CK05";"Cardinality-Based Feature Modeling and Constraints: A Progress Report";356;1611070102325;
"BTRC05";"Using Constraint Programming to Reason on Feature Models";115;1608297046198;
"useBTRC05";"Automated Reasoning on Feature Models";828;1608298128464;
"SZLW05";"Formal Semantics and Verification for Feature Modeling";193;1614960906074;
"B05";"Feature Models, Grammars, and Propositional Formulas";1538;1614961988029;
"LAMS05";"Tool Support for Feature-Oriented Software Development - FeatureIDE: An Eclipse-Based Approach";76;1611071183369;
"S:AIEDAM04";"Product Platform Design and Customization: Status and Promise";826;1617627789728;
"LH:PLDI04";"Jedd: A BDD-Based Relational Extension of Java";85;1616234817901;
"MS:ITVL04";"A 10-Gbps Full-AES Crypto Design with a Twisted BDD S-Box Architecture";222;1616235899486;
"PCF04";"Version Control with Subversion";36;1612962679387;
"GHN+:CAV04";"DPLL (T): Fast Decision Procedures";404;1612251667383;
"TBW:PPPJ04";"Solving Non-Clausal Formulas With DPLL Search";118;1612252749972;
"HD:SAT04";"Using DPLL for Efficient OBDD Construction";64;1612253830672;
"BBM:ISESE04";"A Software Product Line Life Cycle Cost Estimation Model";142;1612254911430;
"MFM:SAT04";"Zchaff2004: An Efficient SAT Solver";216;1612255992113;
"WHHS:DAC04";"Refining the SAT Decision Ordering for Bounded Model Checking";34;1612257074723;
"AMS:JUCS04";"Mince: A Static Global Variable-Ordering for SAT and BDD";36;1612258156123;
"SBB+:SAT04";"Combining Component Caching and Clause Learning for Effective Model Counting";246;1612259236907;
"D:ECAI04";"New Advances in Compiling CNF to Decomposable Negation Normal Form";260;1612260318574;
"HR04";"Logic in Computer Science: Modelling and Reasoning About Systems";2249;1612261400096;
"AOH:ASE04";"A Differencing Algorithm for Object-Oriented Programs";191;1612899779017;
"W+:IBM04";"Eclipse: A Platform for Integrating Development Tools";164;1608203650315;
"HSJ+04";"Fast Backtrack-Free Product Configuration using a Precompiled Solution Space Representation";123;1607088257088;
"PH:Interfaces04";"Linking Product Variety to Order-Fulfillment Strategies";290;1611072264984;
"TBG:VLHCC04";"Managing Duplicated Code with Linked Editing";231;1611073347265;
"MPY+:ICSE04";"Skoll: Distributed Continuous Quality Assurance";131;1611074428038;
"GLRW:ICSR04";"Towards Generating Acceptance Tests for Product Lines";46;1613160383686;
"DL:HASE04";"Software Fault Tree Analysis for Product Lines";76;1613167955811;
"DHT:IST04";"Verifying Haskell Programs by Combining Testing, Model Checking and Interactive Theorem Proving";30;1614963070121;
"M:STVR04";"Search-Based Software Test Data Generation: A Survey: Research Articles";-2;1611075509645;
"P:SoSyM04";"Plug-and-Play Composition of Features and Feature Interactions with Statechart Diagrams";61;1614964151656;
"BFKH:ASE04";"Parameterized Interfaces for Open System Verification of Product Lines";40;1614965232434;
"HP04";"Finding Bugs is Easy";1171;1614966313503;
"KWA:TSE04";"Software Fault Interactions and Implications for Software Testing";871;1614967395916;
"SK:EIWAS04";"PCDiff: Attacking the Fragile Pointcut Problem";201;1611076591918;
"KFG:FSE04";"Verifying Aspect Advice Modularly";147;1614968477169;
"MO:FSE04";"Variability Management with Feature-Oriented Programming and Aspects";314;1614969559107;
"BPS:SCP04";"Variability Management with Feature Models";220;1614970641588;
"TTK04";"Product Family Testing: A Survey";139;1611077674418;
"useLS05";"Cona: Aspects for Contracts and Contracts for Aspects";44;1611088453611;
"AC04";"FeaturePlugin: Feature Modeling Plug-In for Eclipse";372;1611232453282;
"CCHW04";"Eclipse AspectJ: Aspect-Oriented Programming With AspectJ and the Eclipse AspectJ Development Tools";202;1611233534664;
"G04";"A Computer-Checked Proof of the Four Colour Theorem";205;1614971723508;
"SH04";"Experiences Adopting Software Product Line Development without a Product Line Architecture";64;1614972804669;
"BC04";"Interactive Theorem Proving and Program Development - Coq'Art: The Calculus of Inductive Constructions";2344;1611234617114;
"STBMPSF04";"Introducing PLA at Bosch Gasoline Systems: Experiences and Practices";127;1611235698057;
"ZZM04";"A Propositional Logic-Based Method for Verification of Feature Models";182;1614973886699;
"useCHE05b";"Staged Configuration Using Feature Models";694;1614977132302;
"AMS04";"Using a Configurator for Modelling and Configuring Software Product Lines based on Feature Models";52;1614978214857;
"BHST04";"Semantics of Feature Diagrams";-2;1608299209391;
"BSR04";"Scaling Step-Wise Refinement";1204;1608300291056;
"ES:ENTCS03";"Temporal Induction by Incremental SAT Solving";458;1617952459632;
"CGJ+:JACM03";"Counterexample-Guided Abstraction Refinement for Symbolic Model Checking";1082;1617953541196;
"GS:OOPSLA03";"Software Factories: Assembling Applications with Patterns, Models, Frameworks and Tools";1646;1617628871203;
"J:SBCCI03";"A Consumer Report on BDD Packages";28;1616236982440;
"AMS:GLSVLSI03";"FORCE: A Fast and Easy-to-Implement Variable-Ordering Heuristic";106;1612262481665;
"C03";"Predicting When Product Line Investment Pays";49;1612263563975;
"SS:BOICCAD03";"GRASP - A New Search Algorithm for Satisfiability";1448;1612264645154;
"HD:IJCAI03";"A Structure-Based Variable Ordering Heuristic for SAT";62;1612265727916;
"BDP:FOCS03";"Algorithms and Complexity Results for SAT and Bayesian Inference";160;1612266808808;
"FV:SPE03";"Software Product Line Migration and Deployment";107;1607446604904;
"B:ICSE03";"A Tutorial on Feature-Oriented Programming and Product Lines";70;1617268226833;
"MC:PFE03";"Theorem Proving for Product Line Model Verification";62;1613169038077;
"BG:PFE03";"PLUTO: A Test Methodology for Product Families";108;1611236780343;
"CGMC:ICSE03";"Constructing Test Suites for Interaction Testing";480;1614979296143;
"H:JMLC03";"The Verifying Compiler: A Grand Challenge for Computing Research";459;1611237862079;
"AK03";"Model-Driven Development: A Metamodeling Foundation";1307;1611238944150;
"KM:CONQUEST03";"Challenges in Testing Software Product Lines";-2;1614980378134;
"H:NODe03";"Object Teams: Improving Modularity for Crosscutting Collaborations";207;1611240026081;
"BS03";"Abstract State Machines: A Method for High-Level System Design and Analysis";4;1611241108010;
"SDNB:ECOOP03";"Traits: Composable Units of Behaviour";518;1611242189449;
"MO:AOSD03";"Conquering Aspects with Caesar";389;1614981458904;
"LG03";"Analysis of a Software Product Line Architecture: An Experience Report";42;1611243271706;
"CKMR03";"Feature Interaction: A Critical Review and Considered Forecast";494;1611244353653;
"ZR03";"Pipa: A Behavioral Interface Specification Language for AspectJ";84;1611245436229;
"B03";"Composition and Construction of Embedded Software Families";62;1615182959447;
"SRP03";"Details of Formalized Relations in Feature Models Using OCL";92;1615184041046;
"CBBHROA03";"Automating Feature-Oriented Domain Analysis";37;1615185123971;
"R03";"Towards a More Precise Definition of Feature Models";142;1615186205655;
"M:TC02";"Streaming BDD Manipulation";18;1616238063158;
"DR:MBMV02";"Implementation and Visualization of a BDD Package in Java";1;1612267891871;
"KMS:FOCS02";"MONA Implementation Secrets";104;1612268974531;
"VDB:IWLS02";"Improving Static Ordering of BDDs for Reachability Analysis";0;1612420114963;
"D:ISMVL02";"Evaluation of Static Variable Ordering Heuristics for MDD Construction";18;1612421196672;
"DP02";"Introduction to Lattices and Order";6882;1612422276742;
"D:AAAI02";"A Compiler for Deterministic, Decomposable Negation Normal Form";108;1612423359670;
"MGR:ICDE02";"Similarity Flooding: A Versatile Graph Matching Algorithm and Its Application to Schema Matching";2024;1612900731305;
"SGM02";"Component Software - Beyond Object-Oriented Programming";9234;1608204732514;
"DM:JAIR02";"A Knowledge Compilation Map";751;1612969168282;
"K:SPLC02";"Variation Management for Software Production Lines";192;1617276884426;
"KKI:TSE02";"CCFinder: A Multilinguistic Token-based Code Clone Detection System for Large Scale Source Code";1890;1611246517789;
"M:TSE02";"A State-of-the-Art Survey on Software Merging";671;1613147405709;
"FF:ICFP02";"Contracts for Higher-Order Functions";514;1615188368734;
"ABGM:TSE02";"Using Version Control Data to Evaluate the Impact of Software Tools: A Case Study of the Version Editor";98;1611247600338;
"CK:Software02";"Point  Counterpoint: Being Proactive Pays Off  Eliminating the Adoption Barrier";81;1611248683049;
"CL:FOAL02";"Observers and Assistants: A Proposal for Modular Aspect-Oriented Reasoning";152;1611249764400;
"KLD:Software02";"Feature-Oriented Product Line Engineering";826;1613745354564;
"UT:AOSD02";"Aspect-Oriented Programming with Model Checking";86;1613746436758;
"L02";"Specifying Systems: The TLA+ Language and Tools for Hardware and Software Engineers";0;1611250846315;
"FLL+:PLDI02";"Extended Static Checking for Java";1791;1613747519150;
"SB02";"Mixin Layers: An Object-Oriented Implementation Technique for Refinements and Collaboration-Based Designs";412;1611251926859;
"LKF02";"Verifying Cross-Cutting Features as Open Systems";106;1613748600842;
"K:PFE02";"Easing the Transition to Software Mass Customization";448;1613749686510;
"APB:SCAM02";"Handling Preprocessor-Conditioned Declarations";51;1613750767321;
"B02";"Test Driven Development: By Example";3583;1611253007488;
"KLD:S02";"Feature-Oriented Product Line Engineering";826;1613751850319;
"SS:TOSEM02";"Behavior-Consistent Specialization of Object Life Cycles";134;1613752932314;
"SP02";"Aspect-Oriented Programming with C and .NET";79;1613754014312;
"SGSP02";"AspectC++: An Aspect-Oriented Extension to the C++ Programming Language";472;1611254089221;
"LKF:ASE02";"Interfaces for Modular Feature Verification";54;1613755096126;
"K02";"AspectC: An AOSD implementation for C";67;1611255171263;
"NPW02";"IsabelleHOL - A Proof Assistant for Higher-Order Logic";3915;1610579215087;
"P02";"Types and Programming Languages";3296;1613756178994;
"vDK02";"Domain-Specific Language Design Requires Feature Descriptions";398;1615189451661;
"RBSP02";"Extending Feature Diagrams with UML Multiplicities";311;1615190534516;
"BLHM02";"Generating Product-Lines of Product-Families";112;1615195946193;
"dJV02";"Grammars as Feature Diagrams";42;1615197028289;
"M02";"Using First-Order Logic for Product Line Model Validation";329;1615198109442;
"CBRZ:FMSD01";"Bounded Model Checking Using Satisfiability Solving";885;1618219469053;
"DGS:CADICS01";"Using Lower Bounds During Dynamic BDD Minimization";88;1616239144563;
"HS:ICCD01";"BDD Variable Ordering by Scatter Search";27;1616240227214;
"DV:SBCCI01";"Optimizing BDD-Based Verification Analysing Variable Dependencies";2;1612424440679;
"AMS:ICCAD01";"Faster SAT and Smaller BDDs via Common Function Structure";75;1612425521955;
"RV01";"Handbook of Automated Reasoning";690;1612426602862;
"J:IWLS01";"Design of a Pointerless BDD Package";31;1612427685100;
"GT:IWPSE01";"Growth, Evolution, and Structural Change in Open Source Software";135;1612428766927;
"BFG+:PFE01";"Variability Issues in Software Product Lines";330;1612429849833;
"MMC+:DAC01";"Chaff: Engineering an Efficient SAT Solver";4499;1612430437139;
"D:ANCL01";"On the Tractable Counting of Theory Models and Its Application to Truth Maintenance and Belief Revision";129;1612434105428;
"NW01";"Computing Small Clause Normal Forms";265;1612435187682;
"D:JACM01";"Decomposable Negation Normal Form";375;1612436269772;
"KKT:ASE11";"A Rule-Based Approach to the Semantic Lifting of Model Differences in the Context of Model Versioning";102;1608205814486;
"GYK:ICSE01";"Exploiting the Map Metaphor in a Tool for Software Evolution";143;1608206895399;
"SBF:IJPE01";"Mass Customization: Literature Review and Research Directions";1847;1611256251944;
"C:APSEC01";"Applying mutation analysis for object-oriented programs using a reflective approach";64;1615199191914;
"RUCH:TSE01";"Prioritizing Test Cases for Regression Testing";1404;1615285595088;
"MJ01";"Testing a Software Product Line";245;1615362844791;
"FLF:ESECFSE01";"Behavioral Contracts and Behavioral Subtyping";104;1615363926596;
"NCA:REFLECTION01";"Supporting Formal Verification of Crosscutting Concerns";31;1615365008567;
"B2001";"Software Product Lines: Organizational Alternatives";146;1611257333602;
"FL:FME01";"Houdini, an Annotation Assistant for ESCJava";462;1615366090396;
"LB:GCSE01";"A Standard Problem for Evaluating Product-Line Methodologies";240;1615367171564;
"PR01";"Feature Integration Using a Feature Construct";160;1615368253516;
"CN01";"Software Product Lines: Practices and Patterns";6;1611258415153;
"Sch01";"Automated Theorem Proving in Software Engineering";135;1615369335993;
"FK01";"Modular Verification of Collaboration-Based Software Designs";116;1615370417244;
"KHHKPG01";"An Overview of AspectJ";4365;1615371498007;
"AG01";"Implementing Product Line Variabilities";367;1615372579718;
"IPW01";"Featherweight Java: A Minimal Core Calculus for Java and GJ";1120;1611259497890;
"vGBS01";"On the Notion of Variability in Software Product Lines";837;1615373662460;
"S01";"User Interface Design for Programmers";188;1608301374056;
"DG:VLSI00";"History-Based Dynamic Minimization During BDD Construction";5;1616241308455;
"MJR+:DAC00";"To Split or to Conjoin: The Question in Image Computation";105;1616242390012;
"BP:AAAI00";"Counting Models Using Connected Components";229;1612437352254;
"L:AI00";"On the Complexity of Choosing the Branching Literal in DPLL";67;1612438433535;
"HS:AR01";"Local Search Algorithms for SAT: An Empirical Evaluation";228;1612439514642;
"S00";"The C++ Programming Language";8279;1615382318060;
"DWMB:JOM00";"Approaches to Mass Customization: Configurations and Empirical Validation";1090;1611260580639;
"CR:IWPC00";"Case Study of Feature Location Using Dependence Graph";352;1614976051251;
"H:FSE00";"Testing: A Roadmap";572;1611261661916;
"EMR:SEN00";"Prioritizing Test Cases for Regression Testing";1468;1613148486291;
"OLKM00";"The Koala Component Model for Consumer Electronics Software";1058;1613149567038;
"HP:STTT00";"Model Checking Java Programs Using Java PathFinder";1044;1613150648094;
"VHBP:ASE00";"Model Checking Programs";1887;1613151729341;
"HA:FSE00";"Composing Features and Resolving Interactions";92;1613152810691;
"BCS:SPLC00";"Object-Oriented Frameworks and Product Lines";149;1613153892690;
"KPRS:GCSE00";"Aspect Composition Applying the Design by Contract Principle";70;1608302456654;
"B00";"A Run-time Assertion Checker for Java Using JML";46;1613154974634;
"SB00";"Issues Concerning Variability in Software Product Lines";106;1613156055765;
"CE00";"Generative Programming: Methods, Tools, and Applications";4715;1611262744073;
"F00";"Refactoring: Improving the Design of Existing Code";61;1611263825167;
"SHB+:TC99";"Static and Dynamic Configurable Systems";119;1617629952754;
"FRU:MS99";"Component Sharing in the Management of Product Variety: A Study of Automotive Braking Systems";479;1612440596390;
"BR99";"Modern Information Retrieval";18645;1612900803078;
"GK:XPS99";"Knowledge-Based Configuration: Survey and Future Directions";126;1611577675335;
"Binder99";"Testing Object-oriented Systems: Models, Patterns, and Tools";2332;1611264907065;
"BFK+:SSR99";"PuLSE: A Methodology to Develop Software Product Lines";600;1611265988761;
"CCGR:CAV99";"NuSMV: A New Symbolic Model Verifier";847;1611267071269;
"TOHS:ICSE99";"N Degrees of Separation: Multi-Dimensional Separation of Concerns";1988;1611268154390;
"CGP99";"Model Checking";14136;1613158220626;
"PMDL99";"Extending Software Quality Assessment Techniques to Java Systems";90;1613159302966;
"IPW99";"Featherweight Java: A Minimal Core Calculus for Java and GJ";1095;1611269235587;
"SW:IS98";"Product Configuration Frameworks: A Survey";730;1617631035065;
"YBO+:FMCAD98";"A Performance Study of BDD-Based Model Checking";116;1616243471843;
"YCB+:ASPDAC98";"Space- and Time-Efficient BDD Construction Via Working Set Control";48;1616417904382;
"HB:ICCAD98";"Design of Experiments in BDD Variable Ordering: Lessons Learned";35;1616418985893;
"JAF:ICCAD98";"Sampling Schemes for Computing OBDD Variable Orderings";40;1616420068280;
"MD:ISMVL98";"Implementing a Multiple-Valued Decision Diagram Package";129;1616421150163;
"L:ICCAD98";"The Design of a Cache-Friendly BDD Library";28;1616422232535;
"D:STACS98";"On the Existence of Polynomial Time Approximation Schemes for OBDD Minimization";38;1616423313921;
"DB98";"Binary Decision Diagrams: Theory and Implementation";279;1612441678078;
"WR:ITVL98";"FPGA routing and routability estimation via Boolean satisfiability";196;1612442759207;
"MH:FMCAD98";"BDDNOW: A Parallel BDD Package";73;1612443841265;
"NR:ESREL98";"Heuristics for BDD Handling of Sum-of-Products Formulae";12;1616424395673;
"MT98";"Algorithms and Data Structures in VLSI Design: OBDD-Foundations and Applications";424;1610823884561;
"SP98";"Gems of Theoretical Computer Science";52;1618133254574;
"AH:MOR98";"On Local Search for Weighted K-Set Packing";112;1612903276440;
"HK:JR98";"Variety for Sale: Mass Customization or Mass Confusion";1273;1611507400246;
"JZ:TSE98";"Distributed feature composition: a virtual architecture for telecommunications services";321;1611508481709;
"K:TOOLS98";"iContract - The Java(Tm) Design by Contract(Tm) Tool";-2;1608303537578;
"KC98";"JPP: A Java Pre-Processor";17;1611509564161;
"BCK98";"Software Architecture in Practice";9433;1615401794044;
"L:OOPSLA98";"Data Groups: Specifying the Modification of Extended State";205;1611510645949;
"CW:CSUR98";"Version Models for Software Configuration Management";969;1615402876450;
"BM:ICSE98";"Conceptual Module Querying for Software Reengineering";69;1615403957590;
"TWFL:IWSSD98";"Feature Engineering";-2;1615405038763;
"ML:OOPSLA98";"Adaptive Plug-and-Play Components for Evolutionary Software Development";281;1615406120942;
"FKF:POPL98";"Classes and Mixins";564;1615407202606;
"SB:ECOOP98";"Implementing Layered Designs with Mixin Layers";391;1615408285369;
"GFA98";"Integrating Feature Modeling with the RSEB";922;1615409367263;
"KKLKKS98";"FORM: A Feature-Oriented Reuse Method with Domain-Specific Reference Architectures";1549;1611511727888;
"BBR:ESREL97";"BDD-Based Fault-Tree Processing: A Comparison of Variable Ordering Heuristics";77;1616425477407;
"YO:PPoPP97";"Parallel Breadth-First BDD Construction";41;1616426558774;
"MS97";"Applied Mathematical Programming Using Algebraic Systems";284;1612446006331;
"MVH:JSEP97";"Program Understanding Behaviour During Enhancement of Large-Scale Software";95;1612447087753;
"LPM+:97";"Assessing the Benefits of Incorporating Function Clone Detection in a Development Process";287;1608207976090;
"H:TSE97";"The Model Checker SPIN";5134;1615410449147;
"N97";"Proof-Carrying Code";2580;1608304618731;
"JM97";"Design by Contract: The Lessons of Ariane";372;1611512809100;
"M97";"Advanced Compiler Design and Implementation";3993;1608305701160;
"C97";"Type Systems";625;1615411531832;
"P97";"Feature-Oriented Programming: A Fresh Look at Objects";609;1611513889973;
"KLMMLLI97";"Aspect-Oriented Programming";10275;1615413696366;
"TSMS96";"State-of-the-Practice in Product Configuration: A Survey of 10 Cases in the Finnish Industry";139;1617632116159;
"SRB+:DAC96";"High Performance BDD Package by Exploiting Memory Hierarchy";103;1616427641413;
"NJF+:ICCAD96";"Partitioned ROBDDs - A Compact, Canonical and Efficiently Manipulable Representation for Boolean Functions";180;1616428723017;
"BW:TC96";"Improving the Variable Ordering of OBDDs is NP-Complete";787;1616429805627;
"S:FMCAD96";"A Brief Study of BDD Package Performance";31;1616430886874;
"ZBC:ISCAS96";"Improved Variable Ordering of BDDs with Novel Genetic Algorithm";47;1616431969237;
"SB:DAC96";"Implementation of an efficient parallel BDD package";120;1612448170135;
"HDB:EURODAC96";"More: An Alternative Implementation of BDD Packages by Multi-Operand Synthesis";59;1612449250888;
"GPFB96";"Algorithms for the Satisfiability (SAT) Problem: A Survey";467;1612450332362;
"CRG+:SIGMOD96";"Change Detection in Hierarchically Structured Information";769;1608209057221;
