"HS:SC13";"Reusable Components for Lightweight Mechanisation of Programming Languages";9;1616170496720;
"MRG:GPCE13";"Investigating Preprocessor-Based Syntax Errors";50;1616171579500;
"MRKN:iFM13";"Compositional Verification of Software Product Lines";30;1616172661849;
"BDS13";"Compositional Type Checking of Delta-Oriented Software Product Lines";50;1616173744132;
"KKL13";"Introduction to Combinatorial Testing";229;1617027937182;
"HPP+:SPLC13";"Multi-Objective Test Generation for Software Product Lines";122;1616758616206;
"KSS:VariComp13";"Towards Efficient SPL Testing by Variant Reduction";16;1617029019109;
"M13";"JML-Based Verification for Feature-Oriented Programming";8;1617030100497;
"IHE+:ICCAD13";"Formal Verification of Distributed Dynamic Thermal Management";15;1617031181954;
"KRHA:GPCE13";"A Comparison of Product-Based, Feature-Based, and Family-Based Type Checking";43;1617032263731;
"LKA+:ESECFSE13";"Scalable Analysis of Variable Software";176;1617033345958;
"KMKB:ESECFSE13";"SPLat: Lightweight Dynamic Analysis for Reducing Combinatorics in Testing Configurable Systems";67;1610104749665;
"DDJS13";"Verifying Traits: An Incremental Proof System for Fine-Grained Reuse";13;1610105831713;
"PGT+:SPLC13";"Coevolution of Variability Models and Related Artifacts: A Case Study from the Linux Kernel";67;1610106913903;
"RLK+13";"Quantifying the Effects of Aspectual Decompositions on Design by Contract Modularization: A Maintenance Study";8;1610107996400;
"BMB+:PLDI13";"SPLLIFT: Statically Analyzing Software Product Lines in Minutes Instead of Years";101;1610109077812;
"HTH13";"Separation of Concerns in Feature Diagram Languages: A Systematic Survey";33;1610110159091;
"SK:JUCS13";"Modeling and Verification of Reconfigurable Actor Families";5;1617034427713;
"SK:FSEN13";"Delta Modeling and Model Checking of Product Families";15;1617035509131;
"I13";"Methodology for the Derivation of Product Behaviour in a Software Product Line";12;1617036590216;
"HB:FHIES13";"Enhancing Product Line Development by Safety Requirements and Verification";7;1617122228735;
"FKA+:EMSE13";"Do Background Colors Improve Program Comprehension in the Ifdef Hell";115;1617647263693;
"RCC:SPLC13";"Managing Cloned Variants: A Framework and Experience";113;1610111241105;
"D13";"Feature Modularity in Mechanized Reasoning";0;1607896153536;
"SST:MultiPLE13";"Towards Modular Analysis of Multi Product Lines";34;1616752127618;
"ABKS13";"Feature-Oriented Software Product Lines";-2;1613935332367;
"useRLB+:AOSD14";"AspectJML: Modular Specification and Runtime Checking for Crosscutting Contracts";23;1610112323100;
"PB13";"Separation Logic for Object-Oriented Programming";13;1616753209726;
"BLP:FMSPLE13";"Combining Declarative and Procedural Views in the Specification and Analysis of Product Families";34;1616754290284;
"useBLP:FMSPLE13";"Combining Declarative and Procedural Views in the Feature-Oriented Specification and Analysis of Product Families";0;1607897234909;
"BRT+13";"Intraprocedural Dataflow Analysis for Software Product Lines";66;1616755371271;
"CCS+13";"Featured Transition Systems: Foundations for Verifying Variability-Intensive Systems and Their Application to LTL Model Checking";218;1610113404780;
"W13";"Methoden-basierte Komposition von Kontrakten in Feature-orientierter Programmierung";4;1616756452011;
"LLKK:ICSR13";"Validating Consistency between a Feature Model and Its Implementation";26;1616757534203;
"CCH+:SPLC13";"ProVeLines: A Product Line of Verifiers for Software Product Lines";80;1610114487120;
"HSB:CADE13";"Reuse in Software Verification by Abstract Method Calls";31;1616760779412;
"WHSS:MAPLESCALE13";"Interface Variability in Family Model Mining";40;1616761861095;
"SSA:FMSPLE13";"Variability-Aware Safety Analysis Using Delta Component Fault Diagrams";14;1616762943052;
"LC:SCP13";"A Systematic Mapping Study on Software Product Line Evolution: From Legacy System Reengineering to Product Line Refactoring";110;1610115568240;
"CCH+:ASAS13";"Model Checking Adaptive Software with Featured Transition Systems";47;1616764025399;
"CSHL:ICSE13";"Beyond Boolean Product-Line Model Checking: Dealing with Feature Attributes and Multi-Features";100;1610116649970;
"ARTK13";"Feature-Interaction Detection Based on Feature-Based Specifications";86;1616765106557;
"T:ISSTA13";"Product-Line Verification with Feature-Oriented Contracts";4;1616766188536;
"TAZ+:MASPEGHI13";"Subclack: Feature-Oriented Programming with Behavioral Feature Interfaces";14;1610117731450;
"HLC:ICSE13";"Efficient Quality Assurance of Variability-Intensive Systems";2;1607898316915;
"RLL+:FOAL13";"Modular Aspect-Oriented Design Rule Enforcement with XPIDRs";13;1616767270450;
"C13";"Test Case-Aware Combinatorial Interaction Testing";38;1616768352928;
"PFP+:ICSE13";"What Good Are Strong Specifications";55;1616769433711;
"DOS:POPL13";"Meta-Theory a la Carte";57;1607899398508;
"RC:ICSE13";"A Framework for Managing Cloned Product Variants";62;1616770516442;
"EW:GTTSE13";"Variation Programming with the Choice Calculus";31;1616771597773;
"EORW:VaMoS13";"Adding Configuration to the Choice Calculus";5;1616774841154;
"BM13";"C4J: Contracts, Java und Eclipse";-2;1610118814291;
"GBS13";"ReFlO: An Interactive Tool for Pipe-And-Filter Domain Specification and Program Generation";9;1610119896292;
"ARW+:ICSE13";"Strategies for Product-Line Verification: Case Studies and Experiments";164;1610120979052;
"AKL13";"Language-Independent and Automated Software Composition: The FeatureHouse Experience";132;1610122061025;
"STSS:VaMoS13";"Automated Analysis of Dependent Feature Models";26;1607900479783;
"RAK+:VaMoS13";"The PLA Model: On the Combination of Product-Line Analyses";48;1610123141611;
"MHGH:SMT12";"An SMT-Based Approach to Automated Configuration";15;1618217307093;
"R:AIJ12";"Planning as Satisfiability: Heuristics";162;1618218388434;
"H:JSS12";"A Longitudinal Case Study of an Emerging Software Ecosystem: Implications for Practice and Theory";139;1617622379048;
"HD:IWSECO12";"Theoretical Foundations of Software Ecosystems";80;1617623458906;
"BWB:BISE12";"Software Ecosystems";57;1617624541524;
"BNGR:JSEP12";"Formalizing Interactive Staged Feature Model Configuration";43;1611856934025;
"LCF+:TASE12";"A Succinct and Efficient Implementation of a 2 32 BDD Package";2;1610820641421;
"M:JSW12";"Biddy - a Multi-platform Academic BDD Package";5;1610821722181;
"BCHH:CPAIOR12";"Variable Ordering for the Application of Bdds to the Maximum Independent Set Problem";41;1610822802821;
"RPK:SCP12";"Automatic Library Migration for the Generation of Hardware-In-The-Loop Models";30;1612775503775;
"KKPS:ASE12";"Adaptability of Model Comparison Tools";50;1612776585437;
"BCW12";"Model-Driven Software Engineering in Practice";1179;1612777666674;
"RJ12";"Use of Global Consistency Checking for Exploring and Refining Relationships between Distributed Models: A Case Study";6;1612778747751;
"KKOS:ICSM12";"Understanding Model Evolution Through Semantically Lifting Model Differences With SiLift";48;1608159165436;
"FKLW:ICSM12";"Search-Based Detection of High-Level Model Changes";48;1608160248218;
"DTS+:SPLC12";"A Robust Approach for Variability Extraction from the Linux Build System";87;1617658079365;
"TSP+:ISRN12";"Secure and Customizable Data Management for Automotive Systems: A Feasibility Study";8;1607429303463;
"CGR+:VaMoS12";"Cool Features and Tough Decisions: A Comparison of Variability Modeling Approaches";323;1611576594375;
"VGD:FSE12";"Green: Reducing, Reusing and Recycling Constraints in Program Analysis";130;1610124223773;
"HXC:VaMoS12";"A User Survey of Configuration Challenges in Linux and eCos";70;1610390878787;
"SKK+:ICSE12";"Predicting Performance via Automated Feature-Interaction Detection";213;1607674547362;
"SRK+:SQJ12";"SPL Conqueror: Toward Optimization of Non-functional Properties in Software Product Lines";159;1610391960634;
"NNP+:TSE12";"Clone Management for Evolving Software";127;1613733454075;
"HRGL:SPLC12";"Using Regression Testing to Analyze the Impact of Changes to Variability Models on Products";32;1613162547926;
"ALL:ASE12";"Structured Merge with Auto-Tuning: Balancing Precision and Performance";68;1610393041881;
"ZFSZ:CSMR12";"Feature Identification from the Source Code of Product Variants";106;1617262818518;
"DGK+:ICST12";"An Empirical Study of Pre-Release Software Faults in an Industrial Product Line";12;1607917389505;
"YH:STVR12";"Regression Testing Minimization, Selection and Prioritization: A Survey";1310;1610396287662;
"HZDK:ICSM12";"Recovering Commit Dependencies for Selective Code Integration in Software Product Lines";7;1607918917087;
"BEG:CASCON12";"Grammar-based Test Generation for Software Product Line Feature Models";23;1607919999764;
"AHC+:CAiSE12";"Feature Model Differences";51;1607921082709;
"SGB+:VaMoS12";"BeTTy: Benchmarking and Testing on the Automated Analysis of Feature Models";123;1610397369118;
"TSD+:OOPSLA12";"Gradual Typing for First-Class Classes";73;1613173365696;
"MJ:FOAL12";"Design by Contract for Aspects, by Aspects";4;1613174448588;
"HFA+12";"Exemplar Driven Development of Software Product Lines";8;1613175530846;
"EBG:CAiSE12";"Evolutionary Search-Based Test Generation for Software Product Line Feature Models";106;1613176612753;
"CCS+:VaMoS12";"Managing Evolution in Software Product Lines: A Model-Checking Perspective";37;1610398450956;
"BGM:SPLC12";"Demonstration of a Model Checker for the Analysis of Product Variability";8;1613177694480;
"GG:PLDI12";"SuperC: Parsing All of C by Taming the Preprocessor";97;1610399531470;
"SLW:12";"Multi-Perspectives on Feature Models";51;1613178776529;
"HTGE12";"Managing Emerging Configuration Dependencies in Multi Product Lines";20;1610400613245;
"CMSE:SEN12";"Strategies for Testing Products in Software Product Lines";62;1613179857600;
"LSKL:TAP12";"Incremental Model-Based Testing of Delta-oriented Software Product Lines";103;1613180938913;
"DT+:MISS12";"Understanding Linux Feature Distribution";48;1613182020436;
"MHF:SPLC12";"An Algorithm for Generating T-Wise Covering Arrays from Large Feature Models";222;1613183102340;
"useHPP+:TSE14";"Bypassing the Combinatorial Explosion: Using Similarity to Generate and Prioritize T-Wise Test Suites for Large Software Product Lines";35;1610401695466;
"JHF+:MODELS12";"Generating Better Partial Covering Arrays by Modeling Weights on Sub-Product Lines";81;1607681037597;
"POS+:SQJ12";"Pairwise Testing for Software Product Lines: Comparison of Two Approaches";170;1610403860536;
"O:PhD12";"Feature Model-Based Software Product Line Testing";20;1613184184653;
"WRH+12";"Experimentation in Software Engineering";7151;1607922164422;
"KS:COORDINATION12";"Using Coordinated Actors to Model Families of Distributed Systems";4;1613185267162;
"ABFG:ISoLA12";"A Compositional Framework to Derive Product Line Behavioural Descriptions";16;1613186348195;
"SJBK:COMPSAC12";"Scheduling and Analysis of Real-Time Software Families";10;1617263899765;
"BMP:SERENE12";"Assume-Guarantee Testing of Evolving Software Product Line Architectures";2;1613716145918;
"PSS:MODIQUITOUS12";"Test Modeling for Context-aware Ubiquitous Applications with Feature Petri Nets";17;1607923247387;
"FKL+:ICPC12";"Measuring Programming Experience";99;1617264981117;
"S12";"Framework for Measuring Program Comprehension";15;1612972412028;
"RLBC:SPLC12";"Managing Forked Product Variants";59;1617266062537;
"HGR:IST12";"A Systematic Review and an Expert Survey on Capabilities Supporting Multi Product Lines";126;1617267144326;
"JHS:FMCO12";"ABS: A Core Language for Abstract Behavioral Specification";364;1610404943286;
"LKL:SPLC12";"A Survey on Software Product Line Testing";99;1617279048053;
"DCP+:ISoLA12";"A Vision for Behavioural Model-Driven Validation of Software Product Lines";19;1607924329518;
"SK:FSEN12";"Efficient Verification of Evolving Software Product Lines";12;1617280130107;
"SLC12";"Towards Fully-Fledged Reverse Inheritance in Eiffel";7;1617281211301;
"CSHL:FMSPLE12";"Towards an Incremental Automata-Based Approach for Software Product-Line Model Checking";25;1617282293271;
"CSHL:SPLC12";"Behavioural Modelling and Verification of Real-Time Software Product Lines";55;1617283375723;
"CCH+12";"Model Checking Software Product Lines with SNIP";114;1617284458191;
"KKB:ISSRE12";"Shared Execution for Efficiently Testing Product Lines";62;1617285540928;
"KRE+:FOSD12";"Toward Variability-Aware Testing";93;1617286622897;
"useCEW:TOPLAS14";"An Error-Tolerant Type System for Variational Lambda Calculus";47;1617287704330;
"HK:WCRE12";"Reverse Engineering Variability in Source Code Using Clone Detection: A Case Study for Linux Variants of Consumer Electronic Devices";36;1610409271064;
"TB12";"Entwicklung von Softwarevarianten mit FeatureIDE";-2;1607925412293;
"XXJ:WCRE12";"Feature Location in a Collection of Product Variants";89;1617288786425;
"ACG+:VaMoS12";"On Extracting Feature Models From Product Descriptions";179;1617289868566;
"LSZ12";"Featherweight Jigsaw - Replacing Inheritance by Composition in Java-like Languages";20;1617290949923;
"HS:ISoLA12";"A Liskov Principle for Delta-Oriented Programming";44;1617292031513;
"MAG:WASP12";"Formal Specification and Verification of Well-Formedness in Business Process Product Lines";1;1607926493215;
"JHF+:ICTSS12";"A Technique for Agile and Automatic Interaction Testing for Product Lines";26;1617293113080;
"useMRKN:iFM13";"Compositional Verification of Evolving Software Product Lines";3;1617636443922;
"L12";"Variables Nanodatenmanagement fuer eingebettete Systeme";2;1607927575381;
"B12";"Contract-Aware Feature Composition";12;1617637526259;
"GSCH:RE12";"Efficient Consistency Checking of Scenario-Based Product-Line Specifications";25;1617638608808;
"CCP+:ICSE12";"Simulation-Based Abstractions for Software Product-Line Model Checking";76;1617639691822;
"HJD:ConfWS12";"Unifying Software and Product Configuration: A Research Roadmap";30;1610410353919;
"P12";"System Design and Risk Assessment for Safety Critical Control Software Product Lines";1;1616919897812;
"useLKA+:ESECFSE13";"Large-Scale Variability-Aware Type Checking and Dataflow Analysis";18;1617652670909;
"KOE:OOPSLA12";"A Variability-Aware Module System";99;1607928657915;
"useBMB+:PLDI13";"Transparent and Efficient Reuse of IFDS-Based Static Program Analyses for Software Product Lines";0;1607929740810;
"GDS:ICSE12";"Test Confessions: A Study of Testing Practices for Plug-in Systems";75;1610411436033;
"HBC+12";"A Code Tagging Approach to Software Product Line Development";26;1617653753535;
"RC:FASE12";"Combining Related Products into Product Lines";111;1617654835925;
"SCRS12";"Mintha: A Framework for Auto-Programming and Testing of Railway Controllers for Varying Clients";1;1610434304045;
"HMZ:RAMiCS12";"Foundations of Coloring Algebra with Consequences for Feature-Oriented Programming";4;1617687086223;
"HMZ12";"Foundations of Coloring Algebra with Consequences for Feature-Oriented Programming";4;1617688620008;
"JLM+12";"A Constraint-Based Variability Modeling Framework";45;1617775021095;
"DS:ISoLA12";"Family-Based Analysis of Type Safety for Delta-Oriented Software Product Lines";28;1618119190363;
"BTG12";"A Theory of Software Product Line Refinement";68;1618120271457;
"SRC+12";"Software Diversity: State of the Art and Perspectives";147;1610436195128;
"BMS:FM12";"VMC: A Tool for Product Variability Analysis";59;1610438358192;
"SCD:FASE12";"Integration Testing of Software Product Lines Using Compositional Symbolic Execution";48;1618122435460;
"HRRS:Monterey12";"Evolving Delta-Oriented Software Product Line Architectures";46;1618123518323;
"BS:FOSD12";"Ensuring Well-Formedness of Configured Domain Models in Model-Driven Product Lines Based on Negative Variability";23;1618124599677;
"FOSD12";"Proceedings of the 4th International Workshop on Feature-Oriented Software Development (FOSD)";-2;1607430385396;
"HLL+12";"Behavioral Interface Specification Languages";188;1618125682340;
"DDJ+:FMSPLE12";"A Transformational Proof System for Delta-Oriented Programming";26;1618126764880;
"T:MIT12";"Verification of Software Product Lines Using Contracts";3;1618127846112;
"TSAH:GPCE12";"Family-Based Deductive Verification of Software Product Lines";84;1618128927410;
"KATS:TOSEM12";"Type Checking Annotation-Based Product Lines";168;1607930822877;
"B:PLAS12";"Position Paper: Static Flow-Sensitive and Context-Sensitive Information-Flow Analysis for Software Product Lines";11;1610440522014;
"useBRT+13";"Intraprocedural Dataflow Analysis for Software Product Lines";67;1618130009712;
"ASL+12";"Access Control in Feature-Oriented Programming";64;1618131091634;
"useTAK+:CSUR";"Analysis Strategies for Software Product Lines";86;1618132173059;
"TLD:OSR12";"Configuration Coverage in the Analysis of Large-Scale System Software";84;1607931905506;
"TSK+:FASE12";"Applying Design by Contract to Feature-Oriented Programming";42;1618135416658;
"STKS:VaMoS12";"Variant-Preserving Refactoring in Feature-Oriented Software Product Lines";77;1618136497186;
"BCBB:MODELS11";"Modeling Model Slicers";58;1617945968397;
"HFCC:IET11";"Supporting Commonality-Based Analysis of Software Product Lines";19;1611858015408;
"VAE:ConfWS11";"Enumeration of Valid Partial Configurations";13;1611859096716;
"FJG:CSC11";"Solution Counting for CSP and SAT With Large Tree-Width";3;1611860178037;
"CCG+:REMODD11";"Requirements Definition Document for a Software Product Line of Car Crash Management Systems";25;1612779830240;
"CCGI:CMA11";"OO-SPL Modelling of the Focused Case Study";14;1612780911470;
"PA:CoRR11";"RTED: A Robust Algorithm for the Tree Edit Distance";234;1608161329483;
"LKA:AOSD11";"Analyzing the Discipline of Preprocessor Annotations in 30 Million Lines of C Code";129;1608162412355;
"CBH:SCP11";"A Text-Based Approach to Feature Modelling: Syntax and Semantics of TVL";217;1608583918767;
"PLP11";"A Performance Comparison of Contemporary Algorithmic Approaches for Automated Analysis Operations on Feature Models";52;1607618685851;
"HGS+:JRCS11";"The Effect of Default Options on Choice-Evidence from Online Product Configurators";27;1610441604141;
"OZLG:SPLC11";"Pairwise Feature-Interaction Testing for SPLs: Potentials and Limitations";55;1608163493412;
"useXXJ:WCRE12";"Reengineering Legacy Software Products into Software Product Line Based on Automatic Variability Analysis";34;1617635361472;
"ACLF:ASE11";"Slicing Feature Models";81;1618137579302;
"KSL+:Promise11";"Are Change Metrics Good Predictors for an Evolving Software Product Line";38;1618138660658;
"KLG:MSR11";"Empirical Evaluation of Reliability Improvement in an Evolving Software Product Line";20;1618139743458;
"CMN:STVR11";"On the Use of a Similarity Function for Test Case Selection in the Context of Model-Based Testing";105;1618140824903;
"GC:ISSRE11";"Feature Interaction Faults Revisited: An Exploratory Study";63;1610442685925;
"AB:ICSE11";"A Practical Guide for Using Statistical Tests to Assess Randomized Algorithms in Software Engineering";748;1618142987433;
"HBG:ISSRE11";"PACOGEN: Automatic Generation of Pairwise Test Configurations from Feature Models";86;1610443768211;
"BG:SQJ11";"Assessing the Maintainability of Software Product Line Feature Models Using Structural Metrics";149;1618144070030;
"ALB+:ESECFSE11";"Semistructured Merge: Rethinking Merge in Revision Control Systems";103;1610444849443;
"DKB:WCRE11";"Analyzing the Source Code of Multiple Software Variants for Reuse Potential";74;1618145152827;
"Pa11";"Sustainable Evolution of Product Line Infrastructure Code";-2;1612973494212;
"HHJ+:FMCO11";"HATS Abstract Behavioral Specification: The Architectural View";20;1610445931392;
"W11";"Deductive Verification of Object-Oriented Software: Dynamic Frames, Dynamic Logic, and Predicate Abstraction";70;1610447013272;
"HZS:SCP11";"Statically Safe Program Generation with SafeGen";80;1618146234030;
"HS:TOPLAS11";"Morphing: Structurally Shaping a Class by Reflecting on Others";30;1610600888402;
"HHSDA11";"Supporting Multiple Perspectives in Feature-Based Configuration";74;1618147316154;
"EB+:ITNG11";"Goal-Oriented Test Case Selection and Prioritization for Product Line Feature Models";50;1618148397211;
"JHF:MODELS11";"Properties of Realistic Feature Models Make Combinatorial Testing of Product Lines Feasible";103;1618149479552;
"GCD:ESE11";"Evaluating Improvements to a Meta-Heuristic Search for Constrained Interaction Testing";223;1618150560526;
"JH:TSE11";"An Analysis and Survey of the Development of Mutation Testing";1610;1618151641435;
"C:NFM11";"OpenJML: JML for Java 7 by Extending OpenJDK";95;1610601971087;
"LWE:VLHCC11";"ifdef Confirmed Harmful: Promoting Understandable Software Variation";68;1610603053205;
"FSP+:EASE11";"Using Background Colors to Support Program Comprehension in Software Product Lines";53;1607936864230;
"YYZ+:ESECFSE11";"How Do Fixes Become Bugs";255;1618152722975;
"SK:FACS11";"Reducing the Model Checking Cost of Product Lines Using Static Analysis Techniques";4;1618157992302;
"NL:CSUR11";"A Survey of Combinatorial Testing";698;1618159073912;
"BK:CAV11";"CPAchecker: A Tool for Configurable Software Verification";547;1610604134995;
"OWES11";"A Survey of Model-Based Software Product Lines Testing";53;1618160155652;
"LHME:SPLC11";"From Requirements to Features: An Exploratory Study of Feature-Oriented Refactoring";35;1610605217676;
"DCI+11";"A Systematic Mapping Study of Software Product Lines Testing";208;1618164483213;
"ALH+:ICSR11";"Supporting Consistency Checking Between Features and Software Product Line Use Scenarios";29;1618165563928;
"KAO:FOSD11";"The Road to Feature Modularity";69;1618166645441;
"EW11";"The Choice Calculus: A Representation for Software Variation";142;1610606300492;
"RCL+:FTfJP11";"On the Interplay of Exception Handling and Design by Contract: An Aspect-Oriented Recovery Approach";10;1610607382447;
"P11";"Precise Documentation: The Key to Better Software";108;1610608464482;
"RQB+:GPCE11";"On the Impact of Feature Dependencies when Maintaining Preprocessor-Based Software Product Lines";37;1618167727336;
"GWW+11";"A Genetic Algorithm for Optimized Feature Selection with Resource Constraints in Software Product Lines";188;1618172054127;
"ABFG:FMOODS11";"A Model-Checking Tool for Families of Services";34;1618174219112;
"TBG:SBES11";"Safe Composition of Configuration Knowledge-Based Software Product Lines";26;1618175300912;
"NTS+:GPCE11";"Investigating the Safe Evolution of Software Product Lines";78;1618176382804;
"GPB:SC11";"Composing Event-B Specifications: Case-Study Experience";28;1610609547015;
"ABF+:PLEASE11";"Design and Validation of Variability in Product Lines";20;1618177473315;
"BMP:SERENE11";"Guaranteeing Correct Evolution of Software Product Lines: Setting up the Problem";4;1610610629110;
"useABFG:ISoLA12";"Formal Description of Variability in Product Families";115;1607940119488;
"CE:SPLC11";"Optimizing the Product Derivation Process";21;1618178556208;
"KA:GTTSE11";"Feature-Oriented Software Development: A Short Tutorial on Feature-Oriented Programming, Virtual Separation of Concerns, and Variability-Aware Analysis";27;1610611711656;
"TSP+:11";"AutoDaMa: On the Feasibility of Secure and Tailor-made Automotive Data Management";-2;1610612793571;
"ASW+:ASE11";"Detection of Feature Interactions Using Feature-Aware Verification";149;1618179638205;
"useASW+:ASE11";"Feature-Aware Verification";2;1612974575773;
"BKS:FoVeOOS11";"Verification of Software Product Lines with Delta-Oriented Slicing";47;1618180719754;
"KBK:AOSD11";"Reducing Combinatorics in Testing Product Lines";132;1618214054462;
"ACLF:SAC11";"A Domain-Specific Language for Managing Feature Models";42;1618215144332;
"BFL+11";"Specification and Verification: The Spec Experience";193;1610613875249;
"MB:CACM11";"Satisfiability Modulo Theories: Introduction and Applications";650;1617947050299;
"ER:IST11";"Software Product Line Testing - A Systematic Mapping Study";372;1618222715155;
"TLSS:EuroSys11";"Feature Consistency in Compile-Time-Configurable System Software: Facing the Linux 10,000 Feature Problem";163;1610614957576;
"KGR+:OOPSLA11";"Variability-Aware Parsing in the Presence of Lexical Macros and Conditional Compilation";277;1614686454168;
"DCB:OOPSLA11";"Product Lines of Theorems";41;1614687537168;
"HRRS:MBEES11";"Delta Modeling for Software Architectures";60;1614688619502;
"H11";"Next-Generation Feature Models with Pseudo-Boolean SAT Solvers";4;1614689702438;
"useHS:ISoLA12";"A Liskov Principle for Delta-Oriented Programming";44;1614690783864;
"STAL:FOSD11";"Automatic Detection of Feature Interactions Using the Java Modeling Language: An Experience Report";30;1610616040579;
"LBL:AUSE11";"Compositional Model Checking of Software Product Lines Using Variation Point Obligations";65;1618223796588;
"SH11";"Formal Methods in Software Product Line Engineering";51;1614691866723;
"SBD11";"Compositional Type-Checking for Delta-Oriented Programming";67;1614692949082;
"CHSL:ICSE11";"Symbolic Model Checking of Software Product Lines";266;1614694030717;
"SRK+:SPLC11";"Scalable Prediction of Non-Functional Properties in Software Product Lines";73;1610617122097;
"TKES:SPLC11";"Abstract Features in Feature Modeling";171;1614695113741;
"RS:ICST11";"Runtime Verification of Linux Kernel Modules Based on Call Interception";30;1614696196253;
"MCHB:VAMOS11";"A Formal Semantics for Feature Cardinalities in Feature Diagrams";56;1614697278015;
"SLBWC:ICSE11";"Reverse Engineering Feature Models";335;1614802652775;
"TSKA:VAST11";"Proof Composition for Deductive Verification of Software Product Lines";55;1614959824956;
"OZML:VaMoS11";"MoSo-PoLiTe - Tool Support for Pairwise and Model-Based Software Product Line Testing";65;1618228122448;
"RSTS:VAMOS11";"Multi-Dimensional Variability Modeling";85;1618229204175;
"JL:AAMAS10";"Distributed BDD-Based BMC for the Verification of Multi-Agent Systems";22;1616192134016;
"HHH:CP10";"A systematic approach to MDD-based constraint programming";94;1616193216518;
