"AKGL10";"Type Safety for Feature-Oriented Product Lines";133;1536321329694;
"T10";"A Machine-Checked Proof for a Product-Line-Aware Type System";7;1536322411148;
"ASLK:ISSRE10";"Detecting Dependences and Interactions in Feature-Oriented Design";54;1536323492852;
"SBB+:SPLC10";"Delta-Oriented Programming of Software Product Lines";311;1536324574626;
"LAL+:ICSE10";"An Analysis of the Variability in Forty Preprocessor-Based Software Product Lines";248;1536325656542;
"BSRC10";"Automated Analysis of Feature Models 20 Years Later A Literature Review";1031;1535659144770;
"OG:ICSR09";"Reusable Model-Based Testing";26;1536251455028;
"KFBA:SQJ09";"Extending the Reflexion Method for Consolidating Software Variants into Product Lines";58;1535224581846;
"YHMS:ISSTA09";"Clustering Test Cases to Achieve Effective and Scalable Prioritisation Incorporating Expert Knowledge";164;1536328903970;
"RCK:SCP09";"Comparison and Evaluation of Code Clone Detection Techniques and Tools A Qualitative Approach";741;1536329986549;
"MKB:JSME09";"An Evaluation of Code Similarity Identification for the Grow-and-Prune Model";57;1536331068028;
"BDGG:NC09";"A Survey on Metaheuristics for Stochastic Combinatorial Optimization";440;1536332150708;
"ACLF:SLE09";"Composing Feature Models";103;1536333231710;
"YD:NaBIC09";"Cuckoo Search via Levy Flights";3228;1536334313162;
"CHTN:ICSE09";"Towards Safer Composition";21;1536335394428;
"ABGF:VaMoS09";"Deontic Logics for Modeling Behavioural Variability - Research in Progress";0;1535660227852;
"ALKKL:FOSD09";"An Orthogonal Access Modifier Model for Feature-Oriented Programming";5;1536336476350;
"MSA:09";"Viewpoint-Oriented Variability Modeling";-2;1536337558688;
"WCR:SPLC09";"A Framework for Constructing Semantically Composable Feature Models from Natural Language Requirements";131;1536338641312;
"RBK:SBLP09";"Optimizing JML Feature Compilation in Ajmlc Using Aspect-Oriented Refactorings";17;1536339724010;
"CMRH09";"Software Dependencies, Work Dependencies, and Their Impact on Failures";235;1535661310012;
"PPR+:SIGMOD09";"A Comparison of Approaches to Large-scale Data Analysis";1271;1536340806011;
"WDF+:CADE09";"SPASS Version 3.5";261;1535662393335;
"MBNJ:ICSE09";"Taming Dynamically Adaptive Systems Using Models and Aspects";236;1517410814102;
"MDHS09";"Producing Wrong Data Without Doing Anything Obviously Wrong!";274;1535663476232;
"C09";"How NOT to Review a Paper The Tools and Techniques of the Adversarial Reviewer";12;1517411894779;
"MFC+09";"Programs That Test Themselves";93;1517412975850;
"MA:SPLC09";"Gathering Current Knowledge About Quality Evaluation in Software Product Lines";27;1517414056473;
"TRC:VaMoS09";"Abductive Reasoning and Automated Analysis of Feature Models How are They Connected";51;1517415137723;
"TSS+:FOSD09";"Dead or Alive Finding Zombie Features in the Linux Kernel";46;1517416219076;
"DCB09";"Fitting the Pieces Together A Machine-Checked Model of Safe Composition";70;1517417300725;
"useDCB09";"A Machine-Checked Model of Safe Composition";43;1517418382419;
"MWC:SPLC09";"SAT-Based Analysis of Feature Models is Easy";240;1517432838039;
"KAR+:SPLC09";"On the Impact of the Optional Feature Problem Analysis and Case Studies";91;1517433919837;
"H:FOSD09";"Towards Systematic Ensuring Well-Formedness of Software Product Lines";37;1517469593676;
"BJS:VaMoS09";"A Design of a Configurable Feature Model Configurator";43;1517470675158;
"M09";"Efficient Reasoning Techniques for Large Scale Feature Models";66;1517476770002;
"HM:FOSD09";"An Extension for Feature Algebra";5;1517477850864;
"KBK:GPCE09";"Safe Composition of Non-Monotonic Features";35;1517478932493;
"MBC:OOPSLA09";"S.P.L.O.T. Software Product Lines Online Tools";320;1535664558408;
"LPT09";"Model Checking of Domain Artifacts in Product Line Engineering";128;1517481095058;
"WDS09";"Selecting Highly Optimal Architectural Feature Sets with Filtered Cartesian Flattening";126;1517482180017;
"KA:JOT09";"Virtual Separation of Concerns - A Second Chance for Preprocessors";110;1534783516560;
"AK09";"An Overview of Feature-Oriented Software Development";378;1517483260645;
"useAKL13";"FeatureHouse Language-Independent, Automated Software Composition";244;1535691812290;
"KAK:GPCE09";"A Model of Refactoring Physically and Virtually Separated Features";69;1535692894752;
"R09";"Alternative Features in Colored Featherweight Java";5;1535693977732;
"F09b";"Formalization and Type-Soundness Proof for Featherweight Java in Coq";-2;1535695060336;
"F09";"Language Facilities for the Deployment of Reusable Aspects";6;1535696143462;
"AKGL09";"Type-Safe Feature-Oriented Product Lines";-2;1535697225812;
"JDHW09";"Do Code Clones Matter";387;1535698308773;
"TBK09";"Reasoning about Edits to Feature Models";327;1535699390876;
"KTS+:ICSE09";"FeatureIDE A Tool Framework for Feature-Oriented Software Development";186;1517484342580;
"K:ICSM08";"Frontiers of Software Clone Management";71;1535358613686;
"HHPS:Computer08";"Dynamic Software Product Lines";388;1534791093502;
"LS:JAR08";"Algorithms for Computing Minimal Unsatisfiable Subsets of Constraints";281;1535175864269;
"MBKM:CSMR08";"Supporting the Grow-and-Prune Model in Software Product Lines Evolution Using Clone Detection";66;1536252536888;
"AT:ISSRE08";"Automated Generation of Pointcut Mutants for Testing Pointcuts in AspectJ Programs";44;1517485424454;
"DKN+:WCRE08";"Variant Comparison - A Technique for Visualizing Software Variants";9;1517486505967;
"HSW:VISPLE08";"On Controlled Visualisations in Software Product Line Engineering";36;1517490489563;
"KKB:GPCE08";"On the Modularity of Feature Interactions";43;1517491570475;
"P:ABZ08";"The Composition of Event-B Models";30;1517492652045;
"SG08";"Verified Software Theories, Tools, Experiments";0;1535700472591;
"BTC:ICECCS08";"On Extracting Tests from a Testable Model in the Context of Domain Engineering";12;1517493733856;
"LMN:SPLC08";"An Approach for Developing Service Oriented Product Lines";64;1517494814777;
"CD+:TSE08";"Constructing Interaction Test Suites for Highly-Configurable Systems in the Presence of Constraints A Greedy Approach";239;1535225663136;
"ESB08";"Quality-Aware Software Product Line Engineering";25;1517495895734;
"ENC+:ICSE08";"Evolving Software Product Lines with Aspects An Empirical Study on Design Stability";-2;1536213388311;
"JCP08";"Reporting Experiments in Software Engineering";233;1517496976890;
"HKL+08";"Parallelizing Query Optimization";46;1517498058305;
"L:BSD08";"LLVM and Clang Next Generation Compiler Technology";131;1517499140051;
"AHM+08";"Using Static Analysis to Find Bugs";288;1517554307056;
"HH:FM08";"Towards Consistent Specifications of Product Families";25;1517555390130;
"RSL+:SAVCBS08";"JML and Aspects The Benefits of Instrumenting JML Features with AspectJ";6;1517556471978;
"TBD+08";"Automated Error Analysis for the Agilization of Feature Modeling";155;1535702636877;
"hall-of-fame";"The Product Line Hall of Fame";31;1533070364871;
"GLS08";"Modeling and Model Checking Software Product Lines";151;1533071446453;
"FG:SPLC08";"Formal Modeling for Product Families Engineering";99;1533072528352;
"AKL:GPCE08";"Feature Featherweight Java A Calculus for Feature-Oriented Programming and Stepwise Refinement";73;1533073611351;
"ALS:TSE08";"Aspectual Feature Modules";189;1535703719268;
"AMG08";"Contracts for Aspect-Oriented Design";11;1533111591588;
"RLCS08";"A JML Compiler Based on AspectJ";10;1533112673462;
"KARL:TOOLS08";"A Multiparadigm Study of Crosscutting Modularity in Design Patterns";6;1533118090177;
"SKRKS:VaMoS08";"Integrated Product Line Model for Semi-Automated Product Derivation Using Non-Functional Properties";37;1533119171096;
"SRKKS:APSEC08";"Measuring Non-functional Properties in Software Product Lines for Product Derivation";44;1533120253460;
"BB08";"Modularizing Theorems for Software Product Lines The Jbook Case Study";38;1533121335122;
"HKW:ICSE08";"FeatureMapper Mapping Features to Models";199;1533121815236;
"SSP08";"The Linux Kernel Configurator as a Feature Modeling Tool";35;1533122896568;
"ACPPW08";"Engineering Formal Metatheory";206;1533123979192;
"JKB08";"Formal Methods in Software Product Lines Concepts, Survey, and Guidelines";8;1533125061669;
"KTA08";"Visualizing Software Product Line Variabilities in Source Code";63;1533126144542;
"KAK08";"Granularity in Software Product Lines";490;1533127225571;
"MWCC08";"Efficient Compilation Techniques for Large Scale Feature Models";119;1533128305938;
"PS:ASE08";"Configuration Lifting Verification Meets Software Configuration";80;1533145363435;
"KA08";"Type-Checking Software Product Lines-A Formal Approach";125;1533130469419;
"T08";"Reasoning about Feature Model Edits";5;1533131549912;
"WSB+:SPLC08";"Automated Diagnosis of Product-Line Configuration Errors in Feature Models";173;1535226744712;
"AL08";"Superimposition A Language-Independent Approach to Software Composition";91;1517564023197;
"MVS:ISSTA07";"Automating Component-Based System Assembly";44;1535704802282;
"JDB:SPLC07";"Minimally Invasive Migration to Software Product Lines";37;1517565105006;
"FW:WMA07";"Mutant Minimization for Model-Checker Based Test-Case Generation";23;1517566187161;
"BCU:FMOODS07";"Specification of Timed EFSM Fault Models in SDL";28;1517567268812;
"BC:CGEC07";"One-test-at-a-time Heuristic Search for Interaction Test Suites";88;1517568350619;
"DHG:ICECCS07";"A Formal Contract Language for Plugin-Based Software Engineering";15;1535705885488;
"LL:DV07";"Software Engineering Grundlagen, Menschen, Prozesse, Techniken";82;1517569432587;
"YH:ISSTA07";"Pareto Efficient Multi-objective Test Case Selection";278;1517570515061;
"RW:REJ07";"Multi-Level Feature Trees A Pragmatic Approach to Managing Highly Complex Product Families";-2;1536214469766;
"UGKB:ESEC07";"A Specification-Based Approach to Testing Software Product Lines";17;1517571596737;
"LK+:ECBS07";"IPOG A General Strategy for T-Way Software Testing";244;1517572679065;
"NCB+SEI07";"A Framework for Software Product Line Practice, Version 5.0";108;1532770882628;
"CDS:ISSTA07";"Interaction Testing of Highly-Configurable Systems in the Presence of Constraints";223;1532771963312;
"BHJM:STTT07";"The Software Model Checker Blast Applications to Software Engineering";1;1532773045291;
"M:ICFI07";"Quality Issues in Software Product Lines Feature Interactions and Beyond (Invited Talk)";1;1533192879019;
"JWEG:MODELS07";"Model Composition in Product Lines and Feature Interaction Detection Using Critical Pair Analysis";166;1532780615601;
"LNW:ESOP07";"Modal IO Automata for Interface and Product Line Theories";246;1532884839392;
"LM:ICSE07";"Information Hiding and Visibility in Interface Specifications";38;1532885920908;
"KAB:SPLC07";"A Case Study Implementing Features Using AspectJ";236;1532890537126;
"W:AOSD07";"Aspect-Oriented Design Principles Lessons from Object-Oriented Design";19;1532891618232;
"AGDS07";"Evaluating Pair Programming with Respect to System Complexity and Programmer Expertise";280;1535708050270;
"L07";"Survey of Product-Line Verification and Validation Techniques";8;1532892999327;
"FM07";"The WhyKrakatoaCaduceus Platform for Deductive Program Verification";433;1532928624140;
"LDL07";"Safety Analysis of Software Product Lines Using State-Based Modeling";91;1532929707443;
"P:REFSQ07";"Towards Feature-Oriented Specification and Development with Event-B";31;1532930798461;
"A07";"The Role of Features and Aspects in Software Development";61;1532931881491;
"BHS07";"Verification of Object-Oriented Software The KeY Approach";655;1532932964114;
"SSSPS:OSSPL07";"Is the Linux Kernel a Software Product Line";64;1532934047011;
"BSTRC:VaMoS07";"FAMA Tooling a Framework for the Automated Analysis of Feature Models";226;1535709131939;
"HZS:AOSD07";"cJ Enhancing Java with Safe Type Conditions";46;1532935129700;
"RC07";"A Survey on Software Clone Detection Research";571;1535227825756;
"SNOPRSS07";"Ott Effective Tool Support for the Working Semanticist";117;1535228908657;
"SSP07";"The Java Module System Core Design and Semantic Definition";87;1535229991865;
"MHPSS:RE07";"Disambiguating the Documentation of Variability in Software Product Lines A Separation of Concerns, Formalization and Automated Analysis";260;1535231074978;
"LSR07";"Software Product Lines in Action The Best Industrial Practice in Product Line Engineering";-2;1535232157778;
"K07";"Aspect-Oriented Refactoring of Berkeley DB";17;1535233239914;
"B07";"On the Automated Analysis of Software Product Lines Using Feature Models - A Framework for Developing Automated Tool Support";3;1535710214411;
"TBKC07";"Safe Composition of Product Lines";261;1535234322126;
"useALMK10";"An Algebra for Feature-Oriented Software Development";38;1535320724849;
"CW07";"Feature Diagrams and Logics There and Back Again";335;1535322889824;
"JK07";"Reasoning about Feature Models in Higher-Order Logic";76;1535323972289;
"SHTB07";"Generic Semantics of Feature Diagrams";399;1535711296707;
"LST+:SIGOPS06";"A Quantitative Analysis of Aspects in the eCos Kernel";135;1534792175481;
"DL:AUSE06";"PLFaultCAT A Product-Line Software Fault Tree Analysis Tool";57;1536253618771;
"D:QSIC06";"Quality Assessment of Mutation Operators Dedicated for C Programs";47;1535325055086;
"UL06";"Practical Model-Based Testing A Tools Approach";1279;1535326137699;
"SHT:RE06";"Feature Diagrams A Survey and a Formal Semantics";473;1535327219318;
"WSM+:ISSTA06";"Time-Aware Test Suite Prioritization";341;1535328302075;
"DNS+:TOPLAS06";"Traits A Mechanism for Fine-grained Reuse";280;1535329384339;
"KC:SPLC06";"New Methods in Software Product Line Development";93;1535330466917;
"NTJ06";"System Testing of Product Lines From Requirements to Test Cases";42;1535331549827;
"CDS:ROSATEA06";"Coverage and Adequacy in Software Product Line Testing";131;1535739436017;
"GSS+06";"Modular Software Design with Crosscutting Interfaces";306;1535712378310;
"ALSU06";"Compilers Principles, Techniques, and Tools (2nd Edition)";-2;1535713461584;
"LBL:ICSE06";"Feature Oriented Refactoring of Legacy Applications";253;1535332632345;
"SUST:AOAsia06";"An Extensible Contract Verifier for AspectJ";15;1535333713731;
"RRDH06";"Checking JML Specifications Using an Extensible Software Model Checking Framework";23;1535334795577;
"AGMO06";"An Overview of CaesarJ";338;1535335877987;
"LC06";"Design by Contract with JML";208;1535714542747;
"FUB:ROSATEA06";"A Foundation for Behavioural Conformance in Software Product Line Architectures";146;1535336960405;
"BBC+:FMCO06";"JACK A Tool for Validation of Security and Behaviour of Java Applications";55;1535338042487;
"F06";"Five Misunderstandings About Case-Study Research";10051;1535339124802;
"CM06";"Feature Interaction Detection by Pairwise Analysis of LTL Properties-A Case Study";39;1535340206798;
"KN06";"Formal Verification and Software Product Lines";46;1535341289536;
"H:OOPSLA06";"Eliminating Distinctions of Class Using Prototypes to Model Virtual Classes";26;1535342372884;
"K06";"Aspect Categories and Classes of Temporal Properties";103;1535343455343;
"LBR06";"Preliminary Design of JML A Behavioral Interface Specification Language for Java";984;1535344537842;
"ALS:ICSE06";"Aspectual Mixin Layers Aspects and Features in Concert";164;1535345620277;
"B:GTTSE06";"A Tutorial on Feature Oriented Programming and the AHEAD Tool Suite";114;1535346703380;
"KG06";"Supporting the Analysis of Clones in Software Systems A Case Study";-2;1535740519451;
"CP06";"Verifying Feature-Based Model Templates Against Well-Formedness OCL Constraints";264;1535741602109;
"KV06";"Towards Type Safety of Aspect-Oriented Languages";5;1535347785713;
"AWLF06";"Proof General in Eclipse System and Architecture Overview";11;1535348868838;
"B06";"A Very Mathematical Dilemma";9;1535349950630;
"CKK06";"Feature Models are Views on Ontologies";184;1535351033392;
"TBRCST06";"Explanations for Agile Feature Models";27;1535742684608;
"BRCTS06";"A Survey on the Automated Analyses of Feture Models";0;1535743766193;
"BBRC06";"Automated Analyses of Feature Models Challenges Ahead";244;1535352115945;
"AGMKBdL06";"Refactoring Product Lines";190;1535353199354;
"BSTRC06";"A First Step Towards a Framework for the Automated Analysis of Feature Models";84;1535744848288;
"YGM:SEAS06";"Assessing Merge Potential of Existing Engine Control Systems into a Product Line";21;1535354282993;
"GHM+:IBMSJ05";"The Eclipse 3.0 Platform Adopting OSGi Technology";141;1534793257520;
"YMKI:PROFES05";"Measuring Similarity of Large Software Systems Based on Source Code Correspondence";69;1535745931621;
"CK:CASSIS04";"ESCJava2 Uniting ESCJava and JML";323;1535355364208;
"C05";"A Design Discipline and Language Features for Modular Reasoning in Aspect-Oriented Programs";44;1535356445113;
"ACV+:ICSM05";"Comparative Analysis of Porting Strategies in J2ME Games";32;1535357527033;
"AMC+:SPLC05";"Extracting and Evolving Mobile Games Product Lines";139;1535359694925;
"A:ECOOP05";"Open Modules Modular Reasoning About Advice";306;1535360779992;
"BEM:RISE05";"Can Aspects Implement Contracts";32;1535361863425;
"DNS:JACM05";"Simplify A Theorem Prover for Program Checking";876;1535362949312;
"SGB05";"A Taxonomy of Variability Realization Techniques Research Articles";-2;1535747014898;
"BDN:OOPSLA05";"ClassboxJ Controlling the Scope of Change in Java";145;1536091093765;
"KM:ICSE05";"Aspect-Oriented Programming and Modular Reasoning";396;1535748097357;
"BL:PASTE05";"Weakest-Precondition of Unstructured Programs";252;1536092174885;
"H:AUSE05";"Fundamental Nonmodularity in Electronic Mail";34;1536137669838;
"CKLP:FMCO05";"Beyond Assertions Advanced Specification and Verification with JML and ESCJava2";262;1536138751477;
"BCC+05";"An Overview of JML Tools and Applications";1036;1536139832136;
"LKF:AUSE05";"Modular Verification of Open Features Using Three-Valued Model Checking";59;1536140913550;
"CA:GPCE05";"Mapping Features to Models A Template Approach Based on Superimposed Variants";644;1536141994626;
"LS05";"Extending Design by Contract for Aspect-Oriented Programming";18;1536143077492;
"FK:VSTTE05";"Decomposing Verification Around End-User Features";20;1536144158817;
"ALRS05";"FeatureC++ On the Symbiosis of Feature-Oriented and Aspect-Oriented Programming";225;1536145240703;
"W05";"Formalization and Type-Soundness Proof for Featherweight Java in Coq";-2;1535749179563;
"JavaSpec";"The Java Language Specification, Third Edition";-2;1535750263259;
"PBL05";"Software Product Line Engineering Foundations, Principles and Techniques";3735;1536146323065;
"T05";"Enabling the Smooth Integration of Core Assets Defining and Packaging Architectural Rules for a Family of Embedded Products";17;1536147403672;
"BSTRC05";"Using Java CSP Solvers in the Automated Analyses of Feature Models";78;1536148485896;
"KC05";"Synchronizing Cardinality-Based Feature Models and Their Specializations";58;1536215551976;
"CHE05b";"Staged Configuration through Specialization and Multi-Level Configuration of Feature Models";564;1536216634435;
"WLSZP05";"A Semantic Web Approach to Feature Modeling and Verification";100;1536217716836;
"CHE05a";"Formalizing Cardinality-Based Feature Models and Their Specialization";700;1536218799866;
"CK05";"Cardinality-Based Feature Modeling and Constraints A Progress Report";301;1533201533576;
"BTRC05";"Using Constraint Programming to Reason on Feature Models";92;1535751346611;
"useBTRC05";"Automated Reasoning on Feature Models";701;1535752429289;
"SZLW05";"Formal Semantics and Verification for Feature Modeling";165;1533202615900;
"B05";"Feature Models, Grammars, and Propositional Formulas";1244;1533203697334;
"LAMS05";"Tool Support for Feature-Oriented Software Development - FeatureIDE An Eclipse-Based Approach";67;1533204779067;
"MPY+:ICSE04";"Skoll Distributed Continuous Quality Assurance";128;1536244963470;
"GLRW:ICSR04";"Towards Generating Acceptance Tests for Product Lines";39;1536246045146;
"DL:HASE04";"Software Fault Tree Analysis for Product Lines";67;1536254701565;
"DHT:IST04";"Verifying Haskell Programs by Combining Testing, Model Checking and Interactive Theorem Proving";27;1533205861037;
"M:STVR04";"Search-Based Software Test Data Generation A Survey Research Articles";-2;1535753511598;
"P:SoSyM04";"Plug-and-Play Composition of Features and Feature Interactions with Statechart Diagrams";51;1533206945367;
"BFKH:ASE04";"Parameterized Interfaces for Open System Verification of Product Lines";40;1533208027339;
"HP04";"Finding Bugs is Easy";952;1533209108924;
"KWA:TSE04";"Software Fault Interactions and Implications for Software Testing";662;1533210190028;
"SK:EIWAS04";"PCDiff Attacking the Fragile Pointcut Problem";191;1533211271996;
"KFG:FSE04";"Verifying Aspect Advice Modularly";134;1533212352490;
"MO:FSE04";"Variability Management with Feature-Oriented Programming and Aspects";289;1533213434829;
"BPS:SCP04";"Variability Management with Feature Models";191;1533228573763;
"TTK04";"Product Family Testing A Survey";127;1533229656569;
"useLS05";"Cona Aspects for Contracts and Contracts for Aspects";42;1533230739472;
"AC04";"FeaturePlugin Feature Modeling Plug-In for Eclipse";348;1533231821552;
"CCHW04";"Eclipse AspectJ Aspect-Oriented Programming With AspectJ and the Eclipse AspectJ Development Tools";161;1533232903337;
"G04";"A Computer-Checked Proof of the Four Colour Theorem";196;1533233984680;
"SH04";"Experiences Adopting Software Product Line Development without a Product Line Architecture";47;1533235067124;
"BC04";"Interactive Theorem Proving and Program Development - Coq'Art The Calculus of Inductive Constructions";1993;1533236150053;
"STBMPSF04";"Introducing PLA at Bosch Gasoline Systems Experiences and Practices";107;1533237232533;
"ZZM04";"A Propositional Logic-Based Method for Verification of Feature Models";166;1533366838380;
"useCHE05b";"Staged Configuration Using Feature Models";547;1533381847899;
"AMS04";"Using a Configurator for Modelling and Configuring Software Product Lines based on Feature Models";46;1533382929903;
"BHST04";"Semantics of Feature Diagrams";-2;1535754594317;
"BSR04";"Scaling Step-Wise Refinement";1108;1536011379771;
"FV:SPE03";"Software Product Line Migration and Deployment";86;1535321807865;
"B:ICSE03";"A Tutorial on Feature-Oriented Programming and Product Lines";71;1534779186552;
"MC:PFE03";"Theorem Proving for Product Line Model Verification";52;1536255782893;
"BG:PFE03";"PLUTO A Test Methodology for Product Families";81;1536256864493;
"CGMC:ICSE03";"Constructing Test Suites for Interaction Testing";383;1533384011214;
"H:JMLC03";"The Verifying Compiler A Grand Challenge for Computing Research";403;1533418041000;
"AK03";"Model-Driven Development A Metamodeling Foundation";1085;1533419122971;
"KM:CONQUEST03";"Challenges in Testing Software Product Lines";-2;1533420205807;
"H:NODe03";"Object Teams Improving Modularity for Crosscutting Collaborations";195;1533421287783;
"BS03";"Abstract State Machines A Method for High-Level System Design and Analysis";1337;1533422370652;
"SDNB:ECOOP03";"Traits Composable Units of Behaviour";470;1536012460847;
"MO:AOSD03";"Conquering Aspects with Caesar";384;1533677137464;
"LG03";"Analysis of a Software Product Line Architecture An Experience Report";39;1533678221103;
"CKMR03";"Feature Interaction A Critical Review and Considered Forecast";438;1533679303089;
"ZR03";"Pipa A Behavioral Interface Specification Language for AspectJ";80;1533680384936;
"B03";"Composition and Construction of Embedded Software Families";62;1533791438593;
"SRP03";"Details of Formalized Relations in Feature Models Using OCL";76;1533792520933;
"CBBHROA03";"Automating Feature-Oriented Domain Analysis";33;1533793602827;
"R03";"Towards a More Precise Definition of Feature Models";125;1533799090155;
"K:SPLC02";"Variation Management for Software Production Lines";177;1534798263274;
"KKI:TSE02";"CCFinder A Multilinguistic Token-based Code Clone Detection System for Large Scale Source Code";1510;1536257945424;
"M:TSE02";"A State-of-the-Art Survey on Software Merging";547;1536219881180;
"FF:ICFP02";"Contracts for Higher-Order Functions";409;1533800172112;
"ABGM:TSE02";"Using Version Control Data to Evaluate the Impact of Software Tools A Case Study of the Version Editor";89;1532936214168;
"CK:Software02";"Point  Counterpoint Being Proactive Pays Off  Eliminating the Adoption Barrier";-2;1536013544102;
"CL:FOAL02";"Observers and Assistants A Proposal for Modular Aspect-Oriented Reasoning";147;1532937296282;
"KLD:Software02";"Feature-Oriented Product Line Engineering";695;1532938378640;
"UT:AOSD02";"Aspect-Oriented Programming with Model Checking";80;1532939460694;
"L02";"Specifying Systems The TLA+ Language and Tools for Hardware and Software Engineers";979;1532940543314;
"FLL+:PLDI02";"Extended Static Checking for Java";8;1532941625172;
"NWP02";"IsabelleHOL A Proof Assistant for Higher-Order Logic";3049;1532942707792;
"SB02";"Mixin Layers An Object-Oriented Implementation Technique for Refinements and Collaboration-Based Designs";393;1532943790429;
"LKF02";"Verifying Cross-Cutting Features as Open Systems";98;1532944873580;
"K:PFE02";"Easing the Transition to Software Mass Customization";339;1532945956245;
"APB:SCAM02";"Handling Preprocessor-Conditioned Declarations";43;1532947039606;
"B02";"Test Driven Development By Example";2904;1532948122196;
"KLD:S02";"Feature-Oriented Product Line Engineering";695;1532949204935;
"SS:TOSEM02";"Behavior-Consistent Specialization of Object Life Cycles";125;1532950288117;
"SP02";"Aspect-Oriented Programming with C and .NET";68;1532951370391;
"SGSP02";"AspectC++ An Aspect-Oriented Extension to the C++ Programming Language";457;1532952452869;
"LKF:ASE02";"Interfaces for Modular Feature Verification";51;1532953538262;
"K02";"AspectC An AOSD implementation for C";78;1536014625286;
"NPW02";"IsabelleHOL - A Proof Assistant for Higher-Order Logic";3049;1532954621454;
"P02";"Types and Programming Languages";2740;1532955706632;
"vDK02";"Domain-Specific Language Design Requires Feature Descriptions";322;1533840902741;
