"KTS:FormaliSE21";"GUIDO: Automated Guidance for the Configuration of Deductive Program Verifiers";-2;1614672263603;
"MSB+:ICSE21";"Seamless Variability Management With the Virtual Platform";0;1616174826569;
"KTSB:ICSE21";"Bridging the Gap Between Clone-and-Own and Software Product Lines";-2;1611591735302;
"KKK+:EMSE21";"variED: An Editor for Collaborative, Real-Time Feature Modeling";0;1615187288139;
"EPPC:IST21";"An Empirical Study of Performance Using Clone and Own and Software Product Lines in an Industrial Context";0;1611592817512;
"RSC+:SE21";"Tool Support for Correctness-by-Construction";3;1616772678952;
"KJN+:SE21";"Skill-Based Verification of Cyber-Physical Systems";1;1616773760105;
"PKR+:VaMoS21";"Stability of Product-Line Sampling in Continuous Integration";0;1614673345534;
"HPTS:VaMoS21";"Hyper Explanations for Feature-Model Defect Analysis";0;1614674426304;
"SNB+:VaMoS21";"Applications of SAT Solvers on Feature Models";0;1614675507701;
"SL:VaMoS21";"V1e: A Kernel for Domain-Specific Textual Variability Modelling Languages";0;1617894773734;
"JPWL:CoRR20";"Supporting Modularity in Simulink Models";1;1617895855808;
"KKT+20";"Using Abstract Contracts for Verifying Evolving Features and Their Interactions";0;1609770330031;
"BLK:ESECFSE20";"Baital: An Adaptive Weighted Sampling Approach for Improved t-Wise Coverage";2;1614676589624;
"M:SPLC20";"Evolving System Families in Space and Time";0;1612950776864;
"E20";"Towards a Universal Variability Language";1;1616175907556;
"S20";"Applications of SAT Solvers on Product Lines";1;1611593899907;
"HFGB:SPLC2020";"Uniform and Scalable SAT-Sampling for Configurable Systems";1;1611594981571;
"KB:VAMOS2020";"Activities and Costs of Re-Engineering Cloned Variants Into an Integrated Platform";9;1611596063023;
"KB:ESECFSE20";"An Empirical Analysis of the Costs of Clone- and Platform-Oriented Software Reuse";5;1611506318615;
"MKK+:VRST20";"Temporal Consistent Motion Parallax for Omnidirectional Stereo Panorama Video";0;1615380153540;
"BMK+:VR20";"Depth Augmented Omnidirectional Stereo for 6-DoF VR Photography";2;1615381235764;
"NST+:VariVolution20";"GuyDance: Guiding Configuration Updates for Product-Line Evolution";0;1618225960377;
"FAR:SPLC20";"The Benefits of a Feature Model in Banking";0;1610894254541;
"LDJM:ICSE20";"Lazy Product Discovery in Huge Configuration Spaces";2;1615191616606;
"YWT:SPLC20";"Variational Satisfiability Solving";1;1613932088857;
"SBKT:SPLC20";"On the Use of Product-Line Variants as Experimental Subjects for Clone-and-Own Research: A Case Study";0;1613933171363;
"T:SPLC20";"A BDD for Linux The Knowledge Compilation Challenge for Variability";0;1617007382120;
"FHS:CP20";"A Time Leap Challenge for SAT-Solving";1;1607971370293;
"RKTS:FormaliSE20";"Lattice-Based Information Flow Control-by-Construction for Security-by-Design";1;1607967041557;
"FBAH20";"Using Extended Logical Primitives for Efficient BDD Building";3;1617006299967;
"RTC+:REFINE20";"Comparing Correctness-by-Construction with Post-Hoc Verification - A Qualitative User Study";2;1615192698686;
"PAM+:ICPE20";"Sampling Effect on Performance Prediction of Configurable Systems: A Case Study";6;1607968122509;
"BLLV:TSE20";"A Framework for Quantitative Modeling and Analysis of Highly (Re)Configurable Systems";21;1612977820385;
"KJN+:FASE20";"Skill-Based Verification of Cyber-Physical Systems";0;1607964528267;
"AVL:IST20";"Automatic Extraction of Product Line Architecture and Feature Models from UML Class Diagram Variants";7;1611580921863;
"SSS:VaMoS2020";"Recovering Variability Information from Source Code of Clone-and-Own Software Systems";4;1611582002536;
"B20";"Semi-Automated Inference of Feature Traceability During Software Development";0;1607965958647;
"KTS+:VaMoS20";"YASA: Yet Another Sampling Algorithm";7;1612964841930;
"BRK+:VaMoS20";"Variational Correctness-by-Construction";1;1612965923376;
"SSK+:VaMoS20";"SMT-Based Variability Analyses in FeatureIDE";5;1612967004911;
"STS:VaMoS20";"Evaluating SAT Solvers on Industrial Feature Models";8;1612968085897;
"BBCW:SoSyM19";"A Feature-Based Survey of Model View Approaches";52;1618114862214;
"GGL+:IST19";"Scaling-Up Domain-Specific Modelling Languages Through Modularity Services";5;1617898020312;
"FBS:SAT19";"Incremental Inprocessing in SAT Solving";16;1617899102802;
"DMG:EMSE19";"An Empirical Comparison of Dependency Network Evolution in Seven Software Packaging Ecosystems";74;1617615889402;
"IM:IJCAI19";"Exact Bernoulli Scan Statistics Using Binary Decision Diagrams";0;1616176988139;
"SRSM:IJCAI19";"GANAK: A Scalable Probabilistic Exact Model Counter";19;1616178069581;
"CEB+:SANER19";"Identifying Feature Clones: An Industrial Case Study";2;1612951859785;
"CFM:VaMoS19";"A Literature Review and Comparison of Three Feature Location Techniques Using ArgoUML-SPL";8;1612952942336;
"BG19";"Approximate Model Counting, Sparse XOR Constraints and Minimum Distance";3;1611597145648;
"HFME:ICSE19";"Supporting the Statistical Analysis of Variability Models";5;1611598227116;
"KMW+:JSS19";"Where is my Feature and What is it About A Case Study on Recovering Feature Facets";22;1611599308503;
"KBL19";"Features and How to Find Them: A Survey of Manual Feature Location";19;1611600389125;
"KCB+:ESECFSE19";"Effects of Explicit Feature Traceability on Program Comprehension";11;1611601471114;
"AFH+:SODA19";"A PTAS for Euclidean TSP With Hyperplane Neighborhoods";5;1610569480444;
"G:SIGACT19";"Guest Column: The Third P=NP Poll";6;1616179150249;
"JS:CAV19";"Q3B: An Efficient BDD-based SMT Solver for Quantified Bit-Vectors";5;1610571643238;
"SA:PATENT19";"Product Configuration";-2;1610572724326;
"TSG+:VR19";"Immersive EEG: Evaluating Electroencephalography in Virtual Reality";10;1618168808683;
"GUT+:VR19";"Gaze and Motion-aware Real-Time Dome Projection System";5;1618169890101;
"ESSB:SPLC19";"Visualization of Feature Locations with the Tool FeatureDashboard";5;1613187430627;
"RKRL:ASE19";"SiMPOSE-Configurable N-Way Program Merging Strategies for Superimposition-Based Analysis of Variant-Rich Software";0;1611583083468;
"GFOS:CSUR19";"Comparison of Software Design Models: An Extended Systematic Mapping Study";5;1611584163961;
"RLK:JOT19";"From Imprecise N-Way Model Matching to Precise N-Way Model Merging";6;1611585246087;
"PAP+:ICST19";"Uniform Sampling of SAT Solutions for Configurable Systems: Are We There Yet";24;1607969204839;
"HNA+:EMSE19";"Test Them All, Is It Worth It Assessing Configuration Sampling on the JHipster Web Development Stack";31;1607970286362;
"KGS+:ICSE19";"Distance-Based Sampling of Software Configuration Spaces";33;1608136262463;
"OGB:SPLC19";"t-wise Coverage by Uniform Sampling";5;1608137345425;
"MHK:MSR19";"Beyond GumTree: A Hybrid Approach to Generate Edit Scripts";3;1608138427635;
"OGB+:TR19";"Uniform Sampling from Kconfig Feature Models";13;1618161237198;
"MOP+:SPLC19";"Uniform Random Sampling Product Configurations of Feature Models That Have Numerical Features";13;1618162318962;
"FAH+:SPLC19";"A KConfig Translation to Logic with One-Way Validation System";4;1613164711678;
"GTA+:VaMoS19";"Characterizing Safe and Partially Safe Evolution Scenarios in Product Lines: An Empirical Study";5;1612978901805;
"BTS:SEFM19";"SAT Encodings of the At-Most-k Constraint - A Case Study on Configuring University Courses";-2;1615193781470;
"LGL:STTT19";"Sampling Strategies for Product Lines with Unbounded Parametric Real-Time Constraints";2;1613415729456;
"TKK+:SPLC19";"Feature-Oriented Contract Composition";6;1613413565784;
"PTR+:SPLC19";"Product Sampling for Product Lines: The Scalability Challenge";12;1613494789721;
"TTS+:VariVolution19";"Towards Efficient Analysis of Variation in Time and Space";9;1613412484392;
"TSS:MODEVAR19";"On Language Levels for Feature Modeling Notations";2;1613279242216;
"LRGB:COLA19";"Automated Analysis of Two-Layered Feature Models with Feature Attributes";7;1608580672178;
"GBT+19";"Automated Analysis of Feature Models: Quo Vadis";27;1608581755055;
"RRC+:SOSP19";"An Analysis of Performance Evolution of Linux's Core Operations";2;1607613278706;
"RKBL:TOSEM19";"Automated N-Way Program Merging for Facilitating Family-Based Analyses of Variant-Rich Software";5;1613466709334;
"SBT:JSS19";"Partially Safe Evolution of Software Product Lines";21;1613108103277;
"SPLC19a";"SPLC '19: Proceedings of the 23rd International Systems and Software Product Line Conference - Volume A";0;1607937945616;
"SPLC19b";"SPLC '19: Proceedings of the 23rd International Systems and Software Product Line Conference - Volume B";0;1607939026441;
"JMJ+19";"Addressed Challenges";-2;1613414647918;
"THA+19";"Performance Analysis Strategies for Software Variants and Versions";4;1613416810247;
"RSC+:FASE19";"Tool Support for Correctness-by-Construction";3;1607412846403;
"TKK+:JSS19";"Feature-Oriented Contract Composition";6;1614683078279;
"KTP+:SE19";"Understanding Parameters of Deductive Verification: An Empirical Investigation of KeY";2;1607415228516;
"KTS+:SE19";"Propagating Configuration Decisions with Modal Implication Graphs";18;1607416310802;
"RDD:SoSyM19";"Certifying Delta-Oriented Programs";0;1610395206419;
"ATL+:SoSyM19";"Effective Product-Line Testing Using Similarity-Based Product Prioritization";64;1613417891838;
"BDG+:SCP19";"On the Expressiveness of Modal Transition Systems with Variability Constraints";7;1608554027299;
"SYS:IST19";"Metrics for Analyzing Variability and its Implementation in Software Product Lines: A Systematic Literature Review";27;1608557273355;
"LNTS:JSS19";"Retest Test Selection for Product-Line Regression Testing of Variants and Versions of Variants";12;1608558354928;
"TKPK:FASE18";"A Formal Framework for Incremental Model Slicing";2;1617900183936;
"ZSL+:ICSE18";"Identifying Features in Forks";25;1616180231008;
"MRG+:TSE18";"Discipline Matters: Refactoring of Preprocessor Directives in the ifdef Hell";35;1612954024601;
"KKL:VaMoS18";"Don't Worry About It: Managing Variability On-The-Fly";8;1612955107615;
"SNP:CoRR18";"Recording Concerns in Source Code Using Annotations";27;1612956188730;
"JSR+:CoRR18";"Clafer: Lightweight Modeling of Structure, Behaviour, and Variability";16;1611602552144;
"L:CoRR18";"Approximate Model Counting by Partial Knowledge Compilation";0;1611603634623;
"AZT:SAT18";"Fast Sampling of Perfectly Uniform Satisfying Assignments";10;1611604717079;
"SGRM:LPAIR18";"Knowledge Compilation Meets Uniform Sampling";12;1611605799543;
"KWF+:ICSE18";"Do you Remember This Source Code";16;1611642513544;
"KKK+:SPLC18";"Getting Rid of Clone-and-Own: Moving to a Software Product Line for Temperature Monitoring";6;1611643595296;
"KV18";"Combinatorial Optimization";2780;1610573805274;
"CJ:TALG18";"Reducing Curse of Dimensionality: Improved PTAS for TSP (with Neighborhoods) in Doubling Metrics";28;1610574887950;
"B18";"Binary Decision Diagrams";2714;1610575970062;
"SAH:PATENT18";"Product Configuration";-2;1610577050713;
"ABAB:ICSME18";"Semi-Automated Feature Traceability with Embedded Annotations";22;1618227041633;
"S18";"Recording Feature Mappings During Evolution of Cloned Variants";1;1610578132080;
"WBC:SCP18";"Improving Custom-Tailored Variability Mining Using Outlier and Cluster Detection";8;1611586327135;
"MAL:SPLC18";"Multi-Objective Optimization for Reverse Engineering of Apo-Games Feature Models";4;1608139508285;
"KGS:SPLC18";"Identifying the Intensity of Variability Changes in Software Product Line Evolution";8;1612979983918;
"P18";"Stability of Product Sampling under Product-Line Evolution";3;1608582837359;
"CCRC:ASE18";"Navigating the Maze: The Impact of Configurability in Bioinformatics Software";11;1613455889831;
"HKE+:ASE18";"A Unified Lattice Model and Framework for Purity Analyses";4;1610408189409;
"KTPS:FIDE18";"Experience Report on Formally Verifying Parts of OpenJDK's API with KeY";3;1607417392396;
"KTM+:SE18";"Is There a Mismatch between Real-World Feature Models and Product-Line Research";33;1607418474866;
"CGR+:VaMoS18";"Equivalent Mutants in Configurable Systems: An Empirical Study";14;1607419568011;
"LNT+:VaMoS18";"175% Modeling for Product-Line Evolution of Domain Artifacts";16;1607422812284;
"BFG:SPLC18";"Product Line Models of Large Cyber-physical Systems: The Case of ERTMSETCS";4;1608555109675;
"BBG:SPLC18";"Modelling and Analysis with Featured Modal Contract Automata";4;1608556191865;
"VBLL:FM18";"QFLan: A Tool for the Quantitative Analysis of Highly Reconfigurable Systems";8;1610406026036;
"KTPS:ISoLA18";"Scalability of Deductive Verification Depends on Method Call Treatment";5;1608559436837;
"RLB+:GPCE18";"Measuring Effectiveness of Sample-Based Product-Line Testing";2;1608560519859;
"NMS+:GPCE18";"Anomaly Analyses for Feature-Model Evolution";10;1608561601055;
"TKS:ConfWS18";"Product Configuration in the Wild: Strategies for Conflicting Decisions in Web Configurators";3;1608563764062;
"NST:VariVolution18";"Back to the Future: Avoiding Paradoxes in Feature-Model Evolution";10;1608564846922;
"TKL:SPLC18";"Clean Your Variable Code with FeatureIDE";10;1608565929359;
"KFT+:SPLC18";"Apo-Games: A Case Study for Reverse Engineering Variability from Cloned Java Variants";20;1608567012434;
"VAT+:SPLC18";"A Classification of Product Sampling for Software Product Lines";31;1608568093693;
"KTPS:ITP18";"Understanding Parameters of Deductive Verification: An Empirical Investigation of KeY";2;1608569175211;
"DDP:EMSE18";"FEVER: An Approach to Analyze Feature-Oriented Changes and Artefact Co-Evolution in Highly Configurable Systems";11;1608570257081;
"KTS+:ICSE18";"Propagating Configuration Decisions with Modal Implication Graphs";17;1616759697439;
"GYS+:EMSE18";"Data-Efficient Performance Learning for Configurable Systems";46;1607640490369;
"TKL:Modellierung18";"Feature Modeling and Development with FeatureIDE";2;1608571339802;
"AMS+:TOSEM18";"Variability Bugs in Highly Configurable Systems: A Qualitative Analysis";23;1608572421062;
"DBW:SCP18";"Variability Abstractions for Lifted Analyses";4;1608573502441;
"FACF:IST17";"Open Source Software Ecosystems: A Systematic Mapping";71;1617616971119;
"BC:CPAIOR17";"On Finding the Optimal BDD Relaxation";7;1616181313393;
"BK:Informatik17";"Adapting Binary Decision Diagrams for Visualizing Product Configuration Data";0;1616182394581;
"LMX:ASE17";"Mining Implicit Design Templates for Actionable Code Reuse";11;1612957270121;
"VSA+:IST17";"Software Product Lines Traceability: A Systematic Mapping Study";29;1612958351860;
"AT:SAT17";"Probabilistic Model Counting With Short XORs";16;1611644677385;
"LM:IJCAI17";"An Improved Decision-DNNF Compiler";57;1611645760169;
"KNF+:SPLC17";"Finding Lost Features in Cloned Systems";19;1611646842375;
"YCP:SPLC17";"Product Line Engineering Meets Model Based Engineering in the Defense and Automotive Industries";19;1616183476028;
"ABBC:Vamos17";"FLOrIDA: Feature LOcatIon DAshboard for Extracting and Visualizing Feature Traces";30;1613188511840;
"BC:SOFSEM17";"Using N-Grams for the Automated Clustering of Structural Models";13;1611587409507;
"KPS:ICMT17";"Differencing of Model Transformation Rules: Towards Versioning Support in the Development and Maintenance of Model Transformations";1;1611588490050;
"SBG+:ICGT17";"Henshin: A Usability-Focused Framework for EMF Model Transformation Development";52;1611589571785;
"OBM+:FSE17";"Finding Near-Optimal Configurations in Product Lines by Random Sampling";73;1608140589716;
"MRB+:ICPC17";"The Discipline of Preprocessor-Based Annotations - Does ifdef TAG n't endif Matter";18;1608141671174;
"G17";"Explaining Satisfiability Queries for Software Product Lines";5;1608142768117;
"K:TR17";"Differential Testing for Variational Analyses: Experience from Developing KConfigReader";13;1617655917274;
"useBBG:SPLC18";"Orchestration of Dynamic Service Product Lines with Featured Modal Contract Automata";11;1610222192224;
"SKT+:SE17";"Compositional Analyses of Highly-Configurable Systems with Feature-Model Interfaces";0;1607423894268;
"KATS:IFAC17";"Supporting the Development of Interdisciplinary Product Lines in the Manufacturing Domain";6;1607424976125;
"JVK+:SEAMS17";"Transfer Learning for Improving Model Predictions in Highly Configurable Software";61;1608575263721;
"TF17";"An Introduction to Personalization and Mass Customization";42;1608576345299;
"FLS+:CIM17";"Hyper-Heuristic Based Product Selection for Software Product Line Testing";33;1613724799757;
"useHNA+:EMSE19";"Test Them All, Is It worth It A Ground Truth Comparison of Configuration Sampling Strategies";10;1608143849029;
"useHNA+:EMSE19too";"Yo Variability! JHipster: A Playground for Web-Apps Analyses";12;1608144931084;
"FLV:SBES17";"Automatic Generation of Search-Based Algorithms Applied to the Feature Testing of Software Product Lines";11;1613725881402;
"AZAB17";"Constrained Interaction Testing: A Systematic Literature Study";39;1608577427035;
"SSA:ESECFSE17";"Attributed Variability Models: Outside the Comfort Zone";20;1608578508689;
"GRS+:CCPE17";"Performance-Influence Models of Multigrid Methods: A Case Study on Triangular Grids";12;1608579590765;
"FMP:SEFM17";"Specification Clones: An Empirical Study of the Structure of Event-B Specifications";2;1608587166451;
"ALHR:TOCE17";"Teaching Software Product Lines: A Snapshot of Current Practices and Challenges";13;1608588248900;
"BTSG:ICFEM17";"Modularization of Refinement Steps for Agile Formal Methods";2;1607963446195;
"KPK+:SPLC17";"FeatureIDE: Empowering Third-Party Developers";16;1608589331251;
"LSBL:SPLC17";"Modeling and Testing Product Lines with Unbounded Parametric Real-Time Constraints";20;1618121353422;
"KTS+:ESECFSE17";"Is There a Mismatch Between Real-World Feature Models and Product-Line Research";36;1617014952354;
"DABW:STTT17";"Efficient Family-Based Model Checking via Variability Abstractions";21;1615412614248;
"LLE:SoSyM17";"Variability Extraction and Modeling for Product Variants";61;1617634279006;
"MTS+17";"Mastering Software Variability with FeatureIDE";89;1613480774647;
"SPLC17b";"Proceedings of the 21st International Systems and Software Product Line Conference (SPLC) - Volume B";-2;1607426058597;
"CBA:OOPSLA17";"Evaluating and Improving Semistructured Merge";34;1613978101102;
"LBG:GPCE17";"A Classification of Variation Control Systems";32;1608223312830;
"MAZ:SPLC17";"ESPLA: A Catalog of Extractive SPL Adoption Case Studies";40;1608590162569;
"DHL:TAP17";"Abstraction Refinement for the Analysis of Software Product Lines";2;1608224401034;
"G:ESECFSE17";"Kmax: Finding All Configurations of Kbuild Makefiles Statically";13;1608590181938;
"LCA+:IST17";"Feature-Family-Based Reliability Analysis of Software Product Lines";7;1608225482340;
"MNS+:SPLC17";"Anomaly Detection and Explanation in Context-Aware Software Product Lines";10;1608226564062;
"ESKS:SPLC17";"An Empirical Study of Configuration Mismatches in Linux";13;1608227842879;
"WRSS:VaMoS17";"Extractive Software Product Line Engineering Using Model-based Delta Module Generation";16;1608228925663;
"SWS+:SPLC17";"Detecting Variability in MATLABSimulink Models: An Industry-Inspired Technique and Its Evaluation";10;1608747210412;
"ALL+:VACE17";"Delta-Oriented Product Prioritization for Similarity-Based Product-Line Testing";18;1607095830305;
"DW:FASE17";"Variability-Specific Abstraction Refinement for Family-Based Model Checking";23;1617641854919;
"BVW:FASE17";"Family-Based Model Checking with mCRL2";30;1617642936673;
"QPV+:SoSyM17";"The Shape of Feature Code: An Analysis of Twenty C-Preprocessor-Based Systems";32;1608748293360;
"LATS:VaMoS17";"Optimizing Product Orders Using Graph Algorithms for Improving Incremental Product-line Analysis";14;1607682119530;
"FMS+:SANER17";"Variant-Preserving Refactorings for Migrating Cloned Products to a Product Line";60;1617270392451;
"SJS+:BigMDE16";"Managing Model and Meta-Model Components with Export and Import Interfaces";5;1617901267177;
"BCE+:GaMMa06";"A Manifesto for Model Merging";190;1617902349671;
"BBIS:AIJ16";"SAT Race 2015";50;1617903430984;
"M:JSS16";"Revisiting Software Ecosystems Research: A Longitudinal Literature Study";197;1617618052375;
"GAT+:SPLC16";"Exploiting the Enumeration of All Feature Model Configurations: A New Perspective With Distributed Computing";16;1611647925410;
"CMV:IJCAI16";"Algorithmic Improvements in Approximate Counting for Probabilistic Inference: From Linear to Logarithmic SAT Calls";83;1611649006820;
"OBMS16";"Finding Product Line Configurations With High Performance by Random Sampling";5;1611650088367;
"S:SANER16";"Program Comprehension: Past, Present, and Future";42;1611651169273;
"K16";"The Role of Complex Constraints in Feature Modeling";2;1610800092049;
"KR:QREI16";"An Optimal Solution for Test Case Generation Using ROBDD Graph and PSO Algorithm";12;1610801173783;
"TS:JEA16";"Implementing Efficient All Solutions SAT Solvers";54;1610802255017;
"SWS:Modellierung16";"A Software Product Line of Feature Modeling Notations and Cross-Tree Constraint Languages";13;1610803336978;
"P16:UNED";"BDD Algorithms to Perform Hard Analysis Operations on Variability Models";0;1610804419019;
"A16";"Explaining Defects and Identifying Dependencies in Interrelated Feature Models";5;1610805500737;
"HPF+:SOMET16";"Binary Decision Diagram Algorithms to Perform Hard Analysis Operations on Variability Models";4;1610806581893;
"BCHH16";"Decision Diagrams for Optimization";102;1610807662483;
"BCHH:IJC16";"Discrete Optimization with Decision Diagrams";69;1610808743660;
"HHD:SRDS16";"UDS: A Novel and Flexible Scheduling Algorithm for Deterministic Multithreading";6;1617018199104;
"B:ASE16";"Statistical Analysis of Large Sets of Models";7;1611590653475;
"WSS:FOSD16";"Variability Mining of State Charts";9;1612489288112;
"SPA:ICMT16";"Clone Detection for Graph-Based Model Transformation Languages";13;1612490369848;
"SRA:FASE16";"RuleMerger: Automatic Construction of Variability-Based Model Transformation Rules";32;1612491452224;
"KHB+:IS16";"Detecting Complex Changes and Refactorings During (Meta) Model Evolution";23;1612721490737;
"KTRK:ICMT16";"Automatically Deriving the Specification of Model Editing Operations from Meta-Models";52;1612722572351;
"LEL:ICSE16";"A Variability Aware Configuration Management and Revision Control Platform";19;1608146013212;
"DP:ASE16";"Move-Optimized Source Code Tree Differencing";29;1608147095370;
"SW:ASE16";"SuperMod: Tool Support for Collaborative Filtered Model-Driven Software Product Line Engineering";16;1608151589982;
"RDZL:VaMoS16";"Feature Models in Linux: From Symbols to Semantics";9;1617656998153;
"FMSPLE16";"Proceedings of the 7th International Workshop on Formal Methods and Analysis in Software Product Line Engineering (FMSPLE@ETAPS)";-2;1607427140562;
"BFGM:JLAMP16";"Modelling and Analysing Variability in Product Families: Model Checking of Modal Transition Systems with Variability Constraints";58;1608550782226;
"useBVW:FASE17";"Towards a Feature mu-Calculus Targeting SPL Verification";9;1610437276422;
"BRV:ISoLA16";"Supervisory Controller Synthesis for Product Lines Using CIF 3";21;1608551864041;
"BLLV:ISoLA16";"Statistical Model Checking for Product Lines";21;1608552945180;
"HW:FOSD16";"Formula Choice Calculus";5;1608752624983;
"MFV:JSERD16";"A Multi-Objective Test Data Generation Approach for Mutation Testing of Feature Models";13;1608757447282;
"FKPV:CEC16";"Product Selection Based on Upper Confidence Bound MOEAD-DRA for Testing Software Product Lines";16;1613726963016;
"HHB:iFM16";"Can Formal Methods Improve the Efficiency of Code Reviews";10;1608230372279;
"ABB+16";"Deductive Software Verification - The KeY Book";176;1608278650081;
"WSSS:SANER16";"Custom-Tailored Variability Mining for Block-Based Languages";16;1608279731525;
"WTS+:ISoLA16";"Identifying Variability in Object-Oriented Code Using Model-Based Code Mining";6;1608280812422;
"FLRE:SBST16";"A Preliminary Empirical Assessment of Similarity for Combinatorial Interaction Testing of Software Product Lines";8;1615797876568;
"DL:iFM16";"On Type Checking Delta-Oriented Product Lines";17;1615414778518;
"SSRS:VaMoS16";"Aligning Coevolving Artifacts Between Software Product Lines and Products";16;1607932987051;
"BSD:SPLC16";"When 150% is Too Much: Supporting Product Centric Viewpoints in an Industrial Product Line";6;1608758529398;
"SBWW:ICSME16";"Concepts, Operations, and Feasibility of a Projection-Based Variation Control System";29;1607633996014;
"RGPA:SPLC16";"A Prototype-Based Approach for Managing Clones in Clone-and-Own Product Lines";9;1607639408024;
"OFAL:SPLC16";"Long-Term Average Cost in Featured Transition Systems";13;1607643733523;
"LBC:SPLC16";"Towards Clone-and-Own Support: Locating Relevant Methods in Legacy Products";15;1608759612287;
"ZGB+:SPLC16";"A Mathematical Model of Performance-Relevant Feature Interactions";11;1607637242372;
"PKM+:ICSR16";"FeatureIDE: Scalable Product Configuration of Variable Systems";24;1608760694011;
"MBW:ICSE16";"How Does the Degree of Variability Affect Bug Finding";60;1617272556626;
"BSK+:SOFTENG16";"Migration from Annotation-Based to Composition-Based Product Lines: Towards a Tool-Driven Process";-2;1609352438298;
"HZS+:EMSE16";"Preprocessor-Based Variability in Open-Source and Industrial Software Systems: An Empirical Study";68;1609353521227;
"T16";"Spezifikation und Verifikation von Produktlinien mit Feature-orientierten Vertraegen";0;1607635078320;
"SSS+16";"A Study on Tool Support for Refactoring in Database Applications";2;1607636160893;
"KAT:GPCE16";"Explaining Anomalies in Feature Models";59;1617640773849;
"AKT+:GPCE16";"IncLing: Efficient Product-line Testing Using Incremental Pairwise Sampling";71;1609354603862;
"AMK+:GPCE16";"Tool Demo: Testing Configurable Systems with FeatureIDE";33;1609359488360;
"AKTS:FOSD16";"Implicit Constraints in Partial Feature Models";34;1617645100302;
"RRM+:IST16";"Assessing Fine-Grained Feature Dependencies";31;1607669678694;
"SAKS:EMSE16";"Quantifying Structural Attributes of System Decompositions in 28 Feature-Oriented Software Product Lines";8;1616784576985;
