"BB08";"Modularizing Theorems for Software Product Lines: The Jbook Case Study";38;1594912122672;
"HKW:ICSE08";"FeatureMapper: Mapping Features to Models";234;1594913205160;
"SSP08";"The Linux Kernel Configurator as a Feature Modeling Tool";35;1598274199628;
"ACPPW08";"Engineering Formal Metatheory";240;1598275282245;
"JKB08";"Formal Methods in Software Product Lines: Concepts, Survey, and Guidelines";10;1594914291261;
"KTA08";"Visualizing Software Product Line Variabilities in Source Code";82;1598276364137;
"KAK08";"Granularity in Software Product Lines";560;1598277444970;
"MWCC08";"Efficient Compilation Techniques for Large Scale Feature Models";147;1598278527079;
"PS:ASE08";"Configuration Lifting: Verification Meets Software Configuration";99;1594915796860;
"KA08";"Type-Checking Software Product Lines-A Formal Approach";134;1598280691156;
"T08";"Reasoning about Feature Model Edits";9;1598281773721;
"WSB+:SPLC08";"Automated Diagnosis of Product-Line Configuration Errors in Feature Models";177;1601372643442;
"AL08";"Superimposition: A Language-Independent Approach to Software Composition";101;1594916884406;
"KNG:ICSE07";"Automatic Inference of Structural Changes for Matching Across Program Versions";157;1595501654656;
"SK:CSMR07";"Metamodel-Based Inference of Inter-Model Correspondence";37;1595502736638;
"NSC+:ICSE07";"Matching and Merging of Statecharts Specifications";339;1595503818034;
"S:NWMODE07";"A Review of UML Model Comparison Approaches";39;1595504899857;
"TBWK:ESECFSE07";"Difference Computation of Large Models";130;1595505981307;
"RK:D07";"Survey of Research on Software Clones";314;1593959652175;
"FWP+:TSE07";"Change Distilling: Tree Differencing for Fine-Grained Source Code Change Extraction";558;1593960734373;
"PGM+:TSE07";"Feature Location Using Probabilistic Ranking of Methods Based on Execution Scenarios and Information Retrieval";487;1593961816191;
"MVS:ISSTA07";"Automating Component-Based System Assembly";46;1591816372119;
"JDB:SPLC07";"Minimally Invasive Migration to Software Product Lines";51;1597321250531;
"FW:WMA07";"Mutant Minimization for Model-Checker Based Test-Case Generation";26;1597322331844;
"BCU:FMOODS07";"Specification of Timed EFSM Fault Models in SDL";35;1597323413561;
"BC:CGEC07";"One-test-at-a-time Heuristic Search for Interaction Test Suites";108;1597324496491;
"DHG:ICECCS07";"A Formal Contract Language for Plugin-Based Software Engineering";18;1591817454447;
"LL:DV07";"Software Engineering: Grundlagen, Menschen, Prozesse, Techniken";207;1594917969065;
"YH:ISSTA07";"Pareto Efficient Multi-objective Test Case Selection";369;1597325578630;
"RW:REJ07";"Multi-Level Feature Trees: A Pragmatic Approach to Managing Highly Complex Product Families";78;1594919053743;
"UGKB:ESEC07";"A Specification-Based Approach to Testing Software Product Lines";16;1597326660108;
"LK+:ECBS07";"IPOG: A General Strategy for T-Way Software Testing";336;1594920440523;
"NCB+SEI07";"A Framework for Software Product Line Practice, Version 5.0";133;1597818304433;
"CDS:ISSTA07";"Interaction Testing of Highly-configurable Systems in the Presence of Constraints";253;1594921522478;
"CDS:MUTATION07";"Exploiting Constraint Solving History to Construct Interaction Test Suites";41;1594922630646;
"BHJM:STTT07";"The Software Model Checker Blast: Applications to Software Engineering";1;1594924236547;
"M:ICFI07";"Quality Issues in Software Product Lines: Feature Interactions and Beyond (Invited Talk)";1;1594925316153;
"JWEG:MODELS07";"Model Composition in Product Lines and Feature Interaction Detection Using Critical Pair Analysis";186;1597823715145;
"LNW:ESOP07";"Modal IO Automata for Interface and Product Line Theories";291;1597824796630;
"LM:ICSE07";"Information Hiding and Visibility in Interface Specifications";42;1597825877383;
"KAB:SPLC07";"A Case Study Implementing Features Using AspectJ";261;1597826958455;
"W:AOSD07";"Aspect-Oriented Design Principles: Lessons from Object-Oriented Design";-2;1594926399492;
"AGDS07";"Evaluating Pair Programming with Respect to System Complexity and Programmer Expertise";308;1591818535891;
"L07";"Survey of Product-Line Verification and Validation Techniques";9;1597828041520;
"FM07";"The WhyKrakatoaCaduceus Platform for Deductive Program Verification";460;1597829123472;
"LDL07";"Safety Analysis of Software Product Lines Using State-Based Modeling";111;1597830206670;
"P:REFSQ07";"Towards Feature-Oriented Specification and Development with Event-B";35;1597831289224;
"A07";"The Role of Features and Aspects in Software Development";62;1597832371554;
"BHS07";"Verification of Object-Oriented Software: The KeY Approach";-2;1594927482043;
"SSSPS:OSSPL07";"Is the Linux Kernel a Software Product Line";77;1597833454496;
"BSTRC:VaMoS07";"FAMA: Tooling a Framework for the Automated Analysis of Feature Models";253;1594928564503;
"HZS:AOSD07";"cJ: Enhancing Java with Safe Type Conditions";47;1594929646401;
"RC07";"A Survey on Software Clone Detection Research";750;1601373724491;
"SNOPRSS07";"Ott: Effective Tool Support for the Working Semanticist";156;1594930729229;
"SSP07";"The Java Module System: Core Design and Semantic Definition";92;1594931810945;
"MHPSS:RE07";"Disambiguating the Documentation of Variability in Software Product Lines: A Separation of Concerns, Formalization and Automated Analysis";291;1594932892898;
"LSR07";"Software Product Lines in Action: The Best Industrial Practice in Product Line Engineering";964;1594933974335;
"K07";"Aspect-Oriented Refactoring of Berkeley DB";20;1601374805786;
"B07";"On the Automated Analysis of Software Product Lines Using Feature Models - A Framework for Developing Automated Tool Support";4;1591819618656;
"TBKC07";"Safe Composition of Product Lines";294;1601375887124;
"useALMK10";"An Algebra for Feature-Oriented Software Development";42;1601376967999;
"CW07";"Feature Diagrams and Logics: There and Back Again";397;1594935056738;
"JK07";"Reasoning about Feature Models in Higher-Order Logic";76;1601379130959;
"SHTB07";"Generic Semantics of Feature Diagrams";449;1591820700644;
"SE:REJ06";"View Merging in the Presence of Incompleteness and Inconsistency";127;1595507063704;
"FS06";"Product Information Management for Mass Customization: Connecting Customer, Front-Office and Back-Office for Fast and Efficient Customization";187;1594936137938;
"LST+:SIGOPS06";"A Quantitative Analysis of Aspects in the eCos Kernel";144;1600235213924;
"DL:AUSE06";"PLFaultCAT: A Product-Line Software Fault Tree Analysis Tool";57;1594937219586;
"D:QSIC06";"Quality Assessment of Mutation Operators Dedicated for C Programs";58;1601381294471;
"UL06";"Practical Model-Based Testing: A Tools Approach";1530;1594938300822;
"SHT:RE06";"Feature Diagrams: A Survey and a Formal Semantics";536;1594939382851;
"WSM+:ISSTA06";"Time-Aware Test Suite Prioritization";403;1601382376397;
"DNS+:TOPLAS06";"Traits: A Mechanism for Fine-grained Reuse";308;1594940463606;
"KC:SPLC06";"New Methods in Software Product Line Development";110;1601383458623;
"NTJ06";"System Testing of Product Lines: From Requirements to Test Cases";45;1594941544638;
"CDS:ROSATEA06";"Coverage and Adequacy in Software Product Line Testing";152;1594016533449;
"GSS+06";"Modular Software Design with Crosscutting Interfaces";311;1591821782318;
"ALSU06";"Compilers: Principles, Techniques, and Tools (2nd Edition)";-2;1594942627694;
"LBL:ICSE06";"Feature Oriented Refactoring of Legacy Applications";282;1601384540800;
"SUST:AOAsia06";"An Extensible Contract Verifier for AspectJ";16;1601385622042;
"RRDH06";"Checking JML Specifications Using an Extensible Software Model Checking Framework";27;1601388869225;
"AGMO06";"An Overview of CaesarJ";336;1601389951561;
"LC06";"Design by Contract with JML";215;1591822864469;
"FUB:ROSATEA06";"A Foundation for Behavioural Conformance in Software Product Line Architectures";169;1601391033942;
"BBC+:FMCO06";"JACK: A Tool for Validation of Security and Behaviour of Java Applications";63;1594943709063;
"F06";"Five Misunderstandings About Case-Study Research";16737;1601392115276;
"CM06";"Feature Interaction Detection by Pairwise Analysis of LTL Properties-A Case Study";44;1601393195762;
"KN06";"Formal Verification and Software Product Lines";46;1591326479494;
"H:OOPSLA06";"Eliminating Distinctions of Class: Using Prototypes to Model Virtual Classes";29;1594944790654;
"K06";"Aspect Categories and Classes of Temporal Properties";115;1591327561951;
"LBR06";"Preliminary Design of JML: A Behavioral Interface Specification Language for Java";1046;1594945873103;
"ALS:ICSE06";"Aspectual Mixin Layers: Aspects and Features in Concert";168;1594946955521;
"B:GTTSE06";"A Tutorial on Feature Oriented Programming and the AHEAD Tool Suite";129;1591328644175;
"KG06";"Supporting the Analysis of Clones in Software Systems: A Case Study";111;1594948037783;
"CP06";"Verifying Feature-Based Model Templates Against Well-Formedness OCL Constraints";289;1594017616743;
"KV06";"Towards Type Safety of Aspect-Oriented Languages";5;1591329726137;
"AWLF06";"Proof General in Eclipse: System and Architecture Overview";11;1594949119235;
"B06";"A Very Mathematical Dilemma";9;1591332972641;
"CKK06";"Feature Models are Views on Ontologies";200;1591334053904;
"TBRCST06";"Explanations for Agile Feature Models";30;1594018701712;
"BRCTS06";"A Survey on the Automated Analyses of Feture Models";0;1594019783550;
"BBRC06";"Automated Analyses of Feature Models: Challenges Ahead";297;1594950200632;
"AGMKBdL06";"Refactoring Product Lines";207;1591335135570;
"BSTRC06";"A First Step Towards a Framework for the Automated Analysis of Feature Models";1;1594020878244;
"YGM:SEAS06";"Assessing Merge Potential of Existing Engine Control Systems into a Product Line";23;1591336218160;
"KWN:GI05";"A Generic Difference Algorithm for UML Models.";201;1595508144265;
"ZS:ASE05";"UMLDiff: An Algorithm for Object-Oriented Design Differencing";510;1595509226015;
"B:TCS05";"A Survey on Tree Edit Distance and Related Problems";878;1593962897981;
"GHM+:IBMSJ05";"The Eclipse 3.0 Platform: Adopting OSGi Technology";148;1594951281683;
"YMKI:PROFES05";"Measuring Similarity of Large Software Systems Based on Source Code Correspondence";80;1594023235172;
"CK:CASSIS04";"ESCJava2: Uniting ESCJava and JML";365;1594952363220;
"C05";"A Design Discipline and Language Features for Modular Reasoning in Aspect-Oriented Programs";44;1591337299902;
"ACV+:ICSM05";"Comparative Analysis of Porting Strategies in J2ME Games";33;1591559116998;
"AMC+:SPLC05";"Extracting and Evolving Mobile Games Product Lines";139;1591561280411;
"A:ECOOP05";"Open Modules: Modular Reasoning About Advice";311;1594953445269;
"BEM:RISE05";"Can Aspects Implement Contracts";33;1591562362510;
"DNS:JACM05";"Simplify: A Theorem Prover for Program Checking";939;1594954527933;
"SGB05";"A Taxonomy of Variability Realization Techniques: Research Articles";595;1594955609962;
"BDN:OOPSLA05";"ClassboxJ: Controlling the Scope of Change in Java";152;1594956692615;
"KM:ICSE05";"Aspect-Oriented Programming and Modular Reasoning";403;1594024318455;
"BL:PASTE05";"Weakest-Precondition of Unstructured Programs";282;1595932101033;
"H:AUSE05";"Fundamental Nonmodularity in Electronic Mail";44;1595933183446;
"CKLP:FMCO05";"Beyond Assertions: Advanced Specification and Verification with JML and ESCJava2";288;1594957775588;
"BCC+05";"An Overview of JML Tools and Applications";813;1595934265353;
"LKF:AUSE05";"Modular Verification of Open Features Using Three-Valued Model Checking";63;1595935346840;
"CA:GPCE05";"Mapping Features to Models: A Template Approach Based on Superimposed Variants";722;1594958857400;
"LS05";"Extending Design by Contract for Aspect-Oriented Programming";19;1595936429323;
"FK:VSTTE05";"Decomposing Verification Around End-User Features";20;1595937511970;
"ALRS05";"FeatureC++: On the Symbiosis of Feature-Oriented and Aspect-Oriented Programming";235;1594959938916;
"W05";"Formalization and Type-Soundness Proof for Featherweight Java in Coq";-2;1594025400048;
"JavaSpec";"The Java Language Specification, Third Edition";-2;1594029374485;
"PBL05";"Software Product Line Engineering: Foundations, Principles and Techniques";4388;1594961019945;
"T05";"Enabling the Smooth Integration of Core Assets: Defining and Packaging Architectural Rules for a Family of Embedded Products";15;1594962101013;
"BSTRC05";"Using Java CSP Solvers in the Automated Analyses of Feature Models";98;1595944002111;
"KC05";"Synchronizing Cardinality-Based Feature Models and Their Specializations";62;1595949411538;
"CHE05b";"Staged Configuration through Specialization and Multi-Level Configuration of Feature Models";609;1595950492619;
"WLSZP05";"A Semantic Web Approach to Feature Modeling and Verification";120;1595954819847;
"CHE05a";"Formalizing Cardinality-Based Feature Models and Their Specialization";792;1595958065015;
"CK05";"Cardinality-Based Feature Modeling and Constraints: A Progress Report";344;1594963182044;
"BTRC05";"Using Constraint Programming to Reason on Feature Models";109;1594030455327;
"useBTRC05";"Automated Reasoning on Feature Models";803;1594031537382;
"SZLW05";"Formal Semantics and Verification for Feature Modeling";192;1598530975981;
"B05";"Feature Models, Grammars, and Propositional Formulas";1451;1598532058059;
"LAMS05";"Tool Support for Feature-Oriented Software Development - FeatureIDE: An Eclipse-Based Approach";75;1594964264160;
"AOH:ASE04";"A Differencing Algorithm for Object-Oriented Programs";186;1595510307235;
"W+:IBM04";"Eclipse: A Platform for Integrating Development Tools";163;1593963979301;
"HSJ+04";"Fast Backtrack-Free Product Configuration using a Precompiled Solution Space Representation";123;1601295992079;
"PH:Interfaces04";"Linking Product Variety to Order-Fulfillment Strategies";280;1594965346869;
"TBG:VLHCC04";"Managing Duplicated Code with Linked Editing";225;1594966429009;
"MPY+:ICSE04";"Skoll: Distributed Continuous Quality Assurance";128;1594967511013;
"GLRW:ICSR04";"Towards Generating Acceptance Tests for Product Lines";44;1596112390909;
"DL:HASE04";"Software Fault Tree Analysis for Product Lines";71;1596119962471;
"DHT:IST04";"Verifying Haskell Programs by Combining Testing, Model Checking and Interactive Theorem Proving";30;1598533138962;
"M:STVR04";"Search-Based Software Test Data Generation: A Survey: Research Articles";-2;1594968593754;
"P:SoSyM04";"Plug-and-Play Composition of Features and Feature Interactions with Statechart Diagrams";57;1598534221390;
"BFKH:ASE04";"Parameterized Interfaces for Open System Verification of Product Lines";40;1598591619963;
"HP04";"Finding Bugs is Easy";1093;1598592701635;
"KWA:TSE04";"Software Fault Interactions and Implications for Software Testing";811;1598593784451;
"SK:EIWAS04";"PCDiff: Attacking the Fragile Pointcut Problem";201;1594969674976;
"KFG:FSE04";"Verifying Aspect Advice Modularly";143;1598594867202;
"MO:FSE04";"Variability Management with Feature-Oriented Programming and Aspects";308;1598595950283;
"BPS:SCP04";"Variability Management with Feature Models";214;1598597032566;
"TTK04";"Product Family Testing: A Survey";137;1594970756625;
"useLS05";"Cona: Aspects for Contracts and Contracts for Aspects";44;1594971838339;
"AC04";"FeaturePlugin: Feature Modeling Plug-In for Eclipse";366;1594972920462;
"CCHW04";"Eclipse AspectJ: Aspect-Oriented Programming With AspectJ and the Eclipse AspectJ Development Tools";198;1594974359359;
"G04";"A Computer-Checked Proof of the Four Colour Theorem";197;1598598114609;
"SH04";"Experiences Adopting Software Product Line Development without a Product Line Architecture";55;1598599195960;
"BC04";"Interactive Theorem Proving and Program Development - Coq'Art: The Calculus of Inductive Constructions";2199;1594975441302;
"STBMPSF04";"Introducing PLA at Bosch Gasoline Systems: Experiences and Practices";125;1595222934819;
"ZZM04";"A Propositional Logic-Based Method for Verification of Feature Models";174;1598600278294;
"useCHE05b";"Staged Configuration Using Feature Models";661;1598603522514;
"AMS04";"Using a Configurator for Modelling and Configuring Software Product Lines based on Feature Models";49;1598604605430;
"BHST04";"Semantics of Feature Diagrams";-2;1594032618986;
"BSR04";"Scaling Step-Wise Refinement";1188;1594033700180;
"FV:SPE03";"Software Product Line Migration and Deployment";106;1601378050128;
"B:ICSE03";"A Tutorial on Feature-Oriented Programming and Product Lines";71;1600093948714;
"MC:PFE03";"Theorem Proving for Product Line Model Verification";59;1596121044169;
"BG:PFE03";"PLUTO: A Test Methodology for Product Families";107;1595224014679;
"CGMC:ICSE03";"Constructing Test Suites for Interaction Testing";448;1598605687388;
"H:JMLC03";"The Verifying Compiler: A Grand Challenge for Computing Research";449;1595225097303;
"AK03";"Model-Driven Development: A Metamodeling Foundation";1256;1595226180239;
"KM:CONQUEST03";"Challenges in Testing Software Product Lines";-2;1598606768874;
"H:NODe03";"Object Teams: Improving Modularity for Crosscutting Collaborations";206;1595227262346;
"BS03";"Abstract State Machines: A Method for High-Level System Design and Analysis";3;1595228343554;
"SDNB:ECOOP03";"Traits: Composable Units of Behaviour";505;1595229425667;
"MO:AOSD03";"Conquering Aspects with Caesar";389;1598607849945;
"LG03";"Analysis of a Software Product Line Architecture: An Experience Report";42;1595230506688;
"CKMR03";"Feature Interaction: A Critical Review and Considered Forecast";483;1595231589659;
"ZR03";"Pipa: A Behavioral Interface Specification Language for AspectJ";84;1595232672136;
"B03";"Composition and Construction of Embedded Software Families";62;1598610015517;
"SRP03";"Details of Formalized Relations in Feature Models Using OCL";92;1598611098290;
"CBBHROA03";"Automating Feature-Oriented Domain Analysis";-2;1598612179569;
"R03";"Towards a More Precise Definition of Feature Models";137;1598613262146;
"MGR:ICDE02";"Similarity Flooding: A Versatile Graph Matching Algorithm and Its Application to Schema Matching";1998;1595511389542;
"SGM02";"Component Software - Beyond Object-Oriented Programming";9121;1593965059801;
"DM:JAIR02";"A Knowledge Compilation Map";715;1595942921128;
"K:SPLC02";"Variation Management for Software Production Lines";184;1600236296139;
"KKI:TSE02";"CCFinder: A Multilinguistic Token-based Code Clone Detection System for Large Scale Source Code";1822;1595233754166;
"M:TSE02";"A State-of-the-Art Survey on Software Merging";636;1595959147970;
"FF:ICFP02";"Contracts for Higher-Order Functions";500;1598614343754;
"ABGM:TSE02";"Using Version Control Data to Evaluate the Impact of Software Tools: A Case Study of the Version Editor";98;1595234836076;
"CK:Software02";"Point  Counterpoint: Being Proactive Pays Off  Eliminating the Adoption Barrier";78;1595235919730;
"CL:FOAL02";"Observers and Assistants: A Proposal for Modular Aspect-Oriented Reasoning";152;1595237001738;
"KLD:Software02";"Feature-Oriented Product Line Engineering";757;1597834535687;
"UT:AOSD02";"Aspect-Oriented Programming with Model Checking";84;1597836411430;
"L02";"Specifying Systems: The TLA+ Language and Tools for Hardware and Software Engineers";0;1595239804314;
"FLL+:PLDI02";"Extended Static Checking for Java";1745;1597837492969;
"NWP02";"IsabelleHOL: A Proof Assistant for Higher-Order Logic";3779;1595240887218;
"SB02";"Mixin Layers: An Object-Oriented Implementation Technique for Refinements and Collaboration-Based Designs";410;1595241969276;
"LKF02";"Verifying Cross-Cutting Features as Open Systems";106;1597838575456;
"K:PFE02";"Easing the Transition to Software Mass Customization";420;1597839657845;
"APB:SCAM02";"Handling Preprocessor-Conditioned Declarations";46;1597840739755;
"B02";"Test Driven Development: By Example";3448;1595243052204;
"KLD:S02";"Feature-Oriented Product Line Engineering";757;1597841822135;
"SS:TOSEM02";"Behavior-Consistent Specialization of Object Life Cycles";132;1597842904373;
"SP02";"Aspect-Oriented Programming with C and .NET";76;1597843985978;
"SGSP02";"AspectC++: An Aspect-Oriented Extension to the C++ Programming Language";470;1595244134617;
"LKF:ASE02";"Interfaces for Modular Feature Verification";52;1597845066521;
"K02";"AspectC: An AOSD implementation for C";67;1595245215686;
"NPW02";"IsabelleHOL - A Proof Assistant for Higher-Order Logic";3804;1597846148176;
"P02";"Types and Programming Languages";3211;1597847229176;
"vDK02";"Domain-Specific Language Design Requires Feature Descriptions";378;1598615425852;
"RBSP02";"Extending Feature Diagrams with UML Multiplicities";288;1598687136528;
"BLHM02";"Generating Product-Lines of Product-Families";110;1599040270087;
"dJV02";"Grammars as Feature Diagrams";42;1599041364334;
"M02";"Using First-Order Logic for Product Line Model Validation";320;1599042444955;
"KKT:ASE11";"A Rule-Based Approach to the Semantic Lifting of Model Differences in the Context of Model Versioning";98;1593966141198;
"GYK:ICSE01";"Exploiting the Map Metaphor in a Tool for Software Evolution";141;1593967223249;
"SBF:IJPE01";"Mass Customization: Literature Review and Research Directions";1782;1595246297710;
"C:APSEC01";"Applying mutation analysis for object-oriented programs using a reflective approach";62;1599043526234;
"RUCH:TSE01";"Prioritizing Test Cases for Regression Testing";1383;1599044608640;
"MJ01";"Testing a Software Product Line";81;1599045689836;
"FLF:ESECFSE01";"Behavioral Contracts and Behavioral Subtyping";102;1599046770732;
"NCA:REFLECTION01";"Supporting Formal Verification of Crosscutting Concerns";30;1599047852744;
"B2001";"Software Product Lines: Organizational Alternatives";144;1595247380130;
"FL:FME01";"Houdini, an Annotation Assistant for ESCJava";442;1599048934031;
"LB:GCSE01";"A Standard Problem for Evaluating Product-Line Methodologies";228;1599051542289;
"PR01";"Feature Integration Using a Feature Construct";147;1599052623627;
"CN01";"Software Product Lines: Practices and Patterns";6;1595248462046;
"Sch01";"Automated Theorem Proving in Software Engineering";137;1599053705113;
"FK01";"Modular Verification of Collaboration-Based Software Designs";110;1599054913808;
"KHHKPG01";"An Overview of AspectJ";4253;1599055996062;
"AG01";"Implementing Product Line Variabilities";348;1599061965518;
"IPW01";"Featherweight Java: A Minimal Core Calculus for Java and GJ";1081;1595249544243;
"vGBS01";"On the Notion of Variability in Software Product Lines";800;1599063048540;
"S01";"User Interface Design for Programmers";180;1594034781287;
"DWMB:JOM00";"Approaches to Mass Customization: Configurations and Empirical Validation";1055;1595250626924;
"CR:IWPC00";"Case Study of Feature Location Using Dependence Graph";331;1598602441477;
"H:FSE00";"Testing: A Roadmap";557;1595251708391;
"EMR:SEN00";"Prioritizing Test Cases for Regression Testing";1372;1595960230046;
"OLKM00";"The Koala Component Model for Consumer Electronics Software";1009;1595961311383;
"HP:STTT00";"Model Checking Java Programs Using Java PathFinder";1000;1595962392701;
"VHBP:ASE00";"Model Checking Programs";1810;1595963475536;
"HA:FSE00";"Composing Features and Resolving Interactions";84;1595964558249;
"BCS:SPLC00";"Object-Oriented Frameworks and Product Lines";141;1595965640643;
"KPRS:GCSE00";"Aspect Composition Applying the Design by Contract Principle";69;1594035863158;
"B00";"A Run-time Assertion Checker for Java Using JML";45;1595966721178;
"SB00";"Issues Concerning Variability in Software Product Lines";106;1596109101888;
"CE00";"Generative Programming: Methods, Tools, and Applications";4576;1595252789781;
"F00";"Refactoring: Improving the Design of Existing Code";58;1595345482467;
"BR99";"Modern Information Retrieval";18427;1595512471865;
"GK:XPS99";"Knowledge-Based Configuration: Survey and Future Directions";122;1595431335019;
"Binder99";"Testing Object-oriented Systems: Models, Patterns, and Tools";2297;1595361789825;
"BFK+:SSR99";"PuLSE: A Methodology to Develop Software Product Lines";588;1595362872473;
"CCGR:CAV99";"NuSMV: A New Symbolic Model Verifier";822;1595363955059;
"TOHS:ICSE99";"N Degrees of Separation: Multi-Dimensional Separation of Concerns";1973;1595365038182;
"CGP99";"Model Checking";13691;1596110228611;
"PMDL99";"Extending Software Quality Assessment Techniques to Java Systems";83;1596111309640;
"IPW99";"Featherweight Java: A Minimal Core Calculus for Java and GJ";1081;1595366119799;
"SP98";"Gems of Theoretical Computer Science";56;1600697019172;
"AH:MOR98";"On Local Search for Weighted K-Set Packing";109;1595513554019;
"HK:JR98";"Variety for Sale: Mass Customization or Mass Confusion";1230;1595398360895;
"JZ:TSE98";"Distributed feature composition: a virtual architecture for telecommunications services";311;1595399442040;
"K:TOOLS98";"iContract - The Java(Tm) Design by Contract(Tm) Tool";-2;1594036945156;
"KC98";"JPP: A Java Pre-Processor";17;1595400535266;
"BCK98";"Software Architecture in Practice";9091;1599131864096;
"L:OOPSLA98";"Data Groups: Specifying the Modification of Extended State";209;1595401617846;
"CW:CSUR98";"Version Models for Software Configuration Management";951;1599132946194;
"BM:ICSE98";"Conceptual Module Querying for Software Reengineering";67;1599134028485;
"TWFL:IWSSD98";"Feature Engineering";-2;1599135109325;
"ML:OOPSLA98";"Adaptive Plug-and-Play Components for Evolutionary Software Development";278;1599136190394;
"FKF:POPL98";"Classes and Mixins";558;1599137270960;
"SB:ECOOP98";"Implementing Layered Designs with Mixin Layers";383;1599138352335;
"GFA98";"Integrating Feature Modeling with the RSEB";884;1599139434204;
"KKLKKS98";"FORM: A Feature-Oriented Reuse Method with Domain-Specific Reference Architectures";1492;1595402710474;
"LPM+:97";"Assessing the Benefits of Incorporating Function Clone Detection in a Development Process";284;1593968304759;
"H:TSE97";"The Model Checker SPIN";5080;1599140515024;
"N97";"Proof-Carrying Code";2555;1594038026498;
"JM97";"Design by Contract: The Lessons of Ariane";358;1595403791136;
"M97";"Advanced Compiler Design and Implementation";3921;1594039107704;
"C97";"Type Systems";615;1599141597775;
