"MAG:WASP12";"Formal Specification and Verification of Well-Formedness in Business Process Product Lines";1;1591789977770;
"JHF+:ICTSS12";"A Technique for Agile and Automatic Interaction Testing for Product Lines";26;1600252523556;
"useMRKN:iFM13";"Compositional Verification of Evolving Software Product Lines";3;1600255769413;
"L12";"Variables Nanodatenmanagement fuer eingebettete Systeme";2;1591791060615;
"B12";"Contract-Aware Feature Composition";12;1600256850856;
"GSCH:RE12";"Efficient Consistency Checking of Scenario-Based Product-Line Specifications";23;1600257932800;
"CCP+:ICSE12";"Simulation-Based Abstractions for Software Product-Line Model Checking";76;1600259015328;
"HJD:ConfWS12";"Unifying Software and Product Configuration: A Research Roadmap";26;1594646077395;
"P12";"System Design and Risk Assessment for Safety Critical Control Software Product Lines";1;1599808473313;
"useLKA+:ESECFSE13";"Large-Scale Variability-Aware Type Checking and Dataflow Analysis";18;1600408831698;
"KOE:OOPSLA12";"A Variability-Aware Module System";96;1591792142375;
"useBMB+:PLDI13";"Transparent and Efficient Reuse of IFDS-Based Static Program Analyses for Software Product Lines";0;1591792569073;
"GDS:ICSE12";"Test Confessions: A Study of Testing Practices for Plug-in Systems";71;1594647159709;
"HBC+12";"A Code Tagging Approach to Software Product Line Development";22;1600409913990;
"RC:FASE12";"Combining Related Products into Product Lines";103;1600410996712;
"SCRS12";"Mintha: A Framework for Auto-Programming and Testing of Railway Controllers for Varying Clients";1;1594648241711;
"HMZ:RAMiCS12";"Foundations of Coloring Algebra with Consequences for Feature-Oriented Programming";4;1600417486218;
"HMZ12";"Foundations of Coloring Algebra with Consequences for Feature-Oriented Programming";4;1600418567848;
"JLM+12";"A Constraint-Based Variability Modeling Framework";44;1600419648798;
"DS:ISoLA12";"Family-Based Analysis of Type Safety for Delta-Oriented Software Product Lines";25;1600420730887;
"BTG12";"A Theory of Software Product Line Refinement";62;1600421812560;
"SRC+12";"Software Diversity: State of the Art and Perspectives";137;1594649322945;
"BMS:FM12";"VMC: A Tool for Product Variability Analysis";59;1594651486688;
"SCD:FASE12";"Integration Testing of Software Product Lines Using Compositional Symbolic Execution";46;1600423977589;
"HRRS:Monterey12";"Evolving Delta-Oriented Software Product Line Architectures";45;1600425060396;
"BS:FOSD12";"Ensuring Well-Formedness of Configured Domain Models in Model-Driven Product Lines Based on Negative Variability";22;1600426141536;
"FOSD12";"Proceedings of the 4th International Workshop on Feature-Oriented Software Development (FOSD)";-2;1601329063470;
"HLL+12";"Behavioral Interface Specification Languages";178;1600427224203;
"DDJ+:FMSPLE12";"A Transformational Proof System for Delta-Oriented Programming";29;1600428306755;
"T:MIT12";"Verification of Software Product Lines Using Contracts";3;1600429389033;
"TSAH:GPCE12";"Family-Based Deductive Verification of Software Product Lines";79;1600430470272;
"KATS:TOSEM12";"Type Checking Annotation-Based Product Lines";154;1591793650950;
"B:PLAS12";"Position Paper: Static Flow-Sensitive and Context-Sensitive Information-Flow Analysis for Software Product Lines";11;1594653649195;
"useBRT+13";"Intraprocedural Dataflow Analysis for Software Product Lines";96;1600431553186;
"ASL+12";"Access Control in Feature-Oriented Programming";58;1600432634351;
"useTAK+:CSUR";"Analysis Strategies for Software Product Lines";82;1600492755430;
"TLD:OSR12";"Configuration Coverage in the Analysis of Large-Scale System Software";75;1591794733818;
"TSK+:FASE12";"Applying Design by Contract to Feature-Oriented Programming";38;1600699183216;
"STKS:VaMoS12";"Variant-Preserving Refactoring in Feature-Oriented Software Product Lines";70;1600700265660;
"CCG+:REMODD11";"Requirements Definition Document for a Software Product Line of Car Crash Management Systems";23;1595496244005;
"CCGI:CMA11";"OO-SPL Modelling of the Focused Case Study";13;1595497326824;
"PA:CoRR11";"RTED: A Robust Algorithm for the Tree Edit Distance";227;1593952078962;
"LKA:AOSD11";"Analyzing the Discipline of Preprocessor Annotations in 30 Million Lines of C Code";124;1593953160364;
"CBH:SCP11";"A Text-Based Approach to Feature Modelling: Syntax and Semantics of TVL";205;1594126665562;
"PLP11";"A Performance Comparison of Contemporary Algorithmic Approaches for Automated Analysis Operations on Feature Models";47;1591330808516;
"HGS+:JRCS11";"The Effect of Default Options on Choice-Evidence from Online Product Configurators";25;1594654731715;
"OZLG:SPLC11";"Pairwise Feature-Interaction Testing for SPLs: Potentials and Limitations";53;1593954243125;
"useXXJ:WCRE12";"Reengineering Legacy Software Products into Software Product Line Based on Automatic Variability Analysis";32;1600254687211;
"ACLF:ASE11";"Slicing Feature Models";74;1600701348548;
"KSL+:Promise11";"Are Change Metrics Good Predictors for an Evolving Software Product Line";34;1600702429946;
"KLG:MSR11";"Empirical Evaluation of Reliability Improvement in an Evolving Software Product Line";17;1600703512856;
"CMN:STVR11";"On the Use of a Similarity Function for Test Case Selection in the Context of Model-Based Testing";90;1600704593988;
"GC:ISSRE11";"Feature Interaction Faults Revisited: An Exploratory Study";61;1594655812794;
"AB:ICSE11";"A Practical Guide for Using Statistical Tests to Assess Randomized Algorithms in Software Engineering";680;1600706756953;
"HBG:ISSRE11";"PACOGEN: Automatic Generation of Pairwise Test Configurations from Feature Models";82;1594656893187;
"BG:SQJ11";"Assessing the Maintainability of Software Product Line Feature Models Using Structural Metrics";140;1600707839115;
"ALB+:ESECFSE11";"Semistructured Merge: Rethinking Merge in Revision Control Systems";93;1594657974887;
"DKB:WCRE11";"Analyzing the Source Code of Multiple Software Variants for Reuse Potential";67;1600708920373;
"Pa11";"Sustainable Evolution of Product Line Infrastructure Code";-2;1595947248166;
"HHJ+:FMCO11";"HATS Abstract Behavioral Specification: The Architectural View";20;1594659055762;
"W11";"Deductive Verification of Object-Oriented Software: Dynamic Frames, Dynamic Logic, and Predicate Abstraction";69;1594660136700;
"HZS:SCP11";"Statically Safe Program Generation with SafeGen";80;1600710000827;
"HS:TOPLAS11";"Morphing: Structurally Shaping a Class by Reflecting on Others";28;1594661218935;
"HHSDA11";"Supporting Multiple Perspectives in Feature-Based Configuration";71;1600711083752;
"EB+:ITNG11";"Goal-Oriented Test Case Selection and Prioritization for Product Line Feature Models";46;1600712165935;
"JHF:MODELS11";"Properties of Realistic Feature Models Make Combinatorial Testing of Product Lines Feasible";93;1600713248788;
"GCD:ESE11";"Evaluating Improvements to a Meta-Heuristic Search for Constrained Interaction Testing";205;1600752105750;
"JH:TSE11";"An Analysis and Survey of the Development of Mutation Testing";1418;1600753186906;
"C:NFM11";"OpenJML: JML for Java 7 by Extending OpenJDK";88;1594662301000;
"LWE:VLHCC11";"ifdef Confirmed Harmful: Promoting Understandable Software Variation";66;1594663381899;
"FSP+:EASE11";"Using Background Colors to Support Program Comprehension in Software Product Lines";53;1591796897422;
"YYZ+:ESECFSE11";"How Do Fixes Become Bugs";229;1600754269010;
"SK:FACS11";"Reducing the Model Checking Cost of Product Lines Using Static Analysis Techniques";4;1600755350010;
"NL:CSUR11";"A Survey of Combinatorial Testing";620;1600756431467;
"BK:CAV11";"CPAchecker: A Tool for Configurable Software Verification";499;1594672964345;
"OWES11";"A Survey of Model-Based Software Product Lines Testing";53;1600757513556;
"LHME:SPLC11";"From Requirements to Features: An Exploratory Study of Feature-Oriented Refactoring";33;1594674045688;
"DCI+11";"A Systematic Mapping Study of Software Product Lines Testing";244;1600765375854;
"ALH+:ICSR11";"Supporting Consistency Checking Between Features and Software Product Line Use Scenarios";27;1600766457995;
"KAO:FOSD11";"The Road to Feature Modularity";65;1600767540409;
"EW11";"The Choice Calculus: A Representation for Software Variation";136;1594675126656;
"RCL+:FTfJP11";"On the Interplay of Exception Handling and Design by Contract: An Aspect-Oriented Recovery Approach";10;1594676209642;
"P11";"Precise Documentation: The Key to Better Software";103;1594677292622;
"RQB+:GPCE11";"On the Impact of Feature Dependencies when Maintaining Preprocessor-Based Software Product Lines";36;1600857127809;
"GWW+11";"A Genetic Algorithm for Optimized Feature Selection with Resource Constraints in Software Product Lines";179;1600858209699;
"ABFG:FMOODS11";"A Model-Checking Tool for Families of Services";34;1600860371664;
"TBG:SBES11";"Safe Composition of Configuration Knowledge-Based Software Product Lines";24;1600861454448;
"NTS+:GPCE11";"Investigating the Safe Evolution of Software Product Lines";76;1600862536902;
"GPB:SC11";"Composing Event-B Specifications: Case-Study Experience";26;1594712763711;
"ABF+:PLEASE11";"Design and Validation of Variability in Product Lines";20;1600863618480;
"BMP:SERENE11";"Guaranteeing Correct Evolution of Software Product Lines: Setting up the Problem";4;1594713845875;
"useABFG:ISoLA12";"Formal Description of Variability in Product Families";112;1591800143977;
"CE:SPLC11";"Optimizing the Product Derivation Process";19;1600864700314;
"KA:GTTSE11";"Feature-Oriented Software Development: A Short Tutorial on Feature-Oriented Programming, Virtual Separation of Concerns, and Variability-Aware Analysis";23;1594714927321;
"TSP+:11";"AutoDaMa: On the Feasibility of Secure and Tailor-made Automotive Data Management";-2;1594716009730;
"ASW+:ASE11";"Detection of Feature Interactions Using Feature-Aware Verification";136;1600865782454;
"useASW+:ASE11";"Feature-Aware Verification";2;1595948329928;
"BKS:FoVeOOS11";"Verification of Software Product Lines with Delta-Oriented Slicing";46;1600866864019;
"KBK:AOSD11";"Reducing Combinatorics in Testing Product Lines";127;1600867945965;
"ACLF:SAC11";"A Domain-Specific Language for Managing Feature Models";43;1600869027951;
"BFL+11";"Specification and Verification: The Spec Experience";184;1594752139758;
"ER:IST11";"Software Product Line Testing - A Systematic Mapping Study";343;1600871191594;
"TLSS:EuroSys11";"Feature Consistency in Compile-Time-Configurable System Software: Facing the Linux 10,000 Feature Problem";157;1594753221213;
"KGR+:OOPSLA11";"Variability-Aware Parsing in the Presence of Lexical Macros and Conditional Compilation";255;1598283936668;
"DCB:OOPSLA11";"Product Lines of Theorems";38;1598285018564;
"HRRS:MBEES11";"Delta Modeling for Software Architectures";54;1598286099582;
"H11";"Next-Generation Feature Models with Pseudo-Boolean SAT Solvers";4;1598372501489;
"useHS:ISoLA12";"A Liskov Principle for Delta-Oriented Programming";41;1598521242446;
"STAL:FOSD11";"Automatic Detection of Feature Interactions Using the Java Modeling Language: An Experience Report";27;1594754303306;
"LBL:AUSE11";"Compositional Model Checking of Software Product Lines Using Variation Point Obligations";65;1600873365832;
"SH11";"Formal Methods in Software Product Line Engineering";52;1598522323179;
"SBD11";"Compositional Type-Checking for Delta-Oriented Programming";66;1598523404637;
"CHSL:ICSE11";"Symbolic Model Checking of Software Product Lines";254;1598524486664;
"SRK+:SPLC11";"Scalable Prediction of Non-Functional Properties in Software Product Lines";73;1594755386320;
"TKES:SPLC11";"Abstract Features in Feature Modeling";154;1598525567361;
"RS:ICST11";"Runtime Verification of Linux Kernel Modules Based on Call Interception";27;1598526648291;
"MCHB:VAMOS11";"A Formal Semantics for Feature Cardinalities in Feature Diagrams";54;1598527730992;
"SLBWC:ICSE11";"Reverse Engineering Feature Models";331;1598528812189;
"TSKA:VAST11";"Proof Composition for Deductive Verification of Software Product Lines";52;1598529894320;
"OZML:VaMoS11";"MoSo-PoLiTe - Tool Support for Pairwise and Model-Based Software Product Line Testing";63;1601266881026;
"RSTS:VAMOS11";"Multi-Dimensional Variability Modeling";79;1601268687678;
"DR:TOSEM10";"Clone Region Descriptors: Representing and Tracking Duplication in Source Code";94;1593955325204;
"LSB+:SPLC10";"Evolution of the Linux Kernel Variability Model";180;1600415323575;
"SB:TR10";"Formal Semantics of the Kconfig Language";44;1600416404970;
"KZK:LoCoCo10";"Model Counting in Product Configuration";21;1591331891185;
"DGRN:JSS10";"Structuring the Modeling Space and Supporting Evolution in Software Product Line Engineering";116;1601316556211;
"MC:SCP10";"Decision-Making Coordination and Efficient Reasoning Techniques for Feature-Based Configuration";68;1600147730780;
"D:SPLC10";"Visualizing and Analyzing Software Variability with Bar Diagrams and Occurrence Matrices";7;1596115635120;
"GKN:SPLC10";"Sans Constraints Feature Diagrams vs. Feature Models";6;1601269769700;
"SF:DLS10";"Contracts for First-Class Classes";29;1601270852900;
"HEB+:FOSD10";"Toolchain-Independent Variant Management with the Leviathan Filesystem";17;1601271934632;
"BMB+:Models10";"Aspect-Oriented Feature Models";26;1601273020525;
"KO:OOPSLA10";"Modular Logic Metaprogramming";9;1601274102664;
"KKHL:FOSD10";"TypeChef: Toward Type Checking Ifdef Variability in C";82;1594756468082;
"ABGF:VaMoS10";"A Deontic Logical Framework for Modelling Product Families";31;1601276846101;
"RS:VaMoS10";"Automating the Configuration of Multi Software Product Lines";99;1601277927325;
"HB:ISSRE10";"An Industrial Investigation of Similarity Measures for Model-Based Test Case Selection";66;1601279010091;
"M10";"Testing a Software Product Line";81;1601281192844;
"SK:FMSPLE10";"An Effective Approach for Verifying Product Lines in Presence of Variability Models";0;1591801225162;
"useKBK:AOSD11";"Eliminating Products to Test in a Software Product Line";8;1591802307852;
"A10";"Modeling in Event-B: System and Software Engineering";1831;1594757551379;
"SPB:ABZ10";"A Basis for Feature-Oriented Modelling in Event-B";16;1601282274599;
"SOM:SOFSEM10";"Model-Driven Software Product Line Testing: An Integrated Approach";19;1594797911238;
"LMP10";"Quality Assurance in the Presence of Variability";22;1601283362332;
"VGE+:ASE10";"Flexible and Scalable Consistency Checking on Product Line Variability Models";68;1601291665749;
"MCP+:FMSPLE10";"Feature Petri Nets";37;1601292747046;
"KBBK:RV10";"Reducing Configurations to Monitor in a Software Product Line";50;1601293828634;
"ALMK10";"An Algebraic Foundation for Automatic Feature-Based Program Synthesis";63;1601294909783;
"ABFG:iFM10";"A Logical Framework to Deal with Variability";72;1601297072960;
"DJOS10";"Lazy Behavioral Subtyping";32;1601298154010;
"BDH:FoVeOOS10";"Verification of Variable Software: An Experience Report";4;1594845340292;
"SMP:SPLC10";"Avoiding Redundant Testing in Application Engineering";40;1601299234696;
"RSK:FOSD10";"Improving Reuse of Component Families by Generating Component Hierarchies";7;1601300315979;
"AL:iFM10";"Adding Change Impact Analysis to the Formal Verification of C Programs";3;1601301398310;
"STL:TR10";"An Algorithm for Quantifying the Program Variability Induced by Conditional Compilation";4;1601302480183;
"STLS:GPCE10";"Efficient Extraction and Analysis of Preprocessor-Based Variability";52;1601304642957;
"HPSA:SAC10";"Dynamic Contract Layers";27;1601305724846;
"ASLK:FOSD10";"Language-Independent Reference Checking in Software Product Lines";23;1601306807918;
"NNH10";"Principles of Program Analysis";2658;1601307890274;
"SGS:FMCO10";"Compositional Algorithmic Verification of Software Product Lines";28;1601308972073;
"BCH+:ASE10";"Tag and Prune: A Pragmatic Approach to Software Product Line Implementation";38;1594846423134;
"RPRB:SPLASH10";"Emergent Feature Modularization";42;1601330145128;
"BDS:SAC10";"Implementing Software Product Lines Using Traits";48;1601331226616;
"AH:TOPLAS10";"A Calculus for Uniform Feature Composition";54;1601332308806;
"SC10";"A New Eclipse-Based JML Compiler Built Using AST Merging";20;1601333390677;
"PSK+:ICST10";"Automated and Scalable T-Wise Test Case Generation Strategies for Software Product Lines";250;1601365226951;
"RPK:GPCE10";"Automatic Variation-Point Identification in Function-Block-Based Models";54;1601368302525;
"KS:FOSD10";"Patching Product Line Programs";4;1601369383818;
"CIZ:OOPSLA10";"Mostly Modular Compilation of Crosscutting Concerns by Contextual Predicate Dispatch";29;1601370476720;
"BSLWC:ASE10";"Variability Modeling in the Real: A Perspective from the Operating Systems Domain";171;1594847503852;
"OMR:SPLC10";"Automated Incremental Pairwise Testing of Software Product Lines";173;1597080540246;
"K10";"Virtual Separation of Concerns: Toward Preprocessors 2.0";16;1594848585400;
"CHSLR10";"Model Checking Lots of Systems: Efficient Verification of Temporal Properties in Software Product Lines";349;1594886530010;
"AKGL10";"Type Safety for Feature-Oriented Product Lines";148;1597081621904;
"T10";"A Machine-Checked Proof for a Product-Line-Aware Type System";11;1597082703218;
"ASLK:ISSRE10";"Detecting Dependences and Interactions in Feature-Oriented Design";61;1597120580860;
"SBB+:SPLC10";"Delta-Oriented Programming of Software Product Lines";388;1597120673359;
"LAL+:ICSE10";"An Analysis of the Variability in Forty Preprocessor-Based Software Product Lines";306;1597120984732;
"BSRC10";"Automated Analysis of Feature Models 20 Years Later: A Literature Review";1274;1594887612361;
"CCD:ICSE09";"Ldiff: An Enhanced Line Differencing Tool";52;1595498410490;
"KDPP:CVSM09";"Different Models for Model Matching: An Analysis of Approaches to Support Model Differencing";232;1595499491519;
"KAT:TOOLSeurope09";"Guaranteeing Syntactic Correctness for All Product Line Variants: A Language-Independent Approach";82;1593956406113;
"WZD:ICSM09";"Managing Code Clones Using Dynamic Change Tracking and Resolution";74;1593957487175;
"BBH+09";"Handbook of Satisfiability: Volume 185 Frontiers in Artificial Intelligence and Applications";1783;1594127746966;
"SS:HICSS09";"Challenges in Software Product Line Composition";21;1601317638731;
"SBFF:HICSS09";"Are De-Facto Standards a Useful Guide for Designing Human-Computer Interaction Processes The Case of User Interface Design for Web Based B2C Product Configurators";14;1594888694662;
"OG:ICSR09";"Reusable Model-Based Testing";29;1596117799487;
"KFBA:SQJ09";"Extending the Reflexion Method for Consolidating Software Variants into Product Lines";70;1601371558041;
"YHMS:ISSTA09";"Clustering Test Cases to Achieve Effective and Scalable Prioritisation Incorporating Expert Knowledge";191;1597121549930;
"RCK:SCP09";"Comparison and Evaluation of Code Clone Detection Techniques and Tools: A Qualitative Approach";973;1594889776184;
"MKB:JSME09";"An Evaluation of Code Similarity Identification for the Grow-and-Prune Model";67;1597121596392;
"BDGG:NC09";"A Survey on Metaheuristics for Stochastic Combinatorial Optimization";623;1597121653368;
"ACLF:SLE09";"Composing Feature Models";116;1597121873058;
"YD:NaBIC09";"Cuckoo Search via Levy Flights";4974;1597122026655;
"CHTN:ICSE09";"Towards Safer Composition";24;1597122071159;
"ABGF:VaMoS09";"Deontic Logics for Modeling Behavioural Variability - Research in Progress";0;1591803389314;
"ALKKL:FOSD09";"An Orthogonal Access Modifier Model for Feature-Oriented Programming";7;1597122146294;
"MSA:09";"Viewpoint-Oriented Variability Modeling";-2;1597122166671;
"WCR:SPLC09";"A Framework for Constructing Semantically Composable Feature Models from Natural Language Requirements";147;1597122292488;
"RBK:SBLP09";"Optimizing JML Feature Compilation in Ajmlc Using Aspect-Oriented Refactorings";22;1597122465042;
"CMRH09";"Software Dependencies, Work Dependencies, and Their Impact on Failures";275;1591804472038;
"PPR+:SIGMOD09";"A Comparison of Approaches to Large-scale Data Analysis";1442;1597122596013;
"WDF+:CADE09";"SPASS Version 3.5";306;1591805553144;
"MBNJ:ICSE09";"Taming Dynamically Adaptive Systems Using Models and Aspects";278;1597123678124;
"MDHS09";"Producing Wrong Data Without Doing Anything Obviously Wrong!";332;1591806635674;
"C09";"How NOT to Review a Paper: The Tools and Techniques of the Adversarial Reviewer";13;1594890856993;
"MFC+09";"Programs That Test Themselves";107;1597124762290;
"MA:SPLC09";"Gathering Current Knowledge About Quality Evaluation in Software Product Lines";37;1597125846658;
"TRC:VaMoS09";"Abductive Reasoning and Automated Analysis of Feature Models: How are They Connected";65;1594891939530;
"TSS+:FOSD09";"Dead or Alive: Finding Zombie Features in the Linux Kernel";57;1594893021109;
"DCB09";"Fitting the Pieces Together: A Machine-Checked Model of Safe Composition";77;1594894102197;
"useDCB09";"A Machine-Checked Model of Safe Composition";44;1597126929467;
"MWC:SPLC09";"SAT-Based Analysis of Feature Models is Easy";323;1597128012432;
"KAR+:SPLC09";"On the Impact of the Optional Feature Problem: Analysis and Case Studies";106;1594895184223;
"H:FOSD09";"Towards Systematic Ensuring Well-Formedness of Software Product Lines";46;1597129095293;
"BJS:VaMoS09";"A Design of a Configurable Feature Model Configurator";49;1597130185787;
"M09";"Efficient Reasoning Techniques for Large Scale Feature Models";91;1597262304291;
"HM:FOSD09";"An Extension for Feature Algebra";6;1597263385180;
"KBK:GPCE09";"Safe Composition of Non-Monotonic Features";37;1597264466918;
"MBC:OOPSLA09";"S.P.L.O.T.: Software Product Lines Online Tools";419;1594896266198;
"LPT09";"Model Checking of Domain Artifacts in Product Line Engineering";166;1597265549008;
"WDS09";"Selecting Highly Optimal Architectural Feature Sets with Filtered Cartesian Flattening";156;1597266631509;
"KA:JOT09";"Virtual Separation of Concerns - A Second Chance for Preprocessors";121;1600097192508;
"AK09";"An Overview of Feature-Oriented Software Development";503;1597267714083;
"useAKL13";"FeatureHouse: Language-Independent, Automated Software Composition";278;1594897347340;
"KAK:GPCE09";"A Model of Refactoring Physically and Virtually Separated Features";81;1591807717882;
"R09";"Alternative Features in Colored Featherweight Java";5;1591808799263;
"F09b";"Formalization and Type-Soundness Proof for Featherweight Java in Coq";-2;1591809880367;
"F09";"Language Facilities for the Deployment of Reusable Aspects";6;1591810961524;
"AKGL09";"Type-Safe Feature-Oriented Product Lines";-2;1591812043955;
"JDHW09";"Do Code Clones Matter";473;1591813126216;
"TBK:ICSE09";"Reasoning about Edits to Feature Models";400;1601387786924;
"KTS+:ICSE09";"FeatureIDE: A Tool Framework for Feature-Oriented Software Development";250;1594902251302;
"BP:UPGRADE08";"Model Differences in the Eclipse Modeling Framework";213;1595500572279;
"HM:WCRE08";"DiffTS: A Tool for Fine-Grained Structural Change Analysis";55;1593958570056;
"HMO+:SPLC08";"Adding Standardized Variability to Domain Specific Languages";249;1594128828119;
"K:ICSM08";"Frontiers of Software Clone Management";78;1591560198967;
"HHPS:Computer08";"Dynamic Software Product Lines";463;1600234131882;
"LS:JAR08";"Algorithms for Computing Minimal Unsatisfiable Subsets of Constraints";329;1600874448218;
"MBKM:CSMR08";"Supporting the Grow-and-Prune Model in Software Product Lines Evolution Using Clone Detection";76;1596118881396;
"AT:ISSRE08";"Automated Generation of Pointcut Mutants for Testing Pointcuts in AspectJ Programs";50;1597275944393;
"DKN+:WCRE08";"Variant Comparison - A Technique for Visualizing Software Variants";10;1597302864568;
"HSW:VISPLE08";"On Controlled Visualisations in Software Product Line Engineering";39;1597303946764;
"KKB:GPCE08";"On the Modularity of Feature Interactions";50;1597305028529;
"P:ABZ08";"The Composition of Event-B Models";38;1597306110254;
"SG08";"Verified Software: Theories, Tools, Experiments";-2;1594903333552;
"BTC:ICECCS08";"On Extracting Tests from a Testable Model in the Context of Domain Engineering";13;1597307191634;
"LMN:SPLC08";"An Approach for Developing Service Oriented Product Lines";71;1597309354529;
"CDS:TSE08";"Constructing Interaction Test Suites for Highly-Configurable Systems in the Presence of Constraints: A Greedy Approach";313;1594904415666;
"ESB08";"Quality-Aware Software Product Line Engineering";32;1597310436033;
"ENC+:ICSE08";"Evolving Software Product Lines with Aspects: An Empirical Study on Design Stability";447;1594905497880;
"JCP08";"Reporting Experiments in Software Engineering";328;1597311517809;
"HKL+08";"Parallelizing Query Optimization";57;1597312598591;
"L:BSD08";"LLVM and Clang: Next Generation Compiler Technology";213;1594906580164;
"AHM+08";"Using Static Analysis to Find Bugs";458;1597313680271;
"HH:FM08";"Towards Consistent Specifications of Product Families";25;1597314761586;
"RSL+:SAVCBS08";"JML and Aspects: The Benefits of Instrumenting JML Features with AspectJ";7;1594908871569;
"TBD+08";"Automated Error Analysis for the Agilization of Feature Modeling";185;1591814208524;
"hall-of-fame";"The Product Line Hall of Fame";43;1598263379554;
"GLS08";"Modeling and Model Checking Software Product Lines";180;1598264461222;
"FG:SPLC08";"Formal Modeling for Product Families Engineering";114;1598265543404;
"AKL:GPCE08";"Feature Featherweight Java: A Calculus for Feature-Oriented Programming and Stepwise Refinement";83;1594909954496;
"ALS:TSE08";"Aspectual Feature Modules";198;1591815291034;
"AMG08";"Contracts for Aspect-Oriented Design";12;1598266625860;
"RLCS08";"A JML Compiler Based on AspectJ";10;1598267708205;
"KARL:TOOLS08";"A Multiparadigm Study of Crosscutting Modularity in Design Patterns";6;1598272036083;
"SKRKS:VaMoS08";"Integrated Product Line Model for Semi-Automated Product Derivation Using Non-Functional Properties";39;1598273117673;
"SRKKS:APSEC08";"Measuring Non-Functional Properties in Software Product Lines for Product Derivation";52;1594911036788;
