"C:NFM11";"OpenJML: JML for Java 7 by Extending OpenJDK";83;1581523764149;
"LWE:VLHCC11";"ifdef Confirmed Harmful: Promoting Understandable Software Variation";64;1581524847201;
"FSP+:EASE11";"Using Background Colors to Support Program Comprehension in Software Product Lines";53;1580159095188;
"YYZ+:ESECFSE11";"How Do Fixes Become Bugs";211;1584349016103;
"SK:FACS11";"Reducing the Model Checking Cost of Product Lines Using Static Analysis Techniques";4;1584350097738;
"NL:CSUR11";"A Survey of Combinatorial Testing";585;1584351178885;
"BK:CAV11";"CPAchecker: A Tool for Configurable Software Verification";461;1581525929980;
"OWES11";"A Survey of Model-Based Software Product Lines Testing";51;1584352260704;
"LHME:SPLC11";"From Requirements to Features: An Exploratory Study of Feature-Oriented Refactoring";32;1581527011981;
"DCI+11";"A Systematic Mapping Study of Software Product Lines Testing";222;1584356586224;
"ALH+:ICSR11";"Supporting Consistency Checking Between Features and Software Product Line Use Scenarios";25;1584357667507;
"KAO:FOSD11";"The Road to Feature Modularity";65;1584358748539;
"EW11";"The Choice Calculus: A Representation for Software Variation";133;1581529392638;
"RCL+:FTfJP11";"On the Interplay of Exception Handling and Design by Contract: An Aspect-Oriented Recovery Approach";10;1581530492961;
"P11";"Precise Documentation: The Key to Better Software";96;1581531633561;
"RQB+:GPCE11";"On the Impact of Feature Dependencies when Maintaining Preprocessor-Based Software Product Lines";34;1584359829931;
"GWW+11";"A Genetic Algorithm for Optimized Feature Selection with Resource Constraints in Software Product Lines";169;1584360912622;
"ABFG:FMOODS11";"A Model-Checking Tool for Families of Services";34;1584363076526;
"TBG:SBES11";"Safe Composition of Configuration Knowledge-Based Software Product Lines";23;1584364158670;
"NTS+:GPCE11";"Investigating the Safe Evolution of Software Product Lines";73;1584365240804;
"GPB:SC11";"Composing Event-B Specifications: Case-Study Experience";26;1581532720916;
"ABF+:PLEASE11";"Design and Validation of Variability in Product Lines";20;1584366321321;
"BMP:SERENE11";"Guaranteeing Correct Evolution of Software Product Lines: Setting up the Problem";4;1581533805078;
"useABFG:ISoLA12";"Formal Description of Variability in Product Families";111;1580162341803;
"CE:SPLC11";"Optimizing the Product Derivation Process";18;1584367403512;
"KA:GTTSE11";"Feature-Oriented Software Development: A Short Tutorial on Feature-Oriented Programming, Virtual Separation of Concerns, and Variability-Aware Analysis";-2;1581534893979;
"TSP+:11";"AutoDaMa: On the Feasibility of Secure and Tailor-made Automotive Data Management";-2;1581536044189;
"ASW+:ASE11";"Detection of Feature Interactions Using Feature-Aware Verification";124;1584368485982;
"useASW+:ASE11";"Feature-Aware Verification";2;1582264249141;
"BKS:FoVeOOS11";"Verification of Software Product Lines with Delta-Oriented Slicing";43;1584369566900;
"KBK:AOSD11";"Reducing Combinatorics in Testing Product Lines";122;1584370649372;
"ACLF:SAC11";"A Domain-Specific Language for Managing Feature Models";41;1584371731065;
"BFL+11";"Specification and Verification: The Spec Experience";175;1581537127658;
"ER:IST11";"Software Product Line Testing - A Systematic Mapping Study";319;1584373894920;
"TLSS:EuroSys11";"Feature Consistency in Compile-Time-Configurable System Software: Facing the Linux 10,000 Feature Problem";147;1581709191261;
"KGR+:OOPSLA11";"Variability-Aware Parsing in the Presence of Lexical Macros and Conditional Compilation";253;1582805183187;
"DCB:OOPSLA11";"Product Lines of Theorems";37;1582806265875;
"HRRS:MBEES11";"Delta Modeling for Software Architectures";54;1582807347159;
"H11";"Next-Generation Feature Models with Pseudo-Boolean SAT Solvers";4;1582808427882;
"useHS:ISoLA12";"A Liskov Principle for Delta-Oriented Programming";40;1582809508124;
"STAL:FOSD11";"Automatic Detection of Feature Interactions Using the Java Modeling Language: An Experience Report";27;1581710273016;
"LBL:AUSE11";"Compositional Model Checking of Software Product Lines Using Variation Point Obligations";62;1584374976226;
"SH11";"Formal Methods in Software Product Line Engineering";50;1582810589173;
"SBD11";"Compositional Type-Checking for Delta-Oriented Programming";65;1582811671961;
"CHSL:ICSE11";"Symbolic Model Checking of Software Product Lines";241;1582812753208;
"SRK+:SPLC11";"Scalable Prediction of Non-Functional Properties in Software Product Lines";70;1581711355541;
"TKES:SPLC11";"Abstract Features in Feature Modeling";147;1582813834458;
"RS:ICST11";"Runtime Verification of Linux Kernel Modules Based on Call Interception";27;1582814915113;
"MCHB:VAMOS11";"A Formal Semantics for Feature Cardinalities in Feature Diagrams";50;1582815996594;
"SLBWC:ICSE11";"Reverse Engineering Feature Models";320;1582817078416;
"TSKA:VAST11";"Proof Composition for Deductive Verification of Software Product Lines";49;1582818160314;
"OZML:VaMoS11";"MoSo-PoLiTe - Tool Support for Pairwise and Model-Based Software Product Line Testing";61;1584377140252;
"RSTS:VAMOS11";"Multi-Dimensional Variability Modeling";67;1584378221435;
"LSB+:SPLC10";"Evolution of the Linux Kernel Variability Model";161;1584136114720;
"SB:TR10";"Formal Semantics of the Kconfig Language";39;1584137196982;
"KZK:LoCoCo10";"Model Counting in Product Configuration";21;1584973467627;
"DGRN:JSS10";"Structuring the Modeling Space and Supporting Evolution in Software Product Line Engineering";115;1584682867760;
"MC:SCP10";"Decision-Making Coordination and Efficient Reasoning Techniques for Feature-Based Configuration";68;1583916039983;
"D:SPLC10";"Visualizing and Analyzing Software Variability with Bar Diagrams and Occurrence Matrices";7;1582291289886;
"GKN:SPLC10";"Sans Constraints Feature Diagrams vs. Feature Models";6;1584379303652;
"SF:DLS10";"Contracts for First-Class Classes";29;1584380385376;
"HEB+:FOSD10";"Toolchain-Independent Variant Management with the Leviathan Filesystem";16;1584381467706;
"BMB+:Models10";"Aspect-Oriented Feature Models";26;1584382549619;
"KO:OOPSLA10";"Modular Logic Metaprogramming";8;1584383631601;
"KKHL:FOSD10";"TypeChef: Toward Type Checking Ifdef Variability in C";81;1581712441883;
"ABGF:VaMoS10";"A Deontic Logical Framework for Modelling Product Families";30;1584385794438;
"RS:VaMoS10";"Automating the Configuration of Multi Software Product Lines";95;1584386875950;
"HB:ISSRE10";"An Industrial Investigation of Similarity Measures for Model-Based Test Case Selection";60;1584387958489;
"M10";"Testing a Software Product Line";225;1584389039825;
"SK:FMSPLE10";"An Effective Approach for Verifying Product Lines in Presence of Variability Models";0;1580163422965;
"useKBK:AOSD11";"Eliminating Products to Test in a Software Product Line";8;1580164289948;
"A10";"Modeling in Event-B: System and Software Engineering";1751;1581747469459;
"SPB:ABZ10";"A Basis for Feature-Oriented Modelling in Event-B";16;1584390121634;
"SOM:SOFSEM10";"Model-Driven Software Product Line Testing: An Integrated Approach";19;1581844346974;
"LMP10";"Quality Assurance in the Presence of Variability";21;1584391203021;
"VGE+:ASE10";"Flexible and Scalable Consistency Checking on Product Line Variability Models";64;1584392285483;
"MCP+:FMSPLE10";"Feature Petri Nets";35;1584393366852;
"KBBK:RV10";"Reducing Configurations to Monitor in a Software Product Line";50;1584394449081;
"ALMK10";"An Algebraic Foundation for Automatic Feature-Based Program Synthesis";60;1584395532034;
"ABFG:iFM10";"A Logical Framework to Deal with Variability";72;1584397696121;
"DJOS10";"Lazy Behavioral Subtyping";31;1584398778727;
"BDH:FoVeOOS10";"Verification of Variable Software: An Experience Report";4;1581845429939;
"SMP:SPLC10";"Avoiding Redundant Testing in Application Engineering";34;1584399859967;
"RSK:FOSD10";"Improving Reuse of Component Families by Generating Component Hierarchies";5;1584445585454;
"AL:iFM10";"Adding Change Impact Analysis to the Formal Verification of C Programs";3;1584446667836;
"STL:TR10";"An Algorithm for Quantifying the Program Variability Induced by Conditional Compilation";4;1584447749725;
"STLS:GPCE10";"Efficient Extraction and Analysis of Preprocessor-Based Variability";46;1584457175795;
"HPSA:SAC10";"Dynamic Contract Layers";28;1584458258123;
"ASLK:FOSD10";"Language-Independent Reference Checking in Software Product Lines";21;1584459340835;
"NNH10";"Principles of Program Analysis";2564;1584460421805;
"SGS:FMCO10";"Compositional Algorithmic Verification of Software Product Lines";28;1584461504040;
"BCH+:ASE10";"Tag and Prune: A Pragmatic Approach to Software Product Line Implementation";36;1581846512007;
"RPRB:SPLASH10";"Emergent Feature Modularization";39;1584693690129;
"BDS:SAC10";"Implementing Software Product Lines Using Traits";46;1584694771704;
"AH:TOPLAS10";"A Calculus for Uniform Feature Composition";52;1584695854260;
"SC10";"A New Eclipse-Based JML Compiler Built Using AST Merging";19;1584696935332;
"PSK+:ICST10";"Automated and Scalable T-Wise Test Case Generation Strategies for Software Product Lines";244;1584698017756;
"RPK:GPCE10";"Automatic Variation-Point Identification in Function-Block-Based Models";54;1584699100321;
"KS:FOSD10";"Patching Product Line Programs";4;1584700182125;
"CIZ:OOPSLA10";"Mostly Modular Compilation of Crosscutting Concerns by Contextual Predicate Dispatch";29;1584701263147;
"BSLWC:ASE10";"Variability Modeling in the Real: A Perspective from the Operating Systems Domain";165;1581847593334;
"OMR:SPLC10";"Automated Incremental Pairwise Testing of Software Product Lines";166;1582315089131;
"K10";"Virtual Separation of Concerns: Toward Preprocessors 2.0";16;1581848676057;
"CHSLR10";"Model Checking Lots of Systems: Efficient Verification of Temporal Properties in Software Product Lines";338;1581849757301;
"AKGL10";"Type Safety for Feature-Oriented Product Lines";138;1582316171943;
"T10";"A Machine-Checked Proof for a Product-Line-Aware Type System";7;1582317254956;
"ASLK:ISSRE10";"Detecting Dependences and Interactions in Feature-Oriented Design";55;1582404502968;
"SBB+:SPLC10";"Delta-Oriented Programming of Software Product Lines";374;1582405586138;
"LAL+:ICSE10";"An Analysis of the Variability in Forty Preprocessor-Based Software Product Lines";294;1582406668451;
"BSRC10";"Automated Analysis of Feature Models 20 Years Later: A Literature Review";1226;1581850838666;
"BBH+09";"Handbook of Satisfiability: Volume 185 Frontiers in Artificial Intelligence and Applications";1659;1580645695829;
"SS:HICSS09";"Challenges in Software Product Line Composition";21;1584683949981;
"SBFF:HICSS09";"Are De-Facto Standards a Useful Guide for Designing Human-Computer Interaction Processes The Case of User Interface Design for Web Based B2C Product Configurators";13;1581851920719;
"OG:ICSR09";"Reusable Model-Based Testing";28;1582293453907;
"KFBA:SQJ09";"Extending the Reflexion Method for Consolidating Software Variants into Product Lines";66;1584702344041;
"YHMS:ISSTA09";"Clustering Test Cases to Achieve Effective and Scalable Prioritisation Incorporating Expert Knowledge";180;1582444406867;
"RCK:SCP09";"Comparison and Evaluation of Code Clone Detection Techniques and Tools: A Qualitative Approach";905;1581853003398;
"MKB:JSME09";"An Evaluation of Code Similarity Identification for the Grow-and-Prune Model";65;1582445488840;
"BDGG:NC09";"A Survey on Metaheuristics for Stochastic Combinatorial Optimization";585;1582446571941;
"ACLF:SLE09";"Composing Feature Models";115;1582447654745;
"YD:NaBIC09";"Cuckoo Search via Levy Flights";4486;1582448736311;
"CHTN:ICSE09";"Towards Safer Composition";24;1582449819248;
"ABGF:VaMoS09";"Deontic Logics for Modeling Behavioural Variability - Research in Progress";0;1580165372195;
"ALKKL:FOSD09";"An Orthogonal Access Modifier Model for Feature-Oriented Programming";5;1582451982853;
"MSA:09";"Viewpoint-Oriented Variability Modeling";-2;1582453064787;
"WCR:SPLC09";"A Framework for Constructing Semantically Composable Feature Models from Natural Language Requirements";146;1582454146750;
"RBK:SBLP09";"Optimizing JML Feature Compilation in Ajmlc Using Aspect-Oriented Refactorings";21;1582455228701;
"CMRH09";"Software Dependencies, Work Dependencies, and Their Impact on Failures";267;1580177160760;
"PPR+:SIGMOD09";"A Comparison of Approaches to Large-scale Data Analysis";1397;1582456310929;
"WDF+:CADE09";"SPASS Version 3.5";301;1580178242166;
"MBNJ:ICSE09";"Taming Dynamically Adaptive Systems Using Models and Aspects";269;1582457392551;
"MDHS09";"Producing Wrong Data Without Doing Anything Obviously Wrong!";318;1580179323240;
"C09";"How NOT to Review a Paper: The Tools and Techniques of the Adversarial Reviewer";12;1581854085269;
"MFC+09";"Programs That Test Themselves";103;1582458475378;
"MA:SPLC09";"Gathering Current Knowledge About Quality Evaluation in Software Product Lines";33;1582459556579;
"TRC:VaMoS09";"Abductive Reasoning and Automated Analysis of Feature Models: How are They Connected";63;1581855167730;
"TSS+:FOSD09";"Dead or Alive: Finding Zombie Features in the Linux Kernel";54;1581856249586;
"DCB09";"Fitting the Pieces Together: A Machine-Checked Model of Safe Composition";75;1581857331657;
"useDCB09";"A Machine-Checked Model of Safe Composition";44;1582460638177;
"MWC:SPLC09";"SAT-Based Analysis of Feature Models is Easy";305;1582461720634;
"KAR+:SPLC09";"On the Impact of the Optional Feature Problem: Analysis and Case Studies";104;1581858412431;
"H:FOSD09";"Towards Systematic Ensuring Well-Formedness of Software Product Lines";42;1582462802651;
"BJS:VaMoS09";"A Design of a Configurable Feature Model Configurator";48;1582487103483;
"M09";"Efficient Reasoning Techniques for Large Scale Feature Models";86;1582489267146;
"HM:FOSD09";"An Extension for Feature Algebra";6;1582490349035;
"KBK:GPCE09";"Safe Composition of Non-Monotonic Features";33;1582520783199;
"MBC:OOPSLA09";"S.P.L.O.T.: Software Product Lines Online Tools";399;1581859493884;
"LPT09";"Model Checking of Domain Artifacts in Product Line Engineering";156;1582523569192;
"WDS09";"Selecting Highly Optimal Architectural Feature Sets with Filtered Cartesian Flattening";146;1582524652495;
"KA:JOT09";"Virtual Separation of Concerns - A Second Chance for Preprocessors";117;1583878579668;
"AK09";"An Overview of Feature-Oriented Software Development";472;1582525736996;
"useAKL13";"FeatureHouse: Language-Independent, Automated Software Composition";269;1581860576117;
"KAK:GPCE09";"A Model of Refactoring Physically and Virtually Separated Features";77;1580180405765;
"R09";"Alternative Features in Colored Featherweight Java";5;1580185139962;
"F09b";"Formalization and Type-Soundness Proof for Featherweight Java in Coq";-2;1580186222627;
"F09";"Language Facilities for the Deployment of Reusable Aspects";6;1580187304568;
"AKGL09";"Type-Safe Feature-Oriented Product Lines";-2;1580188385825;
"JDHW09";"Do Code Clones Matter";452;1580202700270;
"TBK:ICSE09";"Reasoning about Edits to Feature Models";380;1584959382916;
"KTS+:ICSE09";"FeatureIDE: A Tool Framework for Feature-Oriented Software Development";238;1581861758956;
"HMO+:SPLC08";"Adding Standardized Variability to Domain Specific Languages";243;1580646778518;
"K:ICSM08";"Frontiers of Software Clone Management";78;1584981039965;
"HHPS:Computer08";"Dynamic Software Product Lines";448;1583917120540;
"LS:JAR08";"Algorithms for Computing Minimal Unsatisfiable Subsets of Constraints";326;1584376058655;
"MBKM:CSMR08";"Supporting the Grow-and-Prune Model in Software Product Lines Evolution Using Clone Detection";74;1582294534554;
"AT:ISSRE08";"Automated Generation of Pointcut Mutants for Testing Pointcuts in AspectJ Programs";48;1582526819503;
"DKN+:WCRE08";"Variant Comparison - A Technique for Visualizing Software Variants";10;1582527905582;
"HSW:VISPLE08";"On Controlled Visualisations in Software Product Line Engineering";37;1582528989181;
"KKB:GPCE08";"On the Modularity of Feature Interactions";47;1582530072588;
"P:ABZ08";"The Composition of Event-B Models";38;1582531166746;
"SG08";"Verified Software: Theories, Tools, Experiments";-2;1581862838805;
"BTC:ICECCS08";"On Extracting Tests from a Testable Model in the Context of Domain Engineering";13;1582532248201;
"LMN:SPLC08";"An Approach for Developing Service Oriented Product Lines";71;1582541893706;
"CDS:TSE08";"Constructing Interaction Test Suites for Highly-Configurable Systems in the Presence of Constraints: A Greedy Approach";299;1581868498803;
"ESB08";"Quality-Aware Software Product Line Engineering";29;1582542975943;
"ENC+:ICSE08";"Evolving Software Product Lines with Aspects: An Empirical Study on Design Stability";436;1581870695805;
"JCP08";"Reporting Experiments in Software Engineering";312;1582544057614;
"HKL+08";"Parallelizing Query Optimization";58;1582547821549;
"L:BSD08";"LLVM and Clang: Next Generation Compiler Technology";194;1581871811384;
"AHM+08";"Using Static Analysis to Find Bugs";419;1582548902683;
"HH:FM08";"Towards Consistent Specifications of Product Families";24;1582549983876;
"RSL+:SAVCBS08";"JML and Aspects: The Benefits of Instrumenting JML Features with AspectJ";7;1581872917972;
"TBD+08";"Automated Error Analysis for the Agilization of Feature Modeling";181;1580203781193;
"hall-of-fame";"The Product Line Hall of Fame";39;1582672654827;
"GLS08";"Modeling and Model Checking Software Product Lines";176;1582673738412;
"FG:SPLC08";"Formal Modeling for Product Families Engineering";113;1582674820409;
"AKL:GPCE08";"Feature Featherweight Java: A Calculus for Feature-Oriented Programming and Stepwise Refinement";78;1581874001751;
"ALS:TSE08";"Aspectual Feature Modules";196;1580204863407;
"AMG08";"Contracts for Aspect-Oriented Design";12;1582675903267;
"RLCS08";"A JML Compiler Based on AspectJ";11;1582676985677;
"KARL:TOOLS08";"A Multiparadigm Study of Crosscutting Modularity in Design Patterns";6;1582743045308;
"SKRKS:VaMoS08";"Integrated Product Line Model for Semi-Automated Product Derivation Using Non-Functional Properties";35;1582744127138;
"SRKKS:APSEC08";"Measuring Non-Functional Properties in Software Product Lines for Product Derivation";47;1581875083960;
"BB08";"Modularizing Theorems for Software Product Lines: The Jbook Case Study";38;1581876667841;
"HKW:ICSE08";"FeatureMapper: Mapping Features to Models";223;1581877756444;
"SSP08";"The Linux Kernel Configurator as a Feature Modeling Tool";35;1582745209575;
"ACPPW08";"Engineering Formal Metatheory";229;1582748445340;
"JKB08";"Formal Methods in Software Product Lines: Concepts, Survey, and Guidelines";10;1581878860055;
"KTA08";"Visualizing Software Product Line Variabilities in Source Code";80;1582797612067;
"KAK08";"Granularity in Software Product Lines";538;1582798693519;
"MWCC08";"Efficient Compilation Techniques for Large Scale Feature Models";139;1582799774273;
"PS:ASE08";"Configuration Lifting: Verification Meets Software Configuration";94;1581889992275;
"KA08";"Type-Checking Software Product Lines-A Formal Approach";128;1582801937090;
"T08";"Reasoning about Feature Model Edits";5;1582803019840;
"WSB+:SPLC08";"Automated Diagnosis of Product-Line Configuration Errors in Feature Models";168;1584703426484;
"AL08";"Superimposition: A Language-Independent Approach to Software Composition";100;1581891075716;
"MVS:ISSTA07";"Automating Component-Based System Assembly";46;1580205945579;
"JDB:SPLC07";"Minimally Invasive Migration to Software Product Lines";50;1582556471095;
"FW:WMA07";"Mutant Minimization for Model-Checker Based Test-Case Generation";25;1582557554196;
"BCU:FMOODS07";"Specification of Timed EFSM Fault Models in SDL";33;1582558635399;
"BC:CGEC07";"One-test-at-a-time Heuristic Search for Interaction Test Suites";105;1582559717568;
"DHG:ICECCS07";"A Formal Contract Language for Plugin-Based Software Engineering";18;1580207027335;
"LL:DV07";"Software Engineering: Grundlagen, Menschen, Prozesse, Techniken";202;1581892158333;
"YH:ISSTA07";"Pareto Efficient Multi-objective Test Case Selection";352;1582560799398;
"RW:REJ07";"Multi-Level Feature Trees: A Pragmatic Approach to Managing Highly Complex Product Families";75;1581893240074;
"UGKB:ESEC07";"A Specification-Based Approach to Testing Software Product Lines";16;1582561882190;
"LK+:ECBS07";"IPOG: A General Strategy for T-Way Software Testing";316;1581893345171;
"NCB+SEI07";"A Framework for Software Product Line Practice, Version 5.0";126;1582569458061;
"CDS:ISSTA07";"Interaction Testing of Highly-configurable Systems in the Presence of Constraints";246;1581894427069;
"CDS:MUTATION07";"Exploiting Constraint Solving History to Construct Interaction Test Suites";39;1581921766702;
"BHJM:STTT07";"The Software Model Checker Blast: Applications to Software Engineering";685;1581922849845;
"M:ICFI07";"Quality Issues in Software Product Lines: Feature Interactions and Beyond (Invited Talk)";1;1581923932505;
"JWEG:MODELS07";"Model Composition in Product Lines and Feature Interaction Detection Using Critical Pair Analysis";180;1582574868374;
"LNW:ESOP07";"Modal IO Automata for Interface and Product Line Theories";287;1582575951144;
"LM:ICSE07";"Information Hiding and Visibility in Interface Specifications";41;1582577032495;
"KAB:SPLC07";"A Case Study Implementing Features Using AspectJ";253;1582578115696;
"W:AOSD07";"Aspect-Oriented Design Principles: Lessons from Object-Oriented Design";25;1581975089983;
"AGDS07";"Evaluating Pair Programming with Respect to System Complexity and Programmer Expertise";303;1580208110351;
"L07";"Survey of Product-Line Verification and Validation Techniques";8;1582579195564;
"FM07";"The WhyKrakatoaCaduceus Platform for Deductive Program Verification";450;1582580276923;
"LDL07";"Safety Analysis of Software Product Lines Using State-Based Modeling";111;1582581360156;
"P:REFSQ07";"Towards Feature-Oriented Specification and Development with Event-B";31;1582581725803;
"A07";"The Role of Features and Aspects in Software Development";60;1582582807323;
"BHS07";"Verification of Object-Oriented Software: The KeY Approach";704;1581976171139;
"SSSPS:OSSPL07";"Is the Linux Kernel a Software Product Line";74;1582583889050;
"BSTRC:VaMoS07";"FAMA: Tooling a Framework for the Automated Analysis of Feature Models";246;1581977254280;
"HZS:AOSD07";"cJ: Enhancing Java with Safe Type Conditions";45;1582006092913;
"RC07";"A Survey on Software Clone Detection Research";691;1584704508791;
"SNOPRSS07";"Ott: Effective Tool Support for the Working Semanticist";150;1582007175136;
"SSP07";"The Java Module System: Core Design and Semantic Definition";88;1582008258226;
"MHPSS:RE07";"Disambiguating the Documentation of Variability in Software Product Lines: A Separation of Concerns, Formalization and Automated Analysis";281;1582009339679;
"LSR07";"Software Product Lines in Action: The Best Industrial Practice in Product Line Engineering";920;1582014478295;
"K07";"Aspect-Oriented Refactoring of Berkeley DB";18;1584705590165;
"B07";"On the Automated Analysis of Software Product Lines Using Feature Models - A Framework for Developing Automated Tool Support";4;1580209192373;
"TBKC07";"Safe Composition of Product Lines";278;1584706671491;
"useALMK10";"An Algebra for Feature-Oriented Software Development";40;1584707754441;
"CW07";"Feature Diagrams and Logics: There and Back Again";382;1582016640990;
"JK07";"Reasoning about Feature Models in Higher-Order Logic";76;1584709918881;
"SHTB07";"Generic Semantics of Feature Diagrams";446;1580210273424;
"FS06";"Product Information Management for Mass Customization: Connecting Customer, Front-Office and Back-Office for Fast and Efficient Customization";177;1582017722407;
"LST+:SIGOPS06";"A Quantitative Analysis of Aspects in the eCos Kernel";140;1583918201639;
"DL:AUSE06";"PLFaultCAT: A Product-Line Software Fault Tree Analysis Tool";56;1582018804721;
"D:QSIC06";"Quality Assessment of Mutation Operators Dedicated for C Programs";58;1584712083006;
"UL06";"Practical Model-Based Testing: A Tools Approach";1497;1582019886527;
"SHT:RE06";"Feature Diagrams: A Survey and a Formal Semantics";522;1582020967834;
"WSM+:ISSTA06";"Time-Aware Test Suite Prioritization";381;1584764325864;
"DNS+:TOPLAS06";"Traits: A Mechanism for Fine-grained Reuse";303;1582022048525;
"KC:SPLC06";"New Methods in Software Product Line Development";102;1584867472108;
"NTJ06";"System Testing of Product Lines: From Requirements to Test Cases";45;1582023129792;
"CDS:ROSATEA06";"Coverage and Adequacy in Software Product Line Testing";145;1580238668803;
"GSS+06";"Modular Software Design with Crosscutting Interfaces";311;1580211354744;
"ALSU06";"Compilers: Principles, Techniques, and Tools (2nd Edition)";-2;1582024211377;
"LBL:ICSE06";"Feature Oriented Refactoring of Legacy Applications";270;1584956137642;
"SUST:AOAsia06";"An Extensible Contract Verifier for AspectJ";16;1584957219501;
"RRDH06";"Checking JML Specifications Using an Extensible Software Model Checking Framework";27;1584960463805;
"AGMO06";"An Overview of CaesarJ";330;1584961568550;
"LC06";"Design by Contract with JML";214;1580212437059;
"FUB:ROSATEA06";"A Foundation for Behavioural Conformance in Software Product Line Architectures";164;1584962650749;
"BBC+:FMCO06";"JACK: A Tool for Validation of Security and Behaviour of Java Applications";63;1582025291949;
"F06";"Five Misunderstandings About Case-Study Research";14989;1584963732762;
"CM06";"Feature Interaction Detection by Pairwise Analysis of LTL Properties-A Case Study";44;1584964815515;
"KN06";"Formal Verification and Software Product Lines";46;1584968060095;
"H:OOPSLA06";"Eliminating Distinctions of Class: Using Prototypes to Model Virtual Classes";28;1582026373953;
"K06";"Aspect Categories and Classes of Temporal Properties";114;1584969141113;
"LBR06";"Preliminary Design of JML: A Behavioral Interface Specification Language for Java";1035;1582027456740;
"ALS:ICSE06";"Aspectual Mixin Layers: Aspects and Features in Concert";168;1582028538310;
"B:GTTSE06";"A Tutorial on Feature Oriented Programming and the AHEAD Tool Suite";127;1584970222823;
